name,occupation,count,birthtime,birthplace,location,point,chart
Tippi_Hedren,r_activists,0,"['1930', 1, '19', '06:35']","New Ulm, Minnesota, United States","New Ulm, Brown County, Minnesota, 56073, United States of America","('44n314', '94w4614')",<flatlib.chart.Chart object at 0x62423e198>
Fran_Drescher,r_activists,1,"['1957', 9, '30', '07:28']","New York, New York, United States","New York, United States of America","('40n7127', '74w006')",<flatlib.chart.Chart object at 0x624dc87b8>
Mos_Def,r_activists,2,"['1973', 12, '11']","New York, New York, United States","New York, United States of America","('40n7127', '74w006')",<flatlib.chart.Chart object at 0x62423e898>
Bono,r_activists,3,"['1960', 5, '10', '02:00']","Dublin, Ireland","Dublin, County Dublin, Leinster, Ireland","('53n3498', '6w2603')",<flatlib.chart.Chart object at 0x624792748>
Garry_Kasparov,r_activists,4,"['1963', 4, '13', '23:45']","Baku, Azerbaijan","Baku, Bakı İnzibati Ərazisi, Azerbaijan","('40n3754', '49e8327')",<flatlib.chart.Chart object at 0x624dc8898>
Julian_Assange,r_activists,5,"['1971', 7, '3', '15:00']","Townsville, Queensland, Australia","Townsville, Queensland, 4810, Australia","('19s2569', '146e824')",<flatlib.chart.Chart object at 0x624eb21d0>
Ulrike_Meinhof,r_activists,6,"['1934', 10, '7', '05:30']","Oldenburg, Germany","Oldenburg, Niedersachsen, 26122, Deutschland","('53n139', '8e2146')",<flatlib.chart.Chart object at 0x624eb2a20>
Zack_De_La_Rocha,r_activists,7,"['1970', 1, '12']","Long Beach, California, United States","Long Beach, Los Angeles County, California, United States of America","('33n769', '118w1916')",<flatlib.chart.Chart object at 0x6255b0860>
Mahatma_Gandhi,r_activists,8,"['1869', 10, '2', '07:08']","Porbandar, India","Porbandar, Porbandar Taluka, Porbandar District, Gujarat, 360500, India","('21n6409', '69e611')",<flatlib.chart.Chart object at 0x624aefbe0>
Eleanor_Roosevelt,r_activists,9,"['1884', 10, '11', '11:00']","New York, New York, United States","New York, United States of America","('40n7127', '74w006')",<flatlib.chart.Chart object at 0x624aef668>
Andreas_Baader,r_activists,10,"['1943', 5, '6', '00:05']","Munich, Germany","München, Bayern, Deutschland","('48n1371', '11e5754')",<flatlib.chart.Chart object at 0x624aefcf8>
Terry_Fox,r_activists,11,"['1958', 7, '28', '07:30']","Winnipeg, Manitoba, Canada","Winnipeg, Winnipeg (city), Manitoba, Canada","('49n8955', '97w1385')",<flatlib.chart.Chart object at 0x624823470>
Gavrillo_Princip,r_activists,12,"['1894', 7, '25', '16:40']","Obljaj, Bosnia and Herzegovina","Obljaj, Град Требиње / Grad Trebinje, Република Српска / Republika Srpska, Bosna i Hercegovina","('42n7327', '18e4202')",<flatlib.chart.Chart object at 0x624823208>
Daniel_Defert,r_activists,14,"['1937', 9, '10']",France,France,"('46n6034', '1e8883')",<flatlib.chart.Chart object at 0x62575af98>
Amal_Clooney,r_activists,15,"['1978', 2, '3']","Beirut, Lebanon","بيروت, رأس بيروت, محافظة بيروت, لبنان  Lebanon","('33n8959', '35e4784')",<flatlib.chart.Chart object at 0x624abfc18>
Taya_Kyle,r_activists,16,"['1974', 9, '4']",United States,United States,"('39n7837', '100w4459')",<flatlib.chart.Chart object at 0x628472e48>
Aaron_Swartz,r_activists,17,"['1986', 11, '8']","Chicago, Illinois, United States","Chicago, Cook County, Illinois, United States of America","('41n8756', '87w6244')",<flatlib.chart.Chart object at 0x628472630>
Greta_Thunberg,r_activists,19,"['2003', 1, '3']","Stockholm, Sweden","Stockholm, Stockholms kommun, Stockholms län, Svealand, 111 29, Sverige","('59n3251', '18e0711')",<flatlib.chart.Chart object at 0x628472748>
Margaret_Atwood,r_activists,21,"['1939', 11, '18', '17:00']","Ottawa, Ontario, Canada","Ottawa, Eastern Ontario, Ontario, K1P 1J1, Canada","('45n4211', '75w6903')",<flatlib.chart.Chart object at 0x627a1cf60>
Ronan_Farrow,r_activists,22,"['1987', 12, '19', '10:49']","New York, New York, United States","New York, United States of America","('40n7127', '74w006')",<flatlib.chart.Chart object at 0x62738ae80>
Silvia_Baraldini,r_activists,24,"['1947', 12, '12', '23:30']","Rome, Italy","Roma, Roma Capitale, Italia","('41n8933', '12e4829')",<flatlib.chart.Chart object at 0x62738add8>
Frigide_Barjot,r_activists,25,"['1962', 9, '25', '11:35']","Boulogne-Billancourt, France","Boulogne-Billancourt, Hauts-de-Seine, Île-de-France, France métropolitaine, 92100, France","('48n8357', '2e2402')",<flatlib.chart.Chart object at 0x627a1c6a0>
Rosemary_Barnes,r_activists,26,"['1946', 5, '16', '12:00']","Nottingham, England, United Kingdom","City of Nottingham, East Midlands, England, United Kingdom","('52n9534', '1w1496')",<flatlib.chart.Chart object at 0x6272e9e48>
Donna_Brazile,r_activists,27,"['1959', 12, '15', '08:53']","New Orleans, Louisiana, United States","New Orleans, Orleans Parish, Louisiana, United States of America","('29n9499', '90w0701')",<flatlib.chart.Chart object at 0x6242e9400>
César_Chávez,r_activists,28,"['1927', 3, '31', '15:00']","Yuma, Arizona, United States","Yuma, Yuma County, Arizona, 85364, United States of America","('32n6927', '114w6276')",<flatlib.chart.Chart object at 0x6242e9198>
Eldridge_Cleaver,r_activists,29,"['1935', 8, '31', '02:15']","Little Rock, Arkansas, United States","Little Rock, Arkansas, United States of America","('34n7465', '92w2896')",<flatlib.chart.Chart object at 0x624dcedd8>
Rachel_Corrie,r_activists,30,"['1979', 4, '10', '03:15']","Olympia, Washington, United States","Olympia, Thurston County, Washington, United States of America","('47n0451', '122w895')",<flatlib.chart.Chart object at 0x624dce5c0>
Kerry_Kennedy_Cuomo,r_activists,31,"['1959', 9, '8', '12:55']","Boston, Massachusetts, United States","Boston, Suffolk County, Massachusetts, United States of America","('42n3603', '71w0583')",<flatlib.chart.Chart object at 0x6248ad438>
Adelle_Davis,r_activists,32,"['1904', 2, '25', '03:00']","Lizton, Indiana, United States","Lizton, Hendricks County, Indiana, United States of America","('39n8867', '86w5433')",<flatlib.chart.Chart object at 0x10e6dafd0>
Rennie_Davis,r_activists,33,"['1940', 5, '23', '07:40']","Lansing, Michigan, United States","Lansing, Ingham County, Michigan, United States of America","('42n7338', '84w5554')",<flatlib.chart.Chart object at 0x624751b00>
Bessie_Delany,r_activists,34,"['1891', 9, '3', '09:30']","Raleigh, North Carolina, United States","Raleigh, Wake County, North Carolina, 27603-1300, United States of America","('35n7804', '78w6391')",<flatlib.chart.Chart object at 0x624751f28>
Sadie_Delany,r_activists,35,"['1889', 9, '19', '19:30']","Lynch Station, Virginia, United States","Lynch Station, Campbell County, Virginia, 24517, United States of America","('37n1463', '79w3009')",<flatlib.chart.Chart object at 0x624e4f630>
Doris_Duke,r_activists,36,"['1912', 11, '22', '07:30']","New York, New York, United States","New York, United States of America","('40n7127', '74w006')",<flatlib.chart.Chart object at 0x623450208>
Marc_Emery,r_activists,37,"['1958', 2, '13', '10:35']","London, Ontario, Canada","London, Southwestern Ontario, Ontario, N6A 1G4, Canada","('42n9837', '81w2496')",<flatlib.chart.Chart object at 0x6234505c0>
Mary_Fisher,r_activists,38,"['1948', 4, '6', '12:00']","Louisville, Kentucky, United States","Louisville, Jefferson County, Kentucky, United States of America","('38n2542', '85w7594')",<flatlib.chart.Chart object at 0x62458f6a0>
Margaret_Formby,r_activists,39,"['1929', 7, '12', '02:20']","Van Horn, Texas, United States","Van Horn, Culberson County, Texas, 79855, United States of America","('31n038', '104w8304')",<flatlib.chart.Chart object at 0x62458f908>
Betty_Friedan,r_activists,40,"['1921', 2, '4', '04:00']","Peoria, Illinois, United States","Peoria, Peoria County, Illinois, 61602-6199, United States of America","('40n6939', '89w5891')",<flatlib.chart.Chart object at 0x626eef048>
Harry_Hay,r_activists,43,"['1912', 4, '7', '07:00']","Worthing, England, United Kingdom","Worthing, West Sussex, South East, England, United Kingdom","('50n8117', '0w3704')",<flatlib.chart.Chart object at 0x626a04ba8>
Léon_Jouhaux,r_activists,45,"['1879', 7, '1', '01:00']","Paris, France","Paris, Île-de-France, France métropolitaine, France","('48n8567', '2e3515')",<flatlib.chart.Chart object at 0x626a04438>
Bruce_Kent,r_activists,47,"['1929', 6, '22', '17:30']","Blackheath, England, United Kingdom","Blackheath, London Borough of Lewisham, London, Greater London, England, SE3 0BU, United Kingdom","('51n4663', '0e0086')",<flatlib.chart.Chart object at 0x626eef550>
Morris_Kight,r_activists,48,"['1919', 11, '19', '08:00']","Comanche, Texas, United States","Comanche County, Texas, United States of America","('31n913', '98w5274')",<flatlib.chart.Chart object at 0x6270b06a0>
Anna_Kingsford,r_activists,49,"['1846', 9, '16', '17:00']","Essex, England, United Kingdom","Essex, East of England, England, United Kingdom","('51n7705', '0e4647')",<flatlib.chart.Chart object at 0x6278bee80>
Frances_Moore_Lappé,r_activists,50,"['1944', 2, '10', '02:00']","Pendleton, Oregon, United States","Pendleton, Umatilla County, Oregon, 97801, United States of America","('45n6721', '118w7886')",<flatlib.chart.Chart object at 0x6278be898>
Mavis_Leno,r_activists,51,"['1946', 9, '5', '17:03']","San Francisco, California, United States","San Francisco, San Francisco City and County, California, United States of America","('37n779', '122w4199')",<flatlib.chart.Chart object at 0x625f51be0>
Audre_Lorde,r_activists,52,"['1934', 2, '18', '21:00']","New York, New York, United States","New York, United States of America","('40n7127', '74w006')",<flatlib.chart.Chart object at 0x625df6b38>
Dan_Mathews,r_activists,53,"['1964', 10, '25', '01:15']","Newport Beach, California, United States","Newport Beach, Orange County, California, United States of America","('33n617', '117w9294')",<flatlib.chart.Chart object at 0x625df6e48>
Kate_Millett,r_activists,55,"['1934', 9, '14', '19:40']","Saint Paul, Minnesota, United States","St. Paul, Ramsey County, Minnesota, United States of America","('44n9504', '93w1015')",<flatlib.chart.Chart object at 0x625df6208>
Jessica_Mitford,r_activists,56,"['1917', 9, '11', '04:30']","Gloucester, England, United Kingdom","Gloucester, Gloucestershire, South West England, England, United Kingdom","('51n8654', '2w2458')",<flatlib.chart.Chart object at 0x6243bf240>
Ralph_Nader,r_activists,57,"['1934', 2, '27', '04:52']","Winchester, Connecticut, United States","The Winchester, 144, Wolcott Avenue, West Torrington, Torrington, Litchfield County, Connecticut, 06790, United States of America","('41n8095', '73w1352')",<flatlib.chart.Chart object at 0x6248a8080>
Alexei_Nawalny,r_activists,58,"['1976', 6, '4', '13:30']","Butyn', Russia","Бутынь, Одинцовский городской округ, Московская область, Центральный федеральный округ, 143043, Россия","('55n5986', '36e9423')",<flatlib.chart.Chart object at 0x6243bf828>
Madalyn_Murray_O'Hair,r_activists,60,"['1919', 4, '13', '09:00']","Pittsburgh, Pennsylvania, United States","Pittsburgh, Allegheny County, Pennsylvania, 15262, United States of America","('40n4417', '79w9901')",<flatlib.chart.Chart object at 0x625444ba8>
Diana_Oughton,r_activists,61,"['1942', 1, '26', '07:04']","Dwight, Illinois, United States","Dwight, Livingston County, Illinois, United States of America","('41n0945', '88w4251')",<flatlib.chart.Chart object at 0x6248aa550>
Emmeline_Pankhurst,r_activists,62,"['1858', 7, '14', '21:30']","Manchester, England, United Kingdom","Manchester, Greater Manchester, North West England, England, United Kingdom","('53n4795', '2w2451')",<flatlib.chart.Chart object at 0x624d509b0>
Rosa_Parks,r_activists,63,"['1913', 2, '4', '05:12']","Tuskegee, Alabama, United States","Tuskegee, Macon County, Alabama, United States of America","('32n424', '85w6916')",<flatlib.chart.Chart object at 0x624d50978>
James_Reeb,r_activists,66,"['1927', 1, '1', '00:15']","Wichita, Kansas, United States","Wichita, Sedgwick County, Kansas, United States of America","('37n6922', '97w3375')",<flatlib.chart.Chart object at 0x624d50940>
Sylvia_Rivera,r_activists,67,"['1951', 7, '2', '02:30']","New York, New York, United States","New York, United States of America","('40n7127', '74w006')",<flatlib.chart.Chart object at 0x624b109e8>
Jose_Rizal,r_activists,68,"['1861', 6, '19', '23:30']","Calamba, Philippines","Calamba, Laguna, Calabarzon, 4027, Philippines","('14n2143', '121e1676')",<flatlib.chart.Chart object at 0x6245de128>
Jerry_Rubin,r_activists,69,"['1938', 7, '14', '10:34']","Cincinnati, Ohio, United States","Cincinnati, Hamilton County, Ohio, United States of America","('39n1015', '84w5125')",<flatlib.chart.Chart object at 0x6245deba8>
Vinayak_Damodar_Savarkar,r_activists,70,"['1883', 5, '28', '22:00']","Deolali, India","Deolali, Nashik, Maharashtra, 422400, India","('19n9378', '73e8565')",<flatlib.chart.Chart object at 0x6249d6f60>
Phyllis_Schlafly,r_activists,71,"['1924', 8, '15', '23:25']","St. Louis, Missouri, United States","City of Saint Louis, Missouri, United States of America","('38n653', '90w2411')",<flatlib.chart.Chart object at 0x6249d69e8>
Bobby_Seale,r_activists,72,"['1936', 10, '22', '22:30']","Dallas, Texas, United States","Dallas, Dallas County, Texas, United States of America","('32n7763', '96w7969')",<flatlib.chart.Chart object at 0x6233af860>
Al_Sharpton,r_activists,73,"['1954', 10, '3', '22:05']","New York, New York, United States","New York, United States of America","('40n7127', '74w006')",<flatlib.chart.Chart object at 0x10ef49b70>
Casey_Sheehan,r_activists,74,"['1979', 5, '29', '01:01']","Bellflower, California, United States","Bellflower, Los Angeles County, California, 90706, United States of America","('33n8826', '118w1168')",<flatlib.chart.Chart object at 0x62533def0>
Karen_Silkwood,r_activists,76,"['1946', 2, '19', '21:50']","Longview, Texas, United States","Longview, Gregg County, Texas, United States of America","('32n5007', '94w7405')",<flatlib.chart.Chart object at 0x62533d390>
Curtis_Sliwa,r_activists,77,"['1954', 3, '26', '23:27']","New York, New York, United States","New York, United States of America","('40n7127', '74w006')",<flatlib.chart.Chart object at 0x6243eed68>
Elizabeth_Smart,r_activists,78,"['1987', 11, '3', '13:03']","Salt Lake City, Utah, United States","Salt Lake City, Utah, United States of America","('40n7596', '111w8868')",<flatlib.chart.Chart object at 0x6243ee198>
Eleanor_Marie_Smeal,r_activists,79,"['1939', 7, '30', '16:38']","Ashtabula, Ohio, United States","Ashtabula County, Ohio, United States of America","('41n7167', '80w7495')",<flatlib.chart.Chart object at 0x62441e9b0>
Gloria_Steinem,r_activists,80,"['1934', 3, '25', '22:00']","Toledo, Ohio, United States","Toledo, Lucas County, Ohio, United States of America","('41n6787', '83w5127')",<flatlib.chart.Chart object at 0x62441edd8>
Helene_Stöcker,r_activists,81,"['1869', 11, '13', '03:00']","Wuppertal, Germany","Wuppertal, Nordrhein-Westfalen, 42285, Deutschland","('51n264', '7e178')",<flatlib.chart.Chart object at 0x62441e438>
Peter_Tatchell,r_activists,82,"['1952', 1, '25', '02:30']","Melbourne, Victoria, Australia","City of Melbourne, Victoria, Australia","('37s8142', '144e9632')",<flatlib.chart.Chart object at 0x6248a55c0>
Bal_Gangadhar_Tilak,r_activists,83,"['1856', 7, '23', '06:26']","Ratnagiri, India","Ratnagiri, Maharashtra, India","('17n2826', '73e457')",<flatlib.chart.Chart object at 0x62480c550>
Franz_Weber,r_activists,85,"['1927', 7, '27', '09:00']","Basel, Switzerland","Basel, Basel-Stadt, Switzerland","('47n5581', '7e5878')",<flatlib.chart.Chart object at 0x62480ca58>
Caetano_Veloso,r_activists,86,"['1942', 8, '7', '21:00']","Santo Amaro, Brazil","Santo Amaro, Microrregião de Santo Antônio de Jesus, Mesorregião do Recôncavo baiano, Bahia, Região Nordeste, Brasil","('12s552', '38w706')",<flatlib.chart.Chart object at 0x62504fe48>
Reggie_Bannister,r_activists,87,"['1945', 9, '29']","Long Beach, California, United States","Long Beach, Los Angeles County, California, United States of America","('33n769', '118w1916')",<flatlib.chart.Chart object at 0x624ad33c8>
Laurie_Holden,r_activists,88,"['1969', 12, '17']","Los Angeles, California, United States","Los Angeles, Los Angeles County, California, United States of America","('34n0537', '118w2428')",<flatlib.chart.Chart object at 0x624ad3eb8>
Tina_Modotti,r_activists,89,"['1896', 8, '16', '11:00']","Udine, Italy","Udine, UTI del Friuli Centrale, Friuli Venezia Giulia, 33100, Italia","('46n0635', '13e2358')",<flatlib.chart.Chart object at 0x624ad3a20>
David_Walliams,r_activists,91,"['1971', 8, '20', '01:45']","London, England, United Kingdom","London, Greater London, England, SW1A 2DX, United Kingdom","('51n5073', '0w1276')",<flatlib.chart.Chart object at 0x6253a0128>
Erin_Brockovich-Ellis,r_activists,94,"['1960', 6, '22']","Lawrence, Kansas, United States","Lawrence, Douglas County, Kansas, United States of America","('38n9719', '95w2359')",<flatlib.chart.Chart object at 0x6253a05f8>
Dwight_Worker,r_activists,95,"['1946', 9, '17']","Jackson, Iowa, United States","Jackson County, Iowa, United States of America","('42n142', '90w548')",<flatlib.chart.Chart object at 0x624b13e48>
Evo_Morales,r_activists,96,"['1959', 10, '26', '11:00']","Orinoca Canton, Bolivia","Orinoca, Provincia Sud Carangas, Oruro, Bolivia","('18s9675', '67w2597')",<flatlib.chart.Chart object at 0x624b13f60>
Joëlle_Aubron,r_activists,97,"['1959', 6, '28', '14:15']","Neuilly-sur-Seine, France","Neuilly-sur-Seine, Arrondissement de Nanterre, Hauts-de-Seine, Île-de-France, France métropolitaine, 92200, France","('48n8847', '2e2696')",<flatlib.chart.Chart object at 0x624b134a8>
Jean_Danet,r_activists,98,"['1924', 1, '14', '16:00']","Auray, France","Auray, Lorient, Morbihan, Bretagne, France métropolitaine, 56400, France","('47n6664', '2w9834')",<flatlib.chart.Chart object at 0x6242971d0>
Nadine_Gordimer,r_activists,99,"['1923', 11, '20']","Springs, South Africa","Springs, City of Ekurhuleni Metropolitan Municipality, Gauteng, 1559, South Africa","('26s2431', '28e4317')",<flatlib.chart.Chart object at 0x6242977b8>
Ralph_Abernathy,r_activists,101,"['1926', 3, '11', '02:15']","Linden, Alabama, United States","Linden, Marengo County, Alabama, United States of America","('32n3063', '87w7981')",<flatlib.chart.Chart object at 0x6254ee390>
Abigail_Alcott,r_activists,102,"['1800', 10, '8']","Boston, Massachusetts, United States","Boston, Suffolk County, Massachusetts, United States of America","('42n3603', '71w0583')",<flatlib.chart.Chart object at 0x62493a898>
Susan_B._Anthony,r_activists,103,"['1820', 2, '15']","Adams, Massachusetts, United States","Adams, Berkshire County, Massachusetts, 01220, United States of America","('42n627', '73w1155')",<flatlib.chart.Chart object at 0x62493a3c8>
Luc_Barruet,r_activists,104,"['1967', 1, '4', '01:45']","Versailles, France","Versailles, Yvelines, Île-de-France, France métropolitaine, 78000, France","('48n8035', '2e1267')",<flatlib.chart.Chart object at 0x62493aac8>
Andre_Bergeron,r_activists,105,"['1922', 1, '1', '09:00']","Suarce, France","Suarce, Belfort, Territoire-de-Belfort, Bourgogne-Franche-Comté, France métropolitaine, 90100, France","('47n5649', '7e0819')",<flatlib.chart.Chart object at 0x62493a710>
Alain_Bougrain-Dubourg,r_activists,106,"['1948', 8, '17', '15:35']","Paris, France","Paris, Île-de-France, France métropolitaine, France","('48n8567', '2e3515')",<flatlib.chart.Chart object at 0x62573f668>
David_Brower,r_activists,107,"['1912', 7, '1', '13:55']","Berkeley, California, United States","Berkeley, Alameda County, California, United States of America","('37n8708', '122w2729')",<flatlib.chart.Chart object at 0x6279a7cc0>
Patrick_Buisson,r_activists,108,"['1949', 4, '19', '11:10']","Paris, France","Paris, Île-de-France, France métropolitaine, France","('48n8567', '2e3515')",<flatlib.chart.Chart object at 0x6279a7240>
Aldo_Capitini,r_activists,109,"['1899', 12, '23', '23:00']","Perugia, Italy","Perugia, Umbria, Italia","('43n107', '12e403')",<flatlib.chart.Chart object at 0x6279a7400>
Rodney_Croome,r_activists,110,"['1964', 4, '11', '05:15']","Burnie, Tasmania, Australia","Burnie, City of Burnie, Tasmania, 7320, Australia","('41s0524', '145e9064')",<flatlib.chart.Chart object at 0x6273855f8>
Issan_Dorsey,r_activists,112,"['1933', 3, '7', '05:49']","Santa Barbara, California, United States","Santa Barbara, Santa Barbara County, California, United States of America","('34n4221', '119w7027')",<flatlib.chart.Chart object at 0x627385470>
Alain_Escada,r_activists,113,"['1970', 5, '16', '11:15']","Brussels, Belgium","Bruxelles / Brussel, Ville de Bruxelles - Stad Brussel, Région de Bruxelles-Capitale - Brussels Hoofdstedelijk Gewest, België - Belgique - Belgien","('50n8437', '4e3674')",<flatlib.chart.Chart object at 0x624a80dd8>
David_B._Feinberg,r_activists,114,"['1956', 11, '25', '12:34']","Lynn, Massachusetts, United States","Lynn, Essex County, Massachusetts, 01901, United States of America","('42n4668', '70w9495')",<flatlib.chart.Chart object at 0x6272aea90>
Steve_Gaskin,r_activists,115,"['1935', 2, '16', '23:00']","Denver, Colorado, United States","Denver, Denver County, Colorado, United States of America","('39n7392', '104w9849')",<flatlib.chart.Chart object at 0x6272ae0b8>
Alain_Geismar,r_activists,116,"['1939', 7, '17', '20:20']","Paris, France","Paris, Île-de-France, France métropolitaine, France","('48n8567', '2e3515')",<flatlib.chart.Chart object at 0x624a80898>
Buzz_Hargrove,r_activists,117,"['1944', 3, '8', '16:00']","Bath, New Brunswick, Canada","Bath, Kent Parish, Carleton County, New Brunswick, Canada","('46n5119', '67w5944')",<flatlib.chart.Chart object at 0x6246d48d0>
Benjamin_Hooks,r_activists,118,"['1925', 1, '31', '23:30']","Memphis, Tennessee, United States","Memphis, Shelby County, Tennessee, United States of America","('35n149', '90w0516')",<flatlib.chart.Chart object at 0x62664f860>
Steward_Rawlings_Mott,r_activists,121,"['1937', 12, '4', '09:45']","Flint, Michigan, United States","Flint, Genesee County, Michigan, United States of America","('43n0162', '83w69')",<flatlib.chart.Chart object at 0x62664f278>
Rüdiger_Nehberg,r_activists,122,"['1935', 5, '4', '06:31']","Bielefeld, Germany","Bielefeld, Nordrhein-Westfalen, Deutschland","('52n0191', '8e531')",<flatlib.chart.Chart object at 0x624b01e10>
Huey_Newton,r_activists,123,"['1942', 2, '17', '00:30']","Oak Grove, Louisiana, United States","Oak Grove, West Carroll Parish, Louisiana, United States of America","('32n861', '91w3884')",<flatlib.chart.Chart object at 0x6245e2a20>
Mario_Obledo,r_activists,124,"['1932', 4, '9', '00:05']","San Antonio, Texas, United States","San Antonio, Bexar County, Texas, United States of America","('29n4246', '98w4951')",<flatlib.chart.Chart object at 0x6245e2278>
Eugene_F._III_Rivers,r_activists,125,"['1950', 4, '9', '09:02']","Boston, Massachusetts, United States","Boston, Suffolk County, Massachusetts, United States of America","('42n3603', '71w0583')",<flatlib.chart.Chart object at 0x624af3748>
Tony_Russo,r_activists,126,"['1936', 10, '14', '23:15']","Suffolk, Virginia, United States","Suffolk, Suffolk (city), Virginia, 23434, United States of America","('36n7282', '76w5836')",<flatlib.chart.Chart object at 0x624af3630>
Swami_Sivananda,r_activists,127,"['1887', 9, '8', '02:00']","Pattamadai, India","Pattamadai, Cheranmahadevi, Tirunelveli Kattabo, Tamil Nadu, 627453, India","('8n6673', '77e5844')",<flatlib.chart.Chart object at 0x624af27f0>
Reimond_Speelers,r_activists,128,"['1876', 3, '9', '06:00']","Waasmunster, Belgium","Waasmunster, Oost-Vlaanderen, Vlaanderen, 9250, België - Belgique - Belgien","('51n1097', '4e0842')",<flatlib.chart.Chart object at 0x624af2d68>
Pieter-Dirk_Uys,r_activists,129,"['1945', 9, '9', '06:15']","Cape Town, South Africa","Cape Town, City of Cape Town, Western Cape, 8001, South Africa","('33s929', '18e4174')",<flatlib.chart.Chart object at 0x624af22b0>
Cleews_Vellay,r_activists,131,"['1964', 2, '3', '10:25']","Gonesse, France","Gonesse, Sarcelles, Val-d'Oise, Île-de-France, France métropolitaine, 95500, France","('48n9864', '2e4501')",<flatlib.chart.Chart object at 0x6246c33c8>
Horst_Wessel,r_activists,132,"['1907', 10, '9', '19:30']","Bielefeld, Germany","Bielefeld, Nordrhein-Westfalen, Deutschland","('52n0191', '8e531')",<flatlib.chart.Chart object at 0x6246c37b8>
Fred_Zeller,r_activists,134,"['1912', 3, '26', '02:00']","Paris, France","Paris, Île-de-France, France métropolitaine, France","('48n8567', '2e3515')",<flatlib.chart.Chart object at 0x6246f45c0>
Bianca_Jagger,r_activists,136,"['1945', 5, '2']","Managua, Nicaragua","Managua, Managua (Municipio), Departamento de Managua, 10000 (CODIGO MAESTRO), Nicaragua","('12n146', '86w2747')",<flatlib.chart.Chart object at 0x62345b630>
Ryan_White,r_activists,137,"['1971', 12, '6']","Kokomo, Indiana, United States","Kokomo, Howard County, Indiana, United States of America","('40n4864', '86w1336')",<flatlib.chart.Chart object at 0x62345b6a0>
Mickey_Leland,r_activists,138,"['1944', 11, '27']","Lubbock, Texas, United States","Lubbock, Lubbock County, Texas, United States of America","('33n5635', '101w8793')",<flatlib.chart.Chart object at 0x6233b2a58>
Timothy_Conigrave,r_activists,139,"['1959', 11, '19']","Melbourne, Victoria, Australia","City of Melbourne, Victoria, Australia","('37s8142', '144e9632')",<flatlib.chart.Chart object at 0x6233b2e48>
Michael_Kühnen,r_activists,140,"['1955', 6, '21']","Beuel, Germany","Beuel, Bonn-Beuel, Bonn, Nordrhein-Westfalen, 53225, Deutschland","('50n7375', '7e1186')",<flatlib.chart.Chart object at 0x6233b2748>
Fela_Kuti,r_activists,141,"['1938', 10, '15']","Abeokuta, Nigeria","Abeokuta, Abeokuta South, Ogun, Nigeria","('7n161', '3e348')",<flatlib.chart.Chart object at 0x624713208>
