name,occupation,count,birthtime,birthplace,location,point,chart
Simon_Mol,r_activists,142,"['1973', 11, '6']","Buea, Cameroon","Buea, Fako, Sud-Ouest, Cameroon;Cameroun","('4n1568', '9e2316')",<flatlib.chart.Chart object at 0x626d980b8>
Paco_Vidarte,r_activists,143,"['1970', 3, '1']","Seville, Spain","Sevilla, Andalucía, España","('37n3886', '5w9953')",<flatlib.chart.Chart object at 0x626d98fd0>
Lucie_Bittalová,r_activists,144,"['1987', 12, '15']","Valtice, Czech Republic","Valtice, okres Břeclav, Jihomoravský kraj, Jihovýchod, 69142, Česká republika","('48n7409', '16e7555')",<flatlib.chart.Chart object at 0x626d98c18>
John_Perkins,r_activists,147,"['1945', 1, '28', '18:55']","Hanover, New Hampshire, United States","Hanover, Grafton County, New Hampshire, United States of America","('43n7036', '72w2887')",<flatlib.chart.Chart object at 0x6254e5a20>
Paul_Elam,r_activists,149,"['1957', 2, '8']","Houston, Texas, United States","Houston, Harris County, Texas, 77002-5902, United States of America","('29n7589', '95w3677')",<flatlib.chart.Chart object at 0x624462978>
Ashley_Graham,r_activists,150,"['1987', 10, '30']","Lincoln, Nebraska, United States","Lincoln, Lancaster County, Nebraska, 68508, United States of America","('40n8089', '96w7078')",<flatlib.chart.Chart object at 0x6247d69e8>
Josh_Duggar,r_activists,151,"['1988', 3, '3']","Tontitown, Arkansas, United States","Tontitown, Washington County, Arkansas, United States of America","('36n1779', '94w2335')",<flatlib.chart.Chart object at 0x6247d6828>
Robin_Ficker,r_activists,152,"['1943', 4, '5']","Takoma Park, Maryland, United States","Takoma Park, Montgomery County, Maryland, 20912, United States of America","('38n9779', '77w0075')",<flatlib.chart.Chart object at 0x62422b470>
Olympe_de_Gouges,r_activists,153,"['1748', 5, '7']","Montauban, France","Montauban, Tarn-et-Garonne, Occitanie, France métropolitaine, 82000, France","('44n0176', '1e355')",<flatlib.chart.Chart object at 0x62422b4a8>
