name,occupation,count,birthtime,birthplace,location,point,chart
Pierre_Jovanovic,r_journalists-publicists,453,"['1960', 1, '3', '08:25']","Belgrade, Serbia","Београд, Град Београд, Централна Србија, 11000, Србија (Serbia)","('44n8178', '20e4569')",<flatlib.chart.Chart object at 0x6254d8908>
Francesco_Jovine,r_journalists-publicists,454,"['1902', 10, '9', '02:05']","Campobasso, Italy","Campobasso, Molise, Italia","('41n7173', '14e8262')",<flatlib.chart.Chart object at 0x6254d5eb8>
James_H._Karales,r_journalists-publicists,455,"['1930', 7, '15', '18:50']","Canton, Ohio, United States","Canton, Stark County, Ohio, United States of America","('40n799', '81w3784')",<flatlib.chart.Chart object at 0x6254cb6a0>
David_Kennerly,r_journalists-publicists,458,"['1947', 3, '9', '20:05']","Roseburg, Oregon, United States","Roseburg, Douglas County, Oregon, United States of America","('43n2165', '123w3417')",<flatlib.chart.Chart object at 0x6254cbef0>
Henri_Knap,r_journalists-publicists,459,"['1911', 2, '8', '16:00']","Amsterdam, Netherlands","Amsterdam, Noord-Holland, Nederland","('52n3728', '4e8936')",<flatlib.chart.Chart object at 0x6254cbf60>
Theo_Koomen,r_journalists-publicists,460,"['1929', 5, '20', '05:00']","Medemblik, Netherlands","Medemblik, Noord-Holland, Nederland","('52n7687', '5e1062')",<flatlib.chart.Chart object at 0x6254b4e80>
Erich_Kuby,r_journalists-publicists,462,"['1910', 6, '28', '06:30']","Baden-Baden, Germany","Baden-Baden, Baden-Württemberg, 76530, Deutschland","('48n7581', '8e2415')",<flatlib.chart.Chart object at 0x6254b4898>
Erich_Kuttner,r_journalists-publicists,463,"['1887', 5, '27', '06:00']","Berlin, Germany","Berlin, Deutschland","('52n517', '13e3889')",<flatlib.chart.Chart object at 0x6254bda58>
Jean_Lacroix,r_journalists-publicists,464,"['1900', 12, '26', '11:00']","Lyon, France","Lyon, Métropole de Lyon, Circonscription départementale du Rhône, Auvergne-Rhône-Alpes, France métropolitaine, France","('45n7578', '4e832')",<flatlib.chart.Chart object at 0x6254bd128>
Tommaso_Landolfi,r_journalists-publicists,465,"['1908', 8, '9', '01:00']","Pizzo, Italy","Pizzo, Vibo Valentia, Calabria, Italia","('38n7354', '16e1621')",<flatlib.chart.Chart object at 0x6254b9fd0>
Georges_Langelaan,r_journalists-publicists,466,"['1908', 1, '19', '16:00']","Paris, France","Paris, Île-de-France, France métropolitaine, France","('48n8567', '2e3515')",<flatlib.chart.Chart object at 0x6254b9f98>
Jacques_Laurent,r_journalists-publicists,468,"['1919', 1, '5', '09:15']","Paris, France","Paris, Île-de-France, France métropolitaine, France","('48n8567', '2e3515')",<flatlib.chart.Chart object at 0x6254bcef0>
Peter_Limbourg,r_journalists-publicists,470,"['1960', 7, '7', '07:57']","Bonn, Germany","Bonn, Nordrhein-Westfalen, 53111, Deutschland","('50n7359', '7e1007')",<flatlib.chart.Chart object at 0x6254bcfd0>
Luiz_Carlos_Lisboa,r_journalists-publicists,471,"['1928', 12, '22', '10:30']","Rio de Janeiro, Brazil","Rio de Janeiro, Região Geográfica Imediata do Rio de Janeiro, Região Metropolitana do Rio de Janeiro, Região Geográfica Intermediária do Rio de Janeiro, Rio de Janeiro, Região Sudeste, Brasil","('22s911', '43w2094')",<flatlib.chart.Chart object at 0x624ebeeb8>
Nicola_Lisi,r_journalists-publicists,472,"['1893', 4, '11', '02:30']","Scarperia, Italy","Scarperia, Firenze, Toscana, Italia","('43n9961', '11e3551')",<flatlib.chart.Chart object at 0x624ebef28>
Marcel_Lobet,r_journalists-publicists,473,"['1907', 6, '28', '17:00']","Braine-le-Comte, Belgium","Braine-Le-Comte, Hainaut, Wallonie, 7090, België - Belgique - Belgien","('50n6107', '4e1361')",<flatlib.chart.Chart object at 0x624ea7e80>
Carl_Albert_Loosli,r_journalists-publicists,474,"['1877', 4, '5', '17:30']","Bern, Switzerland","Bern, Verwaltungskreis Bern-Mittelland, Verwaltungsregion Bern-Mittelland, Bern/Berne, Switzerland","('46n9483', '7e4515')",<flatlib.chart.Chart object at 0x624ea7f60>
Christopher_Lydon,r_journalists-publicists,475,"['1940', 2, '20']","Boston, Massachusetts, United States","Boston, Suffolk County, Massachusetts, United States of America","('42n3603', '71w0583')",<flatlib.chart.Chart object at 0x624eb0f60>
Wayne_Madsen,r_journalists-publicists,477,"['1954', 4, '28', '12:12']","Ridley Park, Pennsylvania, United States","Ridley Park, Delaware County, Pennsylvania, 19078, United States of America","('39n8812', '75w3238')",<flatlib.chart.Chart object at 0x624e9b8d0>
Giorgio_Manganelli,r_journalists-publicists,478,"['1922', 11, '15', '04:30']","Milan, Italy","Milano, Lombardia, Italia","('45n4668', '9e1905')",<flatlib.chart.Chart object at 0x624eb0f28>
Don_Marquis,r_journalists-publicists,480,"['1878', 7, '29', '15:00']","Walnut, Illinois, United States","Walnut, Bureau County, Illinois, United States of America","('41n5567', '89w5934')",<flatlib.chart.Chart object at 0x624e91898>
Ivan_Massar,r_journalists-publicists,481,"['1924', 6, '12', '23:10']","Columbus, Ohio, United States","Columbus, Franklin County, Ohio, United States of America","('39n9623', '83w0007')",<flatlib.chart.Chart object at 0x624e91f60>
Dirk_Matheson,r_journalists-publicists,482,"['1959', 6, '5', '00:03']","Burbank, California, United States","Burbank, Los Angeles County, California, United States of America","('34n1816', '118w3259')",<flatlib.chart.Chart object at 0x624ea2780>
Bernard_Mazières,r_journalists-publicists,484,"['1950', 6, '1', '23:45']","Neuilly-sur-Seine, France","Neuilly-sur-Seine, Arrondissement de Nanterre, Hauts-de-Seine, Île-de-France, France métropolitaine, 92200, France","('48n8847', '2e2696')",<flatlib.chart.Chart object at 0x624ea2f60>
J._M._McIntosh,r_journalists-publicists,485,"['1925', 2, '14', '20:27']","Paisley, Scotland, United Kingdom","Paisley, Renfrewshire, Scotland, PA1 1DG, United Kingdom","('55n8456', '4w424')",<flatlib.chart.Chart object at 0x624e99748>
Norris_McWhirter,r_journalists-publicists,486,"['1925', 8, '12', '19:40']","London, England, United Kingdom","London, Greater London, England, SW1A 2DX, United Kingdom","('51n5073', '0w1276')",<flatlib.chart.Chart object at 0x624e99e80>
Ross_McWhirter,r_journalists-publicists,487,"['1925', 8, '12', '20:00']","London, England, United Kingdom","London, Greater London, England, SW1A 2DX, United Kingdom","('51n5073', '0w1276')",<flatlib.chart.Chart object at 0x624e8f978>
Tina_Merlin,r_journalists-publicists,489,"['1926', 8, '19', '11:00']","Trichiana, Italy","Trichiana, Borgo Valbelluna, Belluno, Veneto, 32028, Italia","('46n0489', '12e1782')",<flatlib.chart.Chart object at 0x624e8f198>
Giovanna_Milella,r_journalists-publicists,493,"['1949', 10, '29', '02:45']","Milan, Italy","Milano, Lombardia, Italia","('45n4668', '9e1905')",<flatlib.chart.Chart object at 0x624e8f080>
Pierre_Mille,r_journalists-publicists,494,"['1864', 11, '27', '05:30']","Choisy-le-Roi, France","Choisy-le-Roi, Arrondissement de L'Haÿ-les-Roses, Val-de-Marne, Île-de-France, France métropolitaine, 94600, France","('48n763', '2e4094')",<flatlib.chart.Chart object at 0x624e8eeb8>
Giovanni_Minoli,r_journalists-publicists,495,"['1945', 5, '26', '04:38']","Turin, Italy","Torino, Piemonte, Italia","('45n0678', '7e6825')",<flatlib.chart.Chart object at 0x624e8ef98>
Paolo_Mosca,r_journalists-publicists,497,"['1943', 10, '20', '05:00']","Verbania, Italy","Verbania, Verbano-Cusio-Ossola, Piemonte, Italia","('45n9222', '8e5517')",<flatlib.chart.Chart object at 0x624e8ef28>
Christian_Mégret,r_journalists-publicists,498,"['1904', 11, '11', '06:40']","Vincennes, France","Vincennes, Nogent-sur-Marne, Val-de-Marne, Île-de-France, France métropolitaine, 94300, France","('48n8475', '2e4397')",<flatlib.chart.Chart object at 0x624e86128>
George_Negus,r_journalists-publicists,499,"['1942', 3, '13', '01:00']","Brisbane, Queensland, Australia","Brisbane, Queensland, 4004, Australia","('27s469', '153e0235')",<flatlib.chart.Chart object at 0x624e59eb8>
Eric_Neuhoff,r_journalists-publicists,500,"['1956', 7, '4', '13:40']","Paris, France","Paris, Île-de-France, France métropolitaine, France","('48n8567', '2e3515')",<flatlib.chart.Chart object at 0x624e59f28>
Victor_Noir,r_journalists-publicists,501,"['1848', 7, '30', '11:00']","Attigny, France","Attigny, Neufchâteau, Vosges, Grand Est, France métropolitaine, 88260, France","('48n065', '6e0359')",<flatlib.chart.Chart object at 0x624e51f60>
John_J._O'Neill,r_journalists-publicists,502,"['1889', 6, '21', '20:15']","New York, New York, United States","New York, United States of America","('40n7127', '74w006')",<flatlib.chart.Chart object at 0x624e49748>
Vance_Packard,r_journalists-publicists,503,"['1914', 5, '22', '05:30']","Granville, United States","Granville County, North Carolina, United States of America","('36n321', '78w6594')",<flatlib.chart.Chart object at 0x624e49f60>
Alfons_Paquet,r_journalists-publicists,504,"['1881', 1, '26', '23:00']","Wiesbaden, Germany","Wiesbaden, Hessen, 65183, Deutschland","('50n082', '8e2417')",<flatlib.chart.Chart object at 0x624e49f28>
Sandro_Paternostro,r_journalists-publicists,505,"['1922', 8, '9', '04:00']","Palermo, Italy","Palermo, Sicilia, Italia","('38n1112', '13e3524')",<flatlib.chart.Chart object at 0x624e33860>
Daniel_Pearl,r_journalists-publicists,506,"['1963', 10, '10']","Princeton, New Jersey, United States","Princeton, Mercer County, New Jersey, United States of America","('40n3493', '74w6593')",<flatlib.chart.Chart object at 0x624e37748>
Gilles_Perrault,r_journalists-publicists,509,"['1931', 3, '9', '01:00']","Paris, France","Paris, Île-de-France, France métropolitaine, France","('48n8567', '2e3515')",<flatlib.chart.Chart object at 0x624e37f98>
Jacques_Perret,r_journalists-publicists,510,"['1901', 9, '8', '06:00']","Trappes, France","Trappes, Versailles, Yvelines, Île-de-France, France métropolitaine, 78190, France","('48n7761', '1e9988')",<flatlib.chart.Chart object at 0x624e37ef0>
Cath_Phillips,r_journalists-publicists,512,"['1955', 3, '7', '04:30']","Otorohanga, Waikato, New Zealand","Otorohanga, Otorohanga District, Waikato, 3900, New Zealand","('38s1823', '175e2155')",<flatlib.chart.Chart object at 0x624e3cf60>
Joe_Pilcher,r_journalists-publicists,514,"['1933', 1, '4', '07:48']","Santa Monica, California, United States","Santa Monica, Los Angeles County, California, United States of America","('34n0251', '118w4965')",<flatlib.chart.Chart object at 0x624e297f0>
Guido_Piovene,r_journalists-publicists,515,"['1907', 7, '27', '09:15']","Vicenza, Italy","Vicenza, Veneto, Italia","('45n6349', '11e4064')",<flatlib.chart.Chart object at 0x624e29f98>
Bernard_Pivot,r_journalists-publicists,516,"['1935', 5, '5', '17:00']","Lyon, France","Lyon, Métropole de Lyon, Circonscription départementale du Rhône, Auvergne-Rhône-Alpes, France métropolitaine, France","('45n7578', '4e832')",<flatlib.chart.Chart object at 0x624e29f60>
Paulo_Portas,r_journalists-publicists,517,"['1962', 9, '12', '02:30']","Lisbon, Portugal","Lisboa, Grande Lisboa, Área Metropolitana de Lisboa, Portugal","('38n7078', '9w1366')",<flatlib.chart.Chart object at 0x624e22e80>
Jacques_Pradel,r_journalists-publicists,518,"['1947', 2, '11', '08:30']","Paris, France","Paris, Île-de-France, France métropolitaine, France","('48n8567', '2e3515')",<flatlib.chart.Chart object at 0x624e22f60>
Michele_Prisco,r_journalists-publicists,521,"['1920', 1, '4', '07:20']","Torre Annunziata, Italy","Torre Annunziata, Napoli, Campania, 80058, Italia","('40n7525', '14e455')",<flatlib.chart.Chart object at 0x624e2c978>
Aime_Felix_Pyat,r_journalists-publicists,522,"['1810', 10, '4', '20:00']","Saint-Gratien, France","Saint-Gratien, Amiens, Somme, Hauts-de-France, France métropolitaine, 80260, France","('49n9657', '2e4082')",<flatlib.chart.Chart object at 0x624e2c080>
Robert_Reitzel,r_journalists-publicists,523,"['1849', 1, '27', '19:00']","Schopfheim, Germany","Schopfheim, Verwaltungsgemeinschaft Schopfheim, Landkreis Lörrach, Baden-Württemberg, 79650, Deutschland","('47n6501', '7e8217')",<flatlib.chart.Chart object at 0x624e25e80>
James_Reston,r_journalists-publicists,524,"['1909', 11, '3', '22:40']","Clydebank, Scotland, United Kingdom","Clydebank, West Dunbartonshire, Scotland, G81 1RP, United Kingdom","('55n9026', '4w404')",<flatlib.chart.Chart object at 0x624e20780>
Henri_François_Rey,r_journalists-publicists,525,"['1919', 7, '31', '11:00']","Toulouse, France","Toulouse, Haute-Garonne, Occitanie, France métropolitaine, France","('43n6045', '1e4442')",<flatlib.chart.Chart object at 0x624e20e80>
Frank_Reynolds,r_journalists-publicists,526,"['1923', 11, '29', '19:45']","East Chicago, Indiana, United States","East Chicago, Lake County, Indiana, 46312, United States of America","('41n6398', '87w4548')",<flatlib.chart.Chart object at 0x624e24748>
Mark_Riva,r_journalists-publicists,527,"['1961', 5, '22', '13:08']","Berwyn, Illinois, United States","Berwyn, Cook County, Illinois, 60402, United States of America","('41n8506', '87w7937')",<flatlib.chart.Chart object at 0x624e24f60>
Emanuele_Rocco,r_journalists-publicists,528,"['1922', 8, '25', '07:00']","Rome, Italy","Roma, Roma Capitale, Italia","('41n8933', '12e4829')",<flatlib.chart.Chart object at 0x624e24f28>
Rick_Rodriguez,r_journalists-publicists,529,"['1954', 4, '5', '07:38']","Salinas, California, United States","Salinas, Monterey County, California, United States of America","('36n6744', '121w655')",<flatlib.chart.Chart object at 0x62483eeb8>
Roger_Rosenblatt,r_journalists-publicists,530,"['1940', 9, '13', '12:00']","New York, New York, United States","New York, United States of America","('40n7127', '74w006')",<flatlib.chart.Chart object at 0x62483a748>
Jean_Rousselot,r_journalists-publicists,531,"['1913', 10, '27', '08:00']","Poitiers, France","Poitiers, Vienne, Nouvelle-Aquitaine, France métropolitaine, 86000, France","('46n5803', '0e3402')",<flatlib.chart.Chart object at 0x62483ef60>
Tim_Russert,r_journalists-publicists,532,"['1950', 5, '7']","Buffalo, New York, United States","Buffalo, Erie County, New York, United States of America","('42n8867', '78w8784')",<flatlib.chart.Chart object at 0x624841780>
John_Sack,r_journalists-publicists,533,"['1930', 3, '24', '21:07']","New York, New York, United States","New York, United States of America","('40n7127', '74w006')",<flatlib.chart.Chart object at 0x624841e80>
Nino_Salvaneschi,r_journalists-publicists,534,"['1886', 12, '3', '04:30']","Pavia, Italy","Pavia, Lombardia, Italia","('45n0369', '9e1378')",<flatlib.chart.Chart object at 0x624841ef0>
Henri_Sannier,r_journalists-publicists,535,"['1947', 9, '7', '18:30']","Puteaux, France","Puteaux, Arrondissement de Nanterre, Hauts-de-Seine, Île-de-France, France métropolitaine, 92800, France","('48n8842', '2e2369')",<flatlib.chart.Chart object at 0x62482def0>
Gene_Schoenfeld,r_journalists-publicists,536,"['1935', 3, '17', '08:00']","New York, New York, United States","New York, United States of America","('40n7127', '74w006')",<flatlib.chart.Chart object at 0x624839748>
Annemiek_Schrijver,r_journalists-publicists,537,"['1964', 10, '21', '19:50']","Arnhem, Netherlands","Arnhem, Gelderland, Nederland","('51n9843', '5e9109')",<flatlib.chart.Chart object at 0x62482dfd0>
Robert_Schwartz,r_journalists-publicists,538,"['1920', 1, '18', '09:00']","Salem, Ohio, United States","Salem, Columbiana County, Ohio, 44460, United States of America","('40n9009', '80w8568')",<flatlib.chart.Chart object at 0x62483b748>
Rolf_Seelmann-Eggebert,r_journalists-publicists,539,"['1937', 2, '5', '09:30']","Berlin, Germany","Berlin, Deutschland","('52n517', '13e3889')",<flatlib.chart.Chart object at 0x62483b710>
Errante_Michele_Serra,r_journalists-publicists,540,"['1954', 7, '10', '12:50']","Rome, Italy","Roma, Roma Capitale, Italia","('41n8933', '12e4829')",<flatlib.chart.Chart object at 0x62483bfd0>
Enzo_Siciliano,r_journalists-publicists,541,"['1934', 5, '27', '23:05']","Rome, Italy","Roma, Roma Capitale, Italia","('41n8933', '12e4829')",<flatlib.chart.Chart object at 0x624829080>
Charles_Silberman,r_journalists-publicists,542,"['1925', 1, '31', '22:45']","Polk IA, Iowa, United States","Polk County, Iowa, United States of America","('41n6766', '93w5921')",<flatlib.chart.Chart object at 0x624823748>
G._R._Simms,r_journalists-publicists,543,"['1847', 9, '2', '18:00']","London, England, United Kingdom","London, Greater London, England, SW1A 2DX, United Kingdom","('51n5073', '0w1276')",<flatlib.chart.Chart object at 0x624823ef0>
Renato_Simoni,r_journalists-publicists,544,"['1875', 9, '5', '13:00']","Verona, Italy","Verona, Veneto, Italia","('45n4385', '10e9924')",<flatlib.chart.Chart object at 0x625090c50>
Hedrick_Smith,r_journalists-publicists,545,"['1933', 7, '9', '03:00']","Kilmacolm, Scotland, United Kingdom","Kilmacolm, Inverclyde, Scotland, PA13 4AW, United Kingdom","('55n8939', '4w6273')",<flatlib.chart.Chart object at 0x625686940>
Tony_Snow,r_journalists-publicists,546,"['1955', 6, '1', '18:10']","Berea, Kentucky, United States","Berea, Madison County, Kentucky, United States of America","('37n5687', '84w2963')",<flatlib.chart.Chart object at 0x6247d6240>
David_St._Clair,r_journalists-publicists,547,"['1932', 10, '2', '03:30']","Newton Falls, Ohio, United States","Newton Falls, Trumbull County, Ohio, United States of America","('41n1884', '80w9781')",<flatlib.chart.Chart object at 0x62481ed30>
Adela_Rogers_St._Johns,r_journalists-publicists,548,"['1894', 5, '20']","Los Angeles, California, United States","Los Angeles, Los Angeles County, California, United States of America","('34n0537', '118w2428')",<flatlib.chart.Chart object at 0x6241f9518>
John_Stapleton,r_journalists-publicists,549,"['1946', 2, '24', '23:00']","Oldham, England, United Kingdom","Oldham, Greater Manchester, North West England, England, United Kingdom","('53n5416', '2w1148')",<flatlib.chart.Chart object at 0x6241f9c50>
Domenico_Starnone,r_journalists-publicists,550,"['1943', 2, '15', '05:00']","Saviano, Italy","Saviano, Napoli, Campania, 80039, Italia","('40n9056', '14e505')",<flatlib.chart.Chart object at 0x6241f9d30>
Roger_Stephane,r_journalists-publicists,551,"['1919', 8, '19', '19:00']","Paris, France","Paris, Île-de-France, France métropolitaine, France","('48n8567', '2e3515')",<flatlib.chart.Chart object at 0x624828c50>
John_Stossel,r_journalists-publicists,552,"['1947', 3, '6', '08:43']","Chicago, Illinois, United States","Chicago, Cook County, Illinois, United States of America","('41n8756', '87w6244')",<flatlib.chart.Chart object at 0x624816550>
Willard_Straight,r_journalists-publicists,553,"['1880', 1, '31', '13:40']","New York, New York, United States","New York, United States of America","('40n7127', '74w006')",<flatlib.chart.Chart object at 0x624816c50>
Mary_Strassmeyer,r_journalists-publicists,554,"['1929', 8, '5', '12:50']","Cleveland, Ohio, United States","Cleveland, Cuyahoga County, Ohio, United States of America","('41n5052', '81w6934')",<flatlib.chart.Chart object at 0x624475550>
Streeter_Stuart,r_journalists-publicists,555,"['1908', 6, '3', '11:45']","Oklahoma City, Oklahoma, United States","Oklahoma City, Oklahoma County, Oklahoma, United States of America","('35n473', '97w5171')",<flatlib.chart.Chart object at 0x624475518>
Jug_Suraiya,r_journalists-publicists,556,"['1946', 11, '4', '06:00']","Puri, India","Puri, Puri (M), Puri, Odisha, 752001, India","('19n8076', '85e8253')",<flatlib.chart.Chart object at 0x6244775c0>
Frédéric_Taddeï,r_journalists-publicists,557,"['1961', 1, '5', '21:05']","Paris, France","Paris, Île-de-France, France métropolitaine, France","('48n8567', '2e3515')",<flatlib.chart.Chart object at 0x624477cc0>
Luciano_Teodori,r_journalists-publicists,558,"['1950', 9, '5', '10:55']","Tivoli, Italy","Tivoli, Roma Capitale, Italia","('41n9609', '12e7989')",<flatlib.chart.Chart object at 0x624477da0>
Roger_Therond,r_journalists-publicists,559,"['1924', 10, '24', '18:30']","Ste, France","Saint-Étienne, Loire, Auvergne-Rhône-Alpes, France métropolitaine, France","('45n4401', '4e3873')",<flatlib.chart.Chart object at 0x624461c50>
Helen_Thomas,r_journalists-publicists,560,"['1920', 8, '4']","Winchester, Kentucky, United States","Winchester, Clark County, Kentucky, 40391-1876, United States of America","('37n9901', '84w1797')",<flatlib.chart.Chart object at 0x6247fe550>
Lowell_Thomas,r_journalists-publicists,561,"['1892', 4, '6', '19:55']","Woodington OH, Ohio, United States","Woodington, Darke County, Ohio, United States of America","('40n1784', '84w6777')",<flatlib.chart.Chart object at 0x6247fedd8>
Linda_Lee_Tracy,r_journalists-publicists,562,"['1957', 5, '14', '02:00']","Ottawa, Ontario, Canada","Ottawa, Eastern Ontario, Ontario, K1P 1J1, Canada","('45n4211', '75w6903')",<flatlib.chart.Chart object at 0x6247fec88>
Patrice_Van_Eersel,r_journalists-publicists,563,"['1949', 1, '30', '18:55']","Sf, Morocco","SF 6, Jdiriya ⵊⴷⵉⵢⵔⵉⵢⴰ اجديرية, caïdat de Jdiriya قيادة اجديرية, cercle de Es-Semara دائرة السمارة, Province d'Es-Semara إقليم السمارة, Maroc","('26n9691', '9w2449')",<flatlib.chart.Chart object at 0x6247dcc88>
Oliver_Van_Petten,r_journalists-publicists,564,"['1922', 2, '4', '22:00']","Prestonsburg, Kentucky, United States","Prestonsburg, Floyd County, Kentucky, United States of America","('37n6657', '82w7715')",<flatlib.chart.Chart object at 0x624b10710>
Sander_Vanocur,r_journalists-publicists,565,"['1928', 1, '8', '16:58']","Cleveland, Ohio, United States","Cleveland, Cuyahoga County, Ohio, United States of America","('41n5052', '81w6934')",<flatlib.chart.Chart object at 0x624b10f28>
Michael_Ventura,r_journalists-publicists,566,"['1945', 10, '31', '23:10']","New York, New York, United States","New York, United States of America","('40n7127', '74w006')",<flatlib.chart.Chart object at 0x624b116d8>
Françoise_Vergès,r_journalists-publicists,567,"['1952', 1, '23', '16:15']","Paris, France","Paris, Île-de-France, France métropolitaine, France","('48n8567', '2e3515')",<flatlib.chart.Chart object at 0x624b11e10>
Emilio_Vesce,r_journalists-publicists,568,"['1939', 5, '17', '18:05']","Cairano, Italy","Cairano, Avellino, Campania, Italia","('40n8968', '15e3704')",<flatlib.chart.Chart object at 0x624b11f28>
Philippe_Viannay,r_journalists-publicists,569,"['1917', 8, '15', '06:00']","Saint-Jean-de-Bournay, France","Saint-Jean-de-Bournay, Vienne, Isère, Auvergne-Rhône-Alpes, France métropolitaine, 38440, France","('45n5019', '5e139')",<flatlib.chart.Chart object at 0x624af6e10>
Patrick_Watson,r_journalists-publicists,572,"['1929', 12, '23', '12:00']","Toronto, Ontario, Canada","Toronto, Golden Horseshoe, Ontario, M5H 2N2, Canada","('43n6535', '79w3839')",<flatlib.chart.Chart object at 0x624af6fd0>
Auberon_'Bron'_Waugh,r_journalists-publicists,573,"['1939', 11, '17', '23:55']","Dulverton, England, United Kingdom","Dulverton, Somerset, South West England, England, TA22, United Kingdom","('51n0401', '3w5502')",<flatlib.chart.Chart object at 0x624af6f28>
Wilhelm_Weiss,r_journalists-publicists,574,"['1892', 3, '31', '21:00']","Stadtsteinach, Germany","Stadtsteinach, Stadtsteinach (VGem), Landkreis Kulmbach, Bayern, 95346, Deutschland","('50n1613', '11e5055')",<flatlib.chart.Chart object at 0x624b0aef0>
Carveth_Wells,r_journalists-publicists,575,"['1911', 7, '16', '22:30']","Cheltenham, England, United Kingdom","Cheltenham, Gloucestershire, South West England, England, United Kingdom","('51n8996', '2w0712')",<flatlib.chart.Chart object at 0x624aeae10>
Linton_Wells,r_journalists-publicists,576,"['1893', 4, '1', '03:06']","Louisville, Kentucky, United States","Louisville, Jefferson County, Kentucky, United States of America","('38n2542', '85w7594')",<flatlib.chart.Chart object at 0x624945668>
Glenway_Wescott,r_journalists-publicists,577,"['1901', 4, '11', '17:00']","Kewaskum, Wisconsin, United States","Kewaskum, Washington County, Wisconsin, United States of America","('43n5214', '88w2279')",<flatlib.chart.Chart object at 0x624945ef0>
Mike_Willesee,r_journalists-publicists,578,"['1942', 6, '29', '07:30']","Perth, Western Australia, Australia","Perth, Western Australia, 6000, Australia","('31s9527', '115e8605')",<flatlib.chart.Chart object at 0x624944668>
Walter_Winchell,r_journalists-publicists,579,"['1897', 4, '7', '19:30']","New York, New York, United States","New York, United States of America","('40n7127', '74w006')",<flatlib.chart.Chart object at 0x624944e80>
Pierre-Rene_Wolf,r_journalists-publicists,580,"['1899', 2, '19', '04:00']","Rouen, France","Rouen, Seine-Maritime, Normandie, France métropolitaine, France","('49n4405', '1e094')",<flatlib.chart.Chart object at 0x624944f28>
Jean-Didier_Wolfromm,r_journalists-publicists,581,"['1941', 5, '21', '21:00']","Paris, France","Paris, Île-de-France, France métropolitaine, France","('48n8567', '2e3515')",<flatlib.chart.Chart object at 0x62494ee10>
Xiao_Qian,r_journalists-publicists,583,"['1910', 1, '27', '12:00']","Beijing, China","北京市, 东城区, 北京市, 100010, China 中国","('39n9062', '116e3913')",<flatlib.chart.Chart object at 0x62494ef28>
Guglielmo_Zucconi,r_journalists-publicists,584,"['1919', 12, '19', '17:30']","Bologna, Italy","Bologna, Emilia-Romagna, Italia","('44n4937', '11e343')",<flatlib.chart.Chart object at 0x62494efd0>
Karl_Zéro,r_journalists-publicists,585,"['1961', 8, '6', '13:45']","Aix-les-Bains, France","Aix-les-Bains, Chambéry, Savoie, Auvergne-Rhône-Alpes, France métropolitaine, 73100, France","('45n6886', '5e9146')",<flatlib.chart.Chart object at 0x624951ef0>
Jiří_Dienstbier_Sr.,r_journalists-publicists,588,"['1937', 4, '20']","Kladno, Czech Republic","Kladno, okres Kladno, Středočeský kraj, Střední Čechy, Česká republika","('50n1478', '14e1025')",<flatlib.chart.Chart object at 0x624937f98>
Chris_Huhne,r_journalists-publicists,589,"['1954', 7, '2']","London, England, United Kingdom","London, Greater London, England, SW1A 2DX, United Kingdom","('51n5073', '0w1276')",<flatlib.chart.Chart object at 0x624953710>
