name,occupation,count,birthtime,birthplace,location,point,chart
Stephen_Hawking,r_mathematicians,0,"['1942', 1, '8', '10:08']","Oxford, England, United Kingdom","Oxford, Oxfordshire, South East, England, United Kingdom","('51n752', '1w2578')",<flatlib.chart.Chart object at 0x6245f72e8>
Lewis_Carroll,r_mathematicians,1,"['1832', 1, '27', '03:45']","Daresbury, England, United Kingdom","Daresbury, Halton, North West England, England, WA4 4AJ, United Kingdom","('53n3402', '2w633')",<flatlib.chart.Chart object at 0x62463d4e0>
Bertrand_Russell,r_mathematicians,2,"['1872', 5, '18', '17:45']","Trelleck, Wales, United Kingdom","Trelleck Grange, Devauden, Monmouthshire, Wales, NP16 6QR, United Kingdom","('51n7111', '2w7356')",<flatlib.chart.Chart object at 0x62463deb8>
Leonhard_Euler,r_mathematicians,3,"['1707', 4, '15', '21:13']","Basel, Switzerland","Basel, Basel-Stadt, Switzerland","('47n5581', '7e5878')",<flatlib.chart.Chart object at 0x62463dfd0>
William_Hamilton,r_mathematicians,4,"['1805', 8, '4', '00:00']","Dublin, Ireland","Dublin, County Dublin, Leinster, Ireland","('53n3498', '6w2603')",<flatlib.chart.Chart object at 0x6245e4978>
Ada_Lovelace,r_mathematicians,7,"['1815', 12, '10', '13:00']","London, England, United Kingdom","London, Greater London, England, SW1A 2DX, United Kingdom","('51n5073', '0w1276')",<flatlib.chart.Chart object at 0x6245e44e0>
Ted_Kaczynski,r_mathematicians,9,"['1942', 5, '22', '10:45']","Chicago, Illinois, United States","Chicago, Cook County, Illinois, United States of America","('41n8756', '87w6244')",<flatlib.chart.Chart object at 0x6245e3fd0>
Emmanuel_Lasker,r_mathematicians,10,"['1868', 12, '24', '15:00']","Berlin, Germany","Berlin, Deutschland","('52n517', '13e3889')",<flatlib.chart.Chart object at 0x6245e3400>
Thomas_Shanks,r_mathematicians,12,"['1942', 4, '9', '14:55']","Lima, Ohio, United States","Lima, Allen County, Ohio, United States of America","('40n74', '84w105')",<flatlib.chart.Chart object at 0x62345b588>
Alan_Turing,r_mathematicians,13,"['1912', 6, '23', '02:15']","London, England, United Kingdom","London, Greater London, England, SW1A 2DX, United Kingdom","('51n5073', '0w1276')",<flatlib.chart.Chart object at 0x624321160>
Grigori_Perelman,r_mathematicians,14,"['1966', 6, '13']","Saint Petersburg, Russia","Санкт-Петербург, Северо-Западный федеральный округ, 190000, Россия","('59n9607', '30e1587')",<flatlib.chart.Chart object at 0x6243215f8>
Boris_Nemtsov,r_mathematicians,15,"['1959', 10, '9']","Sochi, Russia","Сочи, городской округ Сочи, релейшен для роутингового слоя в Навителе, Южный федеральный округ, Россия","('43n5855', '39e7231')",<flatlib.chart.Chart object at 0x624321630>
Sofia_Kovalevskaya,r_mathematicians,16,"['1850', 1, '15']","Moscow, Russia","Москва, Центральный федеральный округ, Россия","('55n4792', '37e3273')",<flatlib.chart.Chart object at 0x6242bca20>
Isaac_Newton,r_mathematicians,17,"['1643', 1, '4', '01:38']","Woolsthorpe, England, United Kingdom","Woolsthorpe, Lincolnshire, East Midlands, England, NG33 5NS, United Kingdom","('52n8096', '0w6322')",<flatlib.chart.Chart object at 0x6233b2f28>
Johannes_Kepler,r_mathematicians,19,"['1572', 1, '6', '14:37']","Weil der Stadt, Germany","Weil der Stadt, Landkreis Böblingen, Baden-Württemberg, 71263, Deutschland","('48n7501', '8e8707')",<flatlib.chart.Chart object at 0x6233b2710>
Galilei_Galileo,r_mathematicians,20,"['1564', 2, '26', '15:41']","Pisa, Italy","Pisa, Toscana, Italia","('43n7159', '10e4019')",<flatlib.chart.Chart object at 0x6242bcc18>
René_Descartes,r_mathematicians,21,"['1596', 3, '31']","Descartes, France","Descartes, Loches, Indre-et-Loire, Centre-Val de Loire, France métropolitaine, 37160, France","('46n9741', '0e6995')",<flatlib.chart.Chart object at 0x62465e0b8>
Nicolaus_Copernicus,r_mathematicians,22,"['1473', 2, '28', '17:13']","Torun, Poland","Toruń, województwo kujawsko-pomorskie, Polska","('53n0103', '18e6048')",<flatlib.chart.Chart object at 0x6246b5d30>
Raymond_Queneau,r_mathematicians,23,"['1903', 2, '21', '04:00']","Le Havre, France","Le Havre, Seine-Maritime, Normandie, France métropolitaine, France","('49n4939', '0e108')",<flatlib.chart.Chart object at 0x6246b5f28>
Charles_Babbage,r_mathematicians,24,"['1791', 12, '26', '09:57']","London, England, United Kingdom","London, Greater London, England, SW1A 2DX, United Kingdom","('51n5073', '0w1276')",<flatlib.chart.Chart object at 0x6246a6710>
Luitzen_Brouwer,r_mathematicians,26,"['1881', 2, '27', '03:30']","Rotterdam, Netherlands","Rotterdam, Zuid-Holland, Nederland","('51n9229', '4e4632')",<flatlib.chart.Chart object at 0x6246a6048>
Georg_Cantor,r_mathematicians,28,"['1845', 3, '3', '10:45']","Saint Petersburg, Russia","Санкт-Петербург, Северо-Западный федеральный округ, 190000, Россия","('59n9607', '30e1587')",<flatlib.chart.Chart object at 0x6246b87b8>
Henri_Cartan,r_mathematicians,30,"['1904', 7, '8', '22:00']","Nancy, France","Nancy, Meurthe-et-Moselle, Grand Est, France métropolitaine, 54100, France","('48n6937', '6e1834')",<flatlib.chart.Chart object at 0x6246b86a0>
Subrahmanyan_Chandrasekhar,r_mathematicians,31,"['1910', 10, '19', '20:02']","Lahore, Pakistan","لاہور, Lahore District, پنجاب, 531, پاکستان","('31n5656', '74e3142')",<flatlib.chart.Chart object at 0x6246bbd30>
Auguste_Comte,r_mathematicians,32,"['1798', 1, '19', '12:00']","Montpellier, France","Montpellier, Hérault, Occitanie, France métropolitaine, France","('43n6112', '3e8767')",<flatlib.chart.Chart object at 0x6246bb208>
Jean_Gaston_Darboux,r_mathematicians,33,"['1842', 8, '14', '01:00']","Nimes, France","Nîmes, Gard, Occitanie, France métropolitaine, France","('43n8374', '4e3601')",<flatlib.chart.Chart object at 0x624683be0>
Gérard_Debreu,r_mathematicians,34,"['1921', 7, '4', '04:00']","Calais, France","Calais, Pas-de-Calais, Hauts-de-France, France métropolitaine, 62100, France","('50n9488', '1e8747')",<flatlib.chart.Chart object at 0x624683c18>
Richard_Dedekin,r_mathematicians,35,"['1831', 10, '6', '16:00']","Brunswick, Germany","Braunschweig, Niedersachsen, Deutschland","('52n2647', '10e5236')",<flatlib.chart.Chart object at 0x6246c6208>
Armand_Denjoy,r_mathematicians,36,"['1884', 1, '5', '15:00']","Auch, France","Auch, Gers, Occitanie, France métropolitaine, 32000, France","('43n6464', '0e5851')",<flatlib.chart.Chart object at 0x6246c6518>
Joseph_L._Doob,r_mathematicians,37,"['1910', 2, '27', '01:00']","Cincinnati, Ohio, United States","Cincinnati, Hamilton County, Ohio, United States of America","('39n1015', '84w5125')",<flatlib.chart.Chart object at 0x6233e2470>
Christian_Doppler,r_mathematicians,38,"['1803', 11, '29', '11:00']","Salzburg, Austria","Salzburg, 5020, Österreich","('47n7981', '13e0465')",<flatlib.chart.Chart object at 0x62435a7f0>
William_Emerson,r_mathematicians,39,"['1701', 5, '25', '01:40']","Hurworth-on-Tees, England, United Kingdom","Hurworth-on-Tees, North East England, England, DL2 2AT, United Kingdom","('54n4868', '1w5257')",<flatlib.chart.Chart object at 0x62435a5f8>
Max_Euwe,r_mathematicians,40,"['1901', 5, '20', '03:30']","Amsterdam, Netherlands","Amsterdam, Noord-Holland, Nederland","('52n3728', '4e8936')",<flatlib.chart.Chart object at 0x62435add8>
Maurice-Rene_Frechet,r_mathematicians,41,"['1878', 9, '2', '02:00']","Maligny, Yonne, France","Maligny, Auxerre, Yonne, Bourgogne-Franche-Comté, France métropolitaine, 89800, France","('47n8695', '3e7643')",<flatlib.chart.Chart object at 0x62435ae48>
Evariste_Galois,r_mathematicians,42,"['1811', 10, '25', '01:00']","Bourg-la-Reine, France","Bourg-la-Reine, Antony, Hauts-de-Seine, Île-de-France, France métropolitaine, 92340, France","('48n7795', '2e3161')",<flatlib.chart.Chart object at 0x623469e10>
Andrew_Mattei_Gleason,r_mathematicians,43,"['1921', 11, '4', '23:50']","Fresno, California, United States","Fresno, Fresno County, California, United States of America","('36n7295', '119w7089')",<flatlib.chart.Chart object at 0x6246088d0>
Edouard_Goursat,r_mathematicians,44,"['1858', 5, '21', '19:00']","Lanarce, France","Lanarce, Largentière, Ardèche, Auvergne-Rhône-Alpes, France métropolitaine, 07660, France","('44n7276', '4e0039')",<flatlib.chart.Chart object at 0x624608128>
Alexander_Grothendieck,r_mathematicians,45,"['1928', 3, '28', '00:45']","Berlin, Germany","Berlin, Deutschland","('52n517', '13e3889')",<flatlib.chart.Chart object at 0x623469c50>
John_Currie_Gunn,r_mathematicians,46,"['1916', 9, '13', '13:00']","Glasgow, Scotland, United Kingdom","Glasgow, Glasgow City, Scotland, G2 9SA, United Kingdom","('55n861', '4w2489')",<flatlib.chart.Chart object at 0x62423cac8>
Jacques_Hadamard,r_mathematicians,47,"['1865', 12, '8', '22:00']","Versailles, France","Versailles, Yvelines, Île-de-France, France métropolitaine, 78000, France","('48n8035', '2e1267')",<flatlib.chart.Chart object at 0x62423c390>
Charles_Hermite,r_mathematicians,48,"['1822', 12, '24', '10:00']","Dieuze, France","Dieuze, Sarrebourg-Château-Salins, Moselle, Grand Est, France métropolitaine, 57260, France","('48n8105', '6e718')",<flatlib.chart.Chart object at 0x62423c668>
David_Hilbert,r_mathematicians,49,"['1862', 1, '23', '13:00']","Znamensk, Russia","Знаменск, Гвардейский городской округ, Калининградская область, Северо-Западный федеральный округ, 238200, Россия","('54n6156', '21e2274')",<flatlib.chart.Chart object at 0x6243455c0>
Camille_Jordan,r_mathematicians,50,"['1838', 1, '5', '07:30']","Lyon, France","Lyon, Métropole de Lyon, Circonscription départementale du Rhône, Auvergne-Rhône-Alpes, France métropolitaine, France","('45n7578', '4e832')",<flatlib.chart.Chart object at 0x6243450b8>
Urbain_Le_Verrier,r_mathematicians,52,"['1811', 3, '11', '10:00']","Saint-L, France","Saint-Dié-des-Vosges, Vosges, Grand Est, France métropolitaine, 88100, France","('48n2873', '6e9478')",<flatlib.chart.Chart object at 0x624345eb8>
Henri_Leon_Lebesgue,r_mathematicians,53,"['1875', 6, '28', '07:00']","Beauvais, France","Beauvais, Oise, Hauts-de-France, France métropolitaine, 60000, France","('49n4301', '2e0823')",<flatlib.chart.Chart object at 0x624354dd8>
Tullio_Levi-Civita,r_mathematicians,54,"['1873', 3, '29', '09:00']","Padua, Italy","Padova, Veneto, Italia","('45n4077', '11e8734')",<flatlib.chart.Chart object at 0x6243544e0>
Georg_Christoph_Lichtenberg,r_mathematicians,55,"['1742', 7, '1', '17:00']","Ober-Ramstadt, Germany","Ober-Ramstadt, Landkreis Darmstadt-Dieburg, Hessen, 64372, Deutschland","('49n831', '8e7451')",<flatlib.chart.Chart object at 0x62346db70>
Jules_Antoine_Lissajous,r_mathematicians,56,"['1822', 3, '4', '18:00']","Versailles, France","Versailles, Yvelines, Île-de-France, France métropolitaine, 78000, France","('48n8035', '2e1267')",<flatlib.chart.Chart object at 0x62346d860>
Deane_Montgomery,r_mathematicians,57,"['1909', 9, '2', '10:00']","Weaver, Minnesota, United States","Weaver, Wabasha County, Minnesota, United States of America","('44n215', '91w9288')",<flatlib.chart.Chart object at 0x62422a208>
Simon_Newcomb,r_mathematicians,58,"['1835', 3, '12', '04:00']","Wallace, Nova Scotia, Canada","Wallace, Cumberland County, Nova Scotia, B0K 1Y0, Canada","('45n8137', '63w4731')",<flatlib.chart.Chart object at 0x623464a20>
Emmy_Noether,r_mathematicians,59,"['1882', 3, '23', '20:00']","Erlangen, Germany","Erlangen, Bayern, 91052, Deutschland","('49n5981', '11e0036')",<flatlib.chart.Chart object at 0x623464ef0>
Andrew_Pollard_Ogg,r_mathematicians,60,"['1934', 4, '9', '16:30']","Bowling Green, Ohio, United States","Bowling Green, Wood County, Ohio, United States of America","('41n3748', '83w6513')",<flatlib.chart.Chart object at 0x624900ac8>
Kathleen_Ollerenshaw,r_mathematicians,61,"['1912', 10, '1', '07:00']","Manchester, England, United Kingdom","Manchester, Greater Manchester, North West England, England, United Kingdom","('53n4795', '2w2451')",<flatlib.chart.Chart object at 0x624900c88>
Irving_Reed,r_mathematicians,63,"['1923', 11, '12', '18:12']","Seattle, Washington, United States","Seattle, King County, Washington, United States of America","('47n6038', '122w3301')",<flatlib.chart.Chart object at 0x624b08e10>
Francesco_Severi,r_mathematicians,64,"['1879', 4, '13', '20:00']","Arezzo, Italy","Arezzo, Toscana, Italia","('43n5172', '11e7639')",<flatlib.chart.Chart object at 0x624900240>
Donald_C._Spencer,r_mathematicians,65,"['1912', 4, '25', '15:30']","Boulder, Colorado, United States","Boulder, Boulder County, Colorado, United States of America","('40n015', '105w2705')",<flatlib.chart.Chart object at 0x624280dd8>
William_Thomson,r_mathematicians,67,"['1824', 6, '26', '05:00']","Belfast, Northern Ireland, United Kingdom","Belfast, County Antrim, Northern Ireland, BT1 5GS, United Kingdom","('54n5964', '5w9303')",<flatlib.chart.Chart object at 0x6242802e8>
Karl_Weierstrass,r_mathematicians,69,"['1815', 10, '31', '23:59']","Ennigerloh, Germany","Ennigerloh, Kreis Warendorf, Nordrhein-Westfalen, 59320, Deutschland","('51n836', '8e0256')",<flatlib.chart.Chart object at 0x624283438>
Hermann_Weyl,r_mathematicians,70,"['1885', 11, '9', '05:00']","Elmshorn, Germany","Elmshorn, Pinneberg, Schleswig-Holstein, Deutschland","('53n7532', '9e6525')",<flatlib.chart.Chart object at 0x624283358>
Norbert_Wiener,r_mathematicians,71,"['1894', 11, '26', '13:55']","Odessa, Missouri, United States","Odessa, Lafayette County, Missouri, United States of America","('38n9996', '93w954')",<flatlib.chart.Chart object at 0x624272ef0>
Herman_Goldstine,r_mathematicians,72,"['1913', 9, '13']","Chicago, Illinois, United States","Chicago, Cook County, Illinois, United States of America","('41n8756', '87w6244')",<flatlib.chart.Chart object at 0x62434d198>
Jacob_Bronowski,r_mathematicians,74,"['1908', 1, '18']","d, Poland","Kolonia D, Osieck, gmina Osieck, powiat otwocki, województwo mazowieckie, 08-445, Polska","('51n9788', '21e4115')",<flatlib.chart.Chart object at 0x624212cf8>
Danica_McKellar,r_mathematicians,75,"['1975', 1, '3']","San Diego, California, United States","San Diego, San Diego County, California, United States of America","('32n7174', '117w1628')",<flatlib.chart.Chart object at 0x624212390>
José_Echegaray,r_mathematicians,76,"['1832', 4, '19', '11:30']","Madrid, Spain","Madrid, Área metropolitana de Madrid y Corredor del Henares, Comunidad de Madrid, 28001, España","('40n4167', '3w7036')",<flatlib.chart.Chart object at 0x624212b38>
Marie_Henri_Andoyer,r_mathematicians,77,"['1862', 10, '1', '00:01']","Paris, France","Paris, Île-de-France, France métropolitaine, France","('48n8567', '2e3515')",<flatlib.chart.Chart object at 0x624277630>
Pierre_P._Boileau,r_mathematicians,79,"['1811', 2, '19', '12:00']","Metz, France","Metz, Moselle, Grand Est, France métropolitaine, France","('49n1197', '6e1764')",<flatlib.chart.Chart object at 0x6242770f0>
Pierre_Ossian_Bonnet,r_mathematicians,80,"['1819', 12, '22', '13:00']","Montpellier, France","Montpellier, Hérault, Occitanie, France métropolitaine, France","('43n6112', '3e8767')",<flatlib.chart.Chart object at 0x6242985c0>
Emile_Borel,r_mathematicians,81,"['1871', 1, '7', '04:00']","Saint-Affrique, France","Saint-Affrique, Millau, Aveyron, Occitanie, France métropolitaine, 12400, France","('43n958', '2e8867')",<flatlib.chart.Chart object at 0x624a72dd8>
Jacques_Charles_Bresse,r_mathematicians,82,"['1822', 10, '9', '22:00']","Vienne, France","Vienne, Nouvelle-Aquitaine, France métropolitaine, France","('46n6121', '0e4654')",<flatlib.chart.Chart object at 0x624a72828>
Florent_J._Bureau,r_mathematicians,83,"['1906', 12, '17', '22:00']","Jemeppe-sur-Sambre, Belgium","Jemeppe-sur-Sambre, Namur, Wallonie, 5190, België - Belgique - Belgien","('50n4656', '4e6687')",<flatlib.chart.Chart object at 0x624a73358>
John_Candies,r_mathematicians,84,"['1919', 12, '19', '02:30']","Des Allemands, Louisiana, United States","Des Allemands, St. Charles Parish, Louisiana, 70030, United States of America","('29n815', '90w4735')",<flatlib.chart.Chart object at 0x624a63e10>
Eugene_Cosserat,r_mathematicians,85,"['1866', 3, '4', '07:30']","Amiens, France","Amiens, Somme, Hauts-de-France, France métropolitaine, 80000, France","('49n8942', '2e2957')",<flatlib.chart.Chart object at 0x624a63208>
Louis_Alexandre_Couturat,r_mathematicians,86,"['1868', 1, '17', '22:00']","Paris, France","Paris, Île-de-France, France métropolitaine, France","('48n8567', '2e3515')",<flatlib.chart.Chart object at 0x624ade0f0>
Lee_Dinetan,r_mathematicians,87,"['1992', 4, '7', '00:45']","Saverne, France","Saverne, Bas-Rhin, Grand Est, France métropolitaine, 67700, France","('48n742', '7e3626')",<flatlib.chart.Chart object at 0x624ade358>
Jules_Drach,r_mathematicians,88,"['1871', 3, '13', '07:00']","Strasbourg, France","Strasbourg, Bas-Rhin, Grand Est, France métropolitaine, France","('48n5846', '7e7507')",<flatlib.chart.Chart object at 0x624ade6d8>
Ernest_Esclangon,r_mathematicians,89,"['1876', 3, '17', '20:00']","Mison, France","Mison, Forcalquier, Alpes-de-Haute-Provence, Provence-Alpes-Côte d'Azur, France métropolitaine, 04200, France","('44n2635', '5e8401')",<flatlib.chart.Chart object at 0x624aeb780>
Oliver_Heaviside,r_mathematicians,91,"['1850', 5, '18']","London, England, United Kingdom","London, Greater London, England, SW1A 2DX, United Kingdom","('51n5073', '0w1276')",<flatlib.chart.Chart object at 0x624443518>
Carl_Gustav_Jacob_Jacobi,r_mathematicians,93,"['1804', 12, '10']","Potsdam, Germany","Potsdam, Brandenburg, Deutschland","('52n4009', '13e0591')",<flatlib.chart.Chart object at 0x624443860>
Gaston_Maurice_Julia,r_mathematicians,95,"['1893', 2, '3', '02:51']","Sidi Bel Abbes, Algeria","Sidi Bel Abbès سيدي بلعباس, دائرة سيدي بلعباس, سيدي بلعباس, الجزائر","('35n2057', '0w6285')",<flatlib.chart.Chart object at 0x624443cc0>
Herman_Kahn,r_mathematicians,96,"['1922', 2, '15', '04:00']","Bayonne, New Jersey, United States","Bayonne, Hudson County, New Jersey, 07002, United States of America","('40n6687', '74w1143')",<flatlib.chart.Chart object at 0x624a54978>
Gabriel_Koenigs,r_mathematicians,97,"['1858', 1, '17', '01:00']","Toulouse, France","Toulouse, Haute-Garonne, Occitanie, France métropolitaine, France","('43n6045', '1e4442')",<flatlib.chart.Chart object at 0x624a54d30>
Joel_Kupperman,r_mathematicians,98,"['1936', 5, '18', '18:30']","Chicago, Illinois, United States","Chicago, Cook County, Illinois, United States of America","('41n8756', '87w6244')",<flatlib.chart.Chart object at 0x624a68630>
Edmond_Laguerre,r_mathematicians,99,"['1834', 4, '9', '01:00']","Bar-le-Duc, France","Bar-le-Duc, Meuse, Grand Est, France métropolitaine, 55000, France","('48n7713', '5e1624')",<flatlib.chart.Chart object at 0x624a68c50>
Hyman_Levy,r_mathematicians,100,"['1889', 3, '7', '12:00']","Edinburgh, Scotland, United Kingdom","Edinburgh, City of Edinburgh, Scotland, EH1 3EG, United Kingdom","('55n9533', '3w1884')",<flatlib.chart.Chart object at 0x624a80e48>
Joseph_Liouville,r_mathematicians,101,"['1809', 3, '24', '08:00']","Saint-Omer, France","Saint-Omer, Pas-de-Calais, Hauts-de-France, France métropolitaine, 62500, France","('50n7522', '2e2541')",<flatlib.chart.Chart object at 0x624a80be0>
Junius_Massau,r_mathematicians,102,"['1852', 4, '9', '16:00']","Charleroi, Belgium","Charleroi, Hainaut, Wallonie, België - Belgique - Belgien","('50n412', '4e4436')",<flatlib.chart.Chart object at 0x625034cf8>
John_Mulligan,r_mathematicians,103,"['1950', 6, '2', '05:00']","Kirkintilloch, Scotland, United Kingdom","Kirkintilloch, East Dunbartonshire, Scotland, G66 1HF, United Kingdom","('55n9384', '4w1549')",<flatlib.chart.Chart object at 0x624462908>
J._Henri_Poincare,r_mathematicians,104,"['1854', 4, '29', '01:00']","Nancy, France","Nancy, Meurthe-et-Moselle, Grand Est, France métropolitaine, 54100, France","('48n6937', '6e1834')",<flatlib.chart.Chart object at 0x625034c18>
Victor_Puiseux,r_mathematicians,105,"['1820', 4, '16', '11:00']","Argenteuil, France","Argenteuil, Val-d'Oise, Île-de-France, France métropolitaine, 95100, France","('48n9479', '2e2482')",<flatlib.chart.Chart object at 0x62444e208>
Henri_Resal,r_mathematicians,106,"['1828', 1, '27', '17:00']","Plombires-les-Bains, France","Plombières-les-Bains, Épinal, Vosges, Grand Est, France métropolitaine, 88370, France","('47n9641', '6e4564')",<flatlib.chart.Chart object at 0x62444e278>
Edouard_Albert_Roche,r_mathematicians,107,"['1820', 10, '17', '15:00']","Montpellier, France","Montpellier, Hérault, Occitanie, France métropolitaine, France","('43n6112', '3e8767')",<flatlib.chart.Chart object at 0x62503d710>
Fabrice_Tourre,r_mathematicians,108,"['1979', 1, '19', '23:00']","Paris, France","Paris, Île-de-France, France métropolitaine, France","('48n8567', '2e3515')",<flatlib.chart.Chart object at 0x62503d9b0>
Cedric_Villani,r_mathematicians,109,"['1973', 10, '5', '19:25']","Brive-la-Gaillarde, France","Brive-la-Gaillarde, Corrèze, Nouvelle-Aquitaine, France métropolitaine, 19100, France","('45n1585', '1e5332')",<flatlib.chart.Chart object at 0x624808f60>
John_von_Neumann,r_mathematicians,110,"['1903', 12, '28']","Budapest, Hungary","Budapest, Közép-Magyarország, Magyarország","('47n4814', '19e1461')",<flatlib.chart.Chart object at 0x6254e55c0>
Jonathan_Weinstein,r_mathematicians,111,"['1977', 3, '9', '09:37']","Boston, Massachusetts, United States","Boston, Suffolk County, Massachusetts, United States of America","('42n3603', '71w0583')",<flatlib.chart.Chart object at 0x6254e5c88>
Boris_Berezovskij,r_mathematicians,112,"['1946', 1, '23']",SSSR,"18 բ, ссср, Գյումրի, Շիրակի մարզ, Armenia","('40n7984', '43e8347')",<flatlib.chart.Chart object at 0x624e3c4a8>
Václav_Hlavatý,r_mathematicians,113,"['1894', 1, '27']","Louny, Czech Republic","Louny, okres Louny, Ústecký kraj, Severozápad, Česká republika","('50n3573', '13e7966')",<flatlib.chart.Chart object at 0x624e3c358>
John_Smeaton,r_mathematicians,114,"['1724', 6, '8']","Leeds, England, United Kingdom","Leeds, Yorkshire and the Humber, England, United Kingdom","('53n7974', '1w5438')",<flatlib.chart.Chart object at 0x62478bd30>
Bernhard_Riemann,r_mathematicians,116,"['1826', 9, '17']","Jameln, Germany","Jameln, Samtgemeinde Elbtalaue, Lüchow-Dannenberg, Niedersachsen, 29479, Deutschland","('53n0418', '11e0758')",<flatlib.chart.Chart object at 0x10e6e5048>
Julia_Robinson,r_mathematicians,117,"['1919', 12, '8']","St. Louis, Missouri, United States","City of Saint Louis, Missouri, United States of America","('38n653', '90w2411')",<flatlib.chart.Chart object at 0x6232cc748>
Robert_Burton,r_mathematicians,120,"['1577', 2, '18', '08:55']","Higham on the Hill, England, United Kingdom","Higham on the Hill, Leicestershire, East Midlands, England, CV13 6AH, United Kingdom","('52n5558', '1w4384')",<flatlib.chart.Chart object at 0x1106de2e8>
