name,occupation,count,birthtime,birthplace,location,point,chart
Sharon_Stone,r_actors,1,"['1958', 3, '10', '17:55']","Meadville, Pennsylvania, United States","Meadville, Crawford County, Pennsylvania, United States of America","('41n6414', '80w1514')",<flatlib.chart.Chart object at 0x6253ff2e8>
Bruce_Willis,r_actors,2,"['1955', 3, '19', '18:32']","Idar-Oberstein, Germany","Idar-Oberstein, Landkreis Birkenfeld, Rheinland-Pfalz, 55743, Deutschland","('49n7106', '7e3133')",<flatlib.chart.Chart object at 0x6253ff390>
Julia_Roberts,r_actors,3,"['1967', 10, '28', '00:16']","Atlanta, Georgia, United States","Atlanta, Fulton County, Georgia, United States of America","('33n7491', '84w3902')",<flatlib.chart.Chart object at 0x625405208>
Eddie_Murphy,r_actors,5,"['1961', 4, '3', '13:30']","New York, New York, United States","New York, United States of America","('40n7127', '74w006')",<flatlib.chart.Chart object at 0x625405b00>
Peter_Jackson,r_actors,6,"['1961', 10, '31', '18:45']","Porirua, Wellington, New Zealand","Porirua, Porirua City, Wellington, 5022, New Zealand","('41s1355', '174e8397')",<flatlib.chart.Chart object at 0x625403278>
Denzel_Washington,r_actors,7,"['1954', 12, '28', '00:09']","Mount Vernon, New York, United States","Mount Vernon, Westchester County, New York, 10550, United States of America","('40n9126', '73w8371')",<flatlib.chart.Chart object at 0x625403198>
Ewan_McGregor,r_actors,9,"['1971', 3, '31', '20:10']","Perth, Scotland, United Kingdom","Perth, Perth and Kinross, Scotland, PH1, United Kingdom","('56n3958', '3w4335')",<flatlib.chart.Chart object at 0x6253e0d68>
Liam_Neeson,r_actors,10,"['1952', 6, '7', '21:55']","Ballymena, Ireland","Ballymena, County Antrim, Northern Ireland, BT43 6AH, United Kingdom","('54n8663', '6w276')",<flatlib.chart.Chart object at 0x6253e0710>
Jessica_Lange,r_actors,11,"['1949', 4, '20', '11:00']","Cloquet, Minnesota, United States","Cloquet, Carlton County, Minnesota, United States of America","('46n7216', '92w4594')",<flatlib.chart.Chart object at 0x62540e208>
Bill_Paxton,r_actors,14,"['1955', 5, '17']","Fort Worth, Texas, United States","Fort Worth, Tarrant County, Texas, United States of America","('32n7532', '97w3327')",<flatlib.chart.Chart object at 0x62540e940>
Jeremy_Irons,r_actors,15,"['1948', 9, '19', '02:00']","Cowes, England, United Kingdom","Cowes, Isle of Wight, South East, England, United Kingdom","('50n7576', '1w3036')",<flatlib.chart.Chart object at 0x62540c208>
Maggie_Smith,r_actors,16,"['1934', 12, '28']","Ilford, Essex, United Kingdom","Ilford Court, 9,11,15,9a,11a,15a, Epping Close, Row Heath, Tendring, Essex, East of England, England, CO15 4UZ, United Kingdom","('51n815', '1e154')",<flatlib.chart.Chart object at 0x62540cac8>
Penélope_Cruz,r_actors,18,"['1974', 4, '28', '07:00']","Alcobendas, Spain","Alcobendas, Área metropolitana de Madrid y Corredor del Henares, Comunidad de Madrid, España","('40n54', '3w6358')",<flatlib.chart.Chart object at 0x62540ca20>
Judi_Dench,r_actors,19,"['1934', 12, '9', '19:55']","York, England, United Kingdom","York, Yorkshire and the Humber, England, YO1 8SG, United Kingdom","('53n9591', '1w0815')",<flatlib.chart.Chart object at 0x6253db9b0>
Tommy_Lee_Jones,r_actors,20,"['1946', 9, '15', '22:00']","San Saba, Texas, United States","San Saba County, Texas, United States of America","('31n1223', '98w8397')",<flatlib.chart.Chart object at 0x6253fb208>
Will_Smith,r_actors,21,"['1968', 9, '25', '01:46']","Philadelphia, Pennsylvania, United States","Philadelphia, Philadelphia County, Pennsylvania, United States of America","('39n9527', '75w1635')",<flatlib.chart.Chart object at 0x6253fba20>
Kevin_Kline,r_actors,22,"['1947', 10, '24', '09:11']","St. Louis, Missouri, United States","City of Saint Louis, Missouri, United States of America","('38n653', '90w2411')",<flatlib.chart.Chart object at 0x6253ee160>
Cheech_Marin,r_actors,23,"['1946', 7, '13', '13:00']","Los Angeles, California, United States","Los Angeles, Los Angeles County, California, United States of America","('34n0537', '118w2428')",<flatlib.chart.Chart object at 0x6253eea20>
Danny_Trejo,r_actors,24,"['1944', 5, '16']","Echo Park, Los Angeles, United States","Echo Park, Los Angeles, Los Angeles County, California, 90026-3148, United States of America","('34n078', '118w2568')",<flatlib.chart.Chart object at 0x6253da160>
George_Clooney,r_actors,25,"['1961', 5, '6', '02:58']","Lexington, Kentucky, United States","Lexington, Fayette County, Kentucky, 40508, United States of America","('38n0464', '84w497')",<flatlib.chart.Chart object at 0x6253da9b0>
Andy_Garcia,r_actors,26,"['1956', 4, '12']","Havana, Cuba","La Habana, La Habana Vieja, La Habana, 24000, Cuba","('23n1353', '82w359')",<flatlib.chart.Chart object at 0x62540f208>
Sylvester_Stallone,r_actors,27,"['1946', 7, '6', '19:20']","New York, New York, United States","New York, United States of America","('40n7127', '74w006')",<flatlib.chart.Chart object at 0x62540f9b0>
Arnold_Schwarzenegger,r_actors,28,"['1947', 7, '30', '04:10']","Graz, Austria","Graz, Steiermark, 8011, Österreich","('47n0709', '15e4383')",<flatlib.chart.Chart object at 0x625400240>
Jean-Claude_Van_Damme,r_actors,29,"['1960', 10, '18', '06:45']","Sint-Agatha-Berchem, Belgium","Berchem-Sainte-Agathe - Sint-Agatha-Berchem, Région de Bruxelles-Capitale - Brussels Hoofdstedelijk Gewest, 1082, België - Belgique - Belgien","('50n8649', '4e2947')",<flatlib.chart.Chart object at 0x625400940>
Dolph_Lundgren,r_actors,30,"['1957', 11, '3']","Stockholm, Sweden","Stockholm, Stockholms kommun, Stockholms län, Svealand, 111 29, Sverige","('59n3251', '18e0711')",<flatlib.chart.Chart object at 0x6253f9278>
Jackie_Chan,r_actors,31,"['1954', 4, '7', '09:45']","Hong Kong, Hong Kong","香港 Hong Kong, 中西區 Central and Western District, 香港島 Hong Kong Island, 香港 Hong Kong, 999077, China 中国","('22n2793', '114e1628')",<flatlib.chart.Chart object at 0x6253f9ac8>
Yun-Fat_Chow,r_actors,32,"['1955', 5, '18']","ostrov Lamma, Hong Kong","南丫島 Lamma Island, 離島區 Islands District, 新界 New Territories, 香港 Hong Kong, China 中国","('22n2094', '114e1498')",<flatlib.chart.Chart object at 0x6253f0208>
Donnie_Yen,r_actors,33,"['1963', 7, '27']","Guangzhou, China","广州市, 越秀区, 广州市, 广东省, 510030, China 中国","('23n1302', '113e2593')",<flatlib.chart.Chart object at 0x6253f0a90>
William_Baldwin,r_actors,34,"['1963', 2, '21']","Massapequa, New York, United States","Massapequa, Veterans Blvd, Seaford, Nassau County, New York, 11758, United States of America","('40n677', '73w4683')",<flatlib.chart.Chart object at 0x6253fe160>
Daniel_Baldwin,r_actors,35,"['1960', 10, '5']","Massapequa, New York, United States","Massapequa, Veterans Blvd, Seaford, Nassau County, New York, 11758, United States of America","('40n677', '73w4683')",<flatlib.chart.Chart object at 0x6253fe1d0>
Clint_Eastwood,r_actors,36,"['1930', 5, '31', '17:35']","San Francisco, California, United States","San Francisco, San Francisco City and County, California, United States of America","('37n779', '122w4199')",<flatlib.chart.Chart object at 0x6253f4cc0>
Adam_Baldwin,r_actors,37,"['1962', 2, '27']","Chicago, Illinois, United States","Chicago, Cook County, Illinois, United States of America","('41n8756', '87w6244')",<flatlib.chart.Chart object at 0x6253f46a0>
Stephen_Baldwin,r_actors,38,"['1966', 5, '12']","Massapequa, New York, United States","Massapequa, Veterans Blvd, Seaford, Nassau County, New York, 11758, United States of America","('40n677', '73w4683')",<flatlib.chart.Chart object at 0x6253fa160>
Christopher_Reeve,r_actors,39,"['1952', 9, '25', '03:12']","New York, New York, United States","New York, United States of America","('40n7127', '74w006')",<flatlib.chart.Chart object at 0x6253fa940>
Keanu_Reeves,r_actors,40,"['1964', 9, '2', '05:41']","Beirut, Lebanon","بيروت, رأس بيروت, محافظة بيروت, لبنان  Lebanon","('33n8959', '35e4784')",<flatlib.chart.Chart object at 0x6265efeb8>
Laurence_Fishburne,r_actors,41,"['1961', 7, '30']","Augusta, Georgia, United States","Augusta, Richmond County, Georgia, 30901, United States of America","('33n471', '81w9748')",<flatlib.chart.Chart object at 0x6265eff28>
Bruce_Campbell,r_actors,42,"['1958', 6, '22']","Royal Oak, Michigan, United States","Royal Oak, Oakland County, Michigan, United States of America","('42n4895', '83w1446')",<flatlib.chart.Chart object at 0x626609208>
Boris_Karloff,r_actors,43,"['1887', 11, '23', '10:30']","London, England, United Kingdom","London, Greater London, England, SW1A 2DX, United Kingdom","('51n5073', '0w1276')",<flatlib.chart.Chart object at 0x626609940>
Harrison_Ford,r_actors,45,"['1942', 7, '13', '11:41']","Chicago Heights, Illinois, United States","Chicago Heights, Cook County, Illinois, 60411, United States of America","('41n5063', '87w6357')",<flatlib.chart.Chart object at 0x626609a20>
Jude_Law,r_actors,46,"['1972', 12, '29', '06:00']","London, England, United Kingdom","London, Greater London, England, SW1A 2DX, United Kingdom","('51n5073', '0w1276')",<flatlib.chart.Chart object at 0x6265e4940>
Sam_Neill,r_actors,47,"['1947', 9, '14']","Omagh, Ireland","Omagh, County Tyrone, Northern Ireland, BT78 1DU, United Kingdom","('54n5992', '7w303')",<flatlib.chart.Chart object at 0x6265e4a20>
Richard_Dreyfuss,r_actors,48,"['1947', 10, '29', '18:07']","New York, New York, United States","New York, United States of America","('40n7127', '74w006')",<flatlib.chart.Chart object at 0x6265f9940>
Roy_Scheider,r_actors,49,"['1932', 11, '10']","City of Orange, New Jersey, United States","City of Orange, Essex County, New Jersey, 07050, United States of America","('40n7707', '74w2326')",<flatlib.chart.Chart object at 0x6265dd208>
Sean_Connery,r_actors,50,"['1930', 8, '25', '18:05']","Edinburgh, Scotland, United Kingdom","Edinburgh, City of Edinburgh, Scotland, EH1 3EG, United Kingdom","('55n9533', '3w1884')",<flatlib.chart.Chart object at 0x6265dd940>
Orlando_Bloom,r_actors,52,"['1977', 1, '13', '09:15']","Canterbury, England, United Kingdom","Canterbury, Kent, South East, England, United Kingdom","('51n28', '1e0803')",<flatlib.chart.Chart object at 0x62660ae48>
Cate_Blanchett,r_actors,53,"['1969', 5, '14', '06:40']","Melbourne, Victoria, Australia","City of Melbourne, Victoria, Australia","('37s8142', '144e9632')",<flatlib.chart.Chart object at 0x62660a780>
Linda_Hamilton,r_actors,54,"['1956', 9, '26']","Salisbury, Maryland, United States","Salisbury, Wicomico County, Maryland, United States of America","('38n3662', '75w6009')",<flatlib.chart.Chart object at 0x6265ecf28>
Pierce_Brosnan,r_actors,55,"['1953', 5, '16', '12:05']","Drogheda, Ireland","Drogheda, County Louth, Leinster, A92 EVH6, Ireland","('53n715', '6w3524')",<flatlib.chart.Chart object at 0x6265ec5f8>
Goldie_Hawn,r_actors,56,"['1945', 11, '21', '09:20']","Washington, District of Columbia, United States","Washington, District of Columbia, 20500, United States of America","('38n8949', '77w0366')",<flatlib.chart.Chart object at 0x626607208>
Renée_Zellweger,r_actors,57,"['1969', 4, '25', '14:41']","Baytown, Texas, United States","Baytown, Harris County, Texas, 77520, United States of America","('29n7355', '94w9774')",<flatlib.chart.Chart object at 0x626607a20>
Hugh_Jackman,r_actors,58,"['1968', 10, '12', '13:00']","Sydney, New South Wales, Australia","Council of the City of Sydney, New South Wales, Australia","('33s8889', '151e2049')",<flatlib.chart.Chart object at 0x6265fa278>
Tom_Cruise,r_actors,60,"['1962', 7, '3', '15:06']","Syracuse, New York, United States","Syracuse, Onondaga County, New York, United States of America","('43n0481', '76w1474')",<flatlib.chart.Chart object at 0x6265fab00>
Ian_McKellen,r_actors,61,"['1939', 5, '25', '21:30']","Burnley, England, United Kingdom","Burnley, Lancashire, North West England, England, United Kingdom","('53n7907', '2w2439')",<flatlib.chart.Chart object at 0x6265fd208>
François_Truffaut,r_actors,62,"['1932', 2, '6', '06:00']","Paris, France","Paris, Île-de-France, France métropolitaine, France","('48n8567', '2e3515')",<flatlib.chart.Chart object at 0x6265fd9b0>
Teri_Garr,r_actors,63,"['1944', 12, '11', '09:30']","Lakewood, Ohio, United States","Lakewood, Cuyahoga County, Ohio, 44107, United States of America","('41n482', '81w7982')",<flatlib.chart.Chart object at 0x626603cc0>
Dan_Aykroyd,r_actors,64,"['1952', 7, '1']","Ottawa, Ontario, Canada","Ottawa, Eastern Ontario, Ontario, K1P 1J1, Canada","('45n4211', '75w6903')",<flatlib.chart.Chart object at 0x626603668>
John_Belushi,r_actors,66,"['1949', 1, '25', '05:12']","Chicago, Illinois, United States","Chicago, Cook County, Illinois, United States of America","('41n8756', '87w6244')",<flatlib.chart.Chart object at 0x62660b390>
Christopher_Lee,r_actors,67,"['1922', 5, '27', '14:45']","London, England, United Kingdom","London, Greater London, England, SW1A 2DX, United Kingdom","('51n5073', '0w1276')",<flatlib.chart.Chart object at 0x62660b940>
Peter_Coyote,r_actors,69,"['1941', 10, '10']","New York, New York, United States","New York, United States of America","('40n7127', '74w006')",<flatlib.chart.Chart object at 0x6265fc390>
Drew_Barrymore,r_actors,70,"['1975', 2, '22', '11:51']","Culver City, California, United States","Culver City, Los Angeles County, California, United States of America","('34n0211', '118w3965')",<flatlib.chart.Chart object at 0x6265fca20>
Whoopi_Goldberg,r_actors,71,"['1955', 11, '13', '12:48']","New York, New York, United States","New York, United States of America","('40n7127', '74w006')",<flatlib.chart.Chart object at 0x6265e2ef0>
Morgan_Freeman,r_actors,72,"['1937', 6, '1', '02:00']","Memphis, Tennessee, United States","Memphis, Shelby County, Tennessee, United States of America","('35n149', '90w0516')",<flatlib.chart.Chart object at 0x6265e2f28>
Paul_Newman,r_actors,73,"['1925', 1, '26', '06:30']","Cleveland, Ohio, United States","Cleveland, Cuyahoga County, Ohio, United States of America","('41n5052', '81w6934')",<flatlib.chart.Chart object at 0x6265d7208>
Ben_Affleck,r_actors,74,"['1972', 8, '15', '02:53']","Berkeley, California, United States","Berkeley, Alameda County, California, United States of America","('37n8708', '122w2729')",<flatlib.chart.Chart object at 0x6265d7a20>
Steve_Buscemi,r_actors,75,"['1957', 12, '13']","New York, New York, United States","New York, United States of America","('40n7127', '74w006')",<flatlib.chart.Chart object at 0x62660c208>
Will_Patton,r_actors,76,"['1954', 6, '14']","Washington, District of Columbia, United States","Washington, District of Columbia, 20500, United States of America","('38n8949', '77w0366')",<flatlib.chart.Chart object at 0x62660ca20>
Liv_Tyler,r_actors,77,"['1977', 7, '1', '06:08']","Portland, Maine, United States","Portland, Cumberland County, Maine, United States of America","('43n661', '70w2549')",<flatlib.chart.Chart object at 0x6265e5f98>
Robert_De_Niro,r_actors,78,"['1943', 8, '17', '03:00']","New York, New York, United States","New York, United States of America","('40n7127', '74w006')",<flatlib.chart.Chart object at 0x6265e5780>
Al_Pacino,r_actors,79,"['1940', 4, '25', '11:02']","New York, New York, United States","New York, United States of America","('40n7127', '74w006')",<flatlib.chart.Chart object at 0x6265eb208>
Val_Kilmer,r_actors,80,"['1959', 12, '31', '07:58']","Los Angeles, California, United States","Los Angeles, Los Angeles County, California, United States of America","('34n0537', '118w2428')",<flatlib.chart.Chart object at 0x6265eba20>
Hugo_Weaving,r_actors,82,"['1960', 4, '4']","Ibadan, Nigeria","Ibadan, Ibadan South West, Oyo, 234102, Nigeria","('7n3777', '3e8972')",<flatlib.chart.Chart object at 0x6265eb9e8>
Tim_Robbins,r_actors,83,"['1958', 10, '16', '02:12']","West Covina, California, United States","West Covina, Los Angeles County, California, United States of America","('34n0686', '117w939')",<flatlib.chart.Chart object at 0x6265fe6a0>
Greta_Scacchi,r_actors,84,"['1960', 2, '18', '11:15']","Milan, Italy","Milano, Lombardia, Italia","('45n4668', '9e1905')",<flatlib.chart.Chart object at 0x6265fe6d8>
Fred_Ward,r_actors,85,"['1942', 12, '30', '09:23']","San Diego, California, United States","San Diego, San Diego County, California, United States of America","('32n7174', '117w1628')",<flatlib.chart.Chart object at 0x6265f1a20>
Vincent_D'Onofrio,r_actors,86,"['1959', 6, '30']","New York, New York, United States","New York, United States of America","('40n7127', '74w006')",<flatlib.chart.Chart object at 0x626601128>
Ed_Harris,r_actors,88,"['1950', 11, '28', '05:32']","Englewood Cliffs, New Jersey, United States","Englewood Cliffs, Bergen County, New Jersey, 07632, United States of America","('40n8854', '73w9524')",<flatlib.chart.Chart object at 0x626601a90>
Kurt_Russell,r_actors,89,"['1951', 3, '17', '10:42']","Springfield, Massachusetts, United States","Springfield, Hampden County, Massachusetts, United States of America","('42n1015', '72w5898')",<flatlib.chart.Chart object at 0x626602208>
Nicolas_Cage,r_actors,91,"['1964', 1, '7', '05:30']","Los Angeles, California, United States","Los Angeles, Los Angeles County, California, United States of America","('34n0537', '118w2428')",<flatlib.chart.Chart object at 0x626602a20>
John_Travolta,r_actors,92,"['1954', 2, '18', '14:53']","Englewood Cliffs, New Jersey, United States","Englewood Cliffs, Bergen County, New Jersey, 07632, United States of America","('40n8854', '73w9524')",<flatlib.chart.Chart object at 0x626600208>
Elisabeth_Shue,r_actors,93,"['1963', 10, '6']","Wilmington, Delaware, United States","Wilmington, New Castle County, Delaware, United States of America","('39n7459', '75w5466')",<flatlib.chart.Chart object at 0x626600a58>
Gary_Busey,r_actors,94,"['1944', 6, '29', '11:50']","Baytown, Texas, United States","Baytown, Harris County, Texas, 77520, United States of America","('29n7355', '94w9774')",<flatlib.chart.Chart object at 0x626614208>
Tom_Arnold,r_actors,95,"['1959', 3, '6', '00:50']","Ottumwa, Iowa, United States","Ottumwa, Wapello County, Iowa, United States of America","('41n02', '92w4113')",<flatlib.chart.Chart object at 0x6266141d0>
Jamie_Lee_Curtis,r_actors,96,"['1958', 11, '22', '08:37']","Los Angeles, California, United States","Los Angeles, Los Angeles County, California, United States of America","('34n0537', '118w2428')",<flatlib.chart.Chart object at 0x626615208>
Tony_Curtis,r_actors,97,"['1925', 6, '3', '09:00']","New York, New York, United States","New York, United States of America","('40n7127', '74w006')",<flatlib.chart.Chart object at 0x6266159b0>
John_Cusack,r_actors,98,"['1966', 6, '28']","Evanston, Illinois, United States","Evanston, Cook County, Illinois, United States of America","('42n0447', '87w693')",<flatlib.chart.Chart object at 0x6280b1208>
John_Malkovich,r_actors,99,"['1953', 12, '9', '23:39']","Christopher, Illinois, United States","Christopher, Franklin County, Illinois, 62822, United States of America","('37n9726', '89w0534')",<flatlib.chart.Chart object at 0x6280b1a58>
Cameron_Diaz,r_actors,100,"['1972', 8, '30', '02:53']","San Diego, California, United States","San Diego, San Diego County, California, United States of America","('32n7174', '117w1628')",<flatlib.chart.Chart object at 0x6280cb208>
Jeff_Goldblum,r_actors,101,"['1952', 10, '22', '23:00']","Pittsburgh, Pennsylvania, United States","Pittsburgh, Allegheny County, Pennsylvania, 15262, United States of America","('40n4417', '79w9901')",<flatlib.chart.Chart object at 0x6280cbcc0>
Anjelica_Huston,r_actors,102,"['1951', 7, '8', '18:29']","Santa Monica, California, United States","Santa Monica, Los Angeles County, California, United States of America","('34n0251', '118w4965')",<flatlib.chart.Chart object at 0x6280d2240>
Vin_Diesel,r_actors,104,"['1967', 7, '18', '14:30']","New York, New York, United States","New York, United States of America","('40n7127', '74w006')",<flatlib.chart.Chart object at 0x6280d2a20>
Andie_MacDowell,r_actors,105,"['1958', 4, '21']","Gaffney, South Carolina, United States","Gaffney, Cherokee County, South Carolina, 29342, United States of America","('35n0718', '81w6498')",<flatlib.chart.Chart object at 0x6280b4208>
Malcolm_McDowell,r_actors,106,"['1943', 6, '13']","Leeds, Yorkshire, United Kingdom","Leeds, Yorkshire and the Humber, England, United Kingdom","('53n7974', '1w5438')",<flatlib.chart.Chart object at 0x6280b4940>
Peter_Stormare,r_actors,107,"['1953', 8, '27']","Kumla, Sweden","Kumla kommun, Örebro län, Svealand, Sverige","('59n118', '15e1206')",<flatlib.chart.Chart object at 0x6280b9160>
Burt_Reynolds,r_actors,109,"['1936', 2, '11', '12:10']","Lansing, Michigan, United States","Lansing, Ingham County, Michigan, United States of America","('42n7338', '84w5554')",<flatlib.chart.Chart object at 0x6280b9ac8>
Susan_Sarandon,r_actors,110,"['1946', 10, '4', '14:25']","New York, New York, United States","New York, United States of America","('40n7127', '74w006')",<flatlib.chart.Chart object at 0x6280bb240>
Rod_Steiger,r_actors,111,"['1925', 4, '12']","Westhampton, New York, United States","Westhampton, Suffolk County, New York, 11977, United States of America","('40n8303', '72w6626')",<flatlib.chart.Chart object at 0x6280bba20>
Patrick_Swayze,r_actors,112,"['1952', 8, '18', '08:10']","Houston, Texas, United States","Houston, Harris County, Texas, 77002-5902, United States of America","('29n7589', '95w3677')",<flatlib.chart.Chart object at 0x6280af208>
Julianne_Moore,r_actors,113,"['1960', 12, '3', '17:53']","Fayetteville, North Carolina, United States","Fayetteville, Cumberland County, North Carolina, United States of America","('35n0526', '78w8783')",<flatlib.chart.Chart object at 0x6280afa58>
Anne_Archer,r_actors,114,"['1947', 8, '24', '01:35']","Los Angeles, California, United States","Los Angeles, Los Angeles County, California, United States of America","('34n0537', '118w2428')",<flatlib.chart.Chart object at 0x6280c0208>
Kevin_Costner,r_actors,115,"['1955', 1, '18', '21:40']","Lynwood, California, United States","Lynwood, Los Angeles County, California, United States of America","('33n9248', '118w2024')",<flatlib.chart.Chart object at 0x6280c0a20>
Jennifer_Jason_Leigh,r_actors,116,"['1962', 2, '5', '12:33']","Los Angeles, California, United States","Los Angeles, Los Angeles County, California, United States of America","('34n0537', '118w2428')",<flatlib.chart.Chart object at 0x6280da240>
Chris_Penn,r_actors,117,"['1965', 10, '10']","Los Angeles, California, United States","Los Angeles, Los Angeles County, California, United States of America","('34n0537', '118w2428')",<flatlib.chart.Chart object at 0x6280daa20>
Michael_Madsen,r_actors,118,"['1957', 9, '25']","Chicago, Illinois, United States","Chicago, Cook County, Illinois, United States of America","('41n8756', '87w6244')",<flatlib.chart.Chart object at 0x6280b2208>
Robert_Downey_Jr.,r_actors,119,"['1965', 4, '4', '13:10']","New York, New York, United States","New York, United States of America","('40n7127', '74w006')",<flatlib.chart.Chart object at 0x6280b29b0>
Kenneth_Branagh,r_actors,120,"['1960', 12, '10', '16:50']","Belfast, Northern Ireland, United Kingdom","Belfast, County Antrim, Northern Ireland, BT1 5GS, United Kingdom","('54n5964', '5w9303')",<flatlib.chart.Chart object at 0x6280b29e8>
Frances_McDormand,r_actors,121,"['1957', 6, '23']","Chicago, Illinois, United States","Chicago, Cook County, Illinois, United States of America","('41n8756', '87w6244')",<flatlib.chart.Chart object at 0x6280cca20>
Christopher_Walken,r_actors,122,"['1943', 3, '31']","Queens, United States","Queens, Queens County, New York, United States of America","('40n7498', '73w7976')",<flatlib.chart.Chart object at 0x6280c1208>
Ben_Stiller,r_actors,123,"['1965', 11, '30', '17:35']","New York, New York, United States","New York, United States of America","('40n7127', '74w006')",<flatlib.chart.Chart object at 0x6280c1940>
Owen_Wilson,r_actors,124,"['1968', 11, '18']","Dallas, Texas, United States","Dallas, Dallas County, Texas, United States of America","('32n7763', '96w7969')",<flatlib.chart.Chart object at 0x6280c2ef0>
Milla_Jovovich,r_actors,125,"['1975', 12, '17', '17:15']","Kiev, Ukraine","Київ, Україна","('50n45', '30e5241')",<flatlib.chart.Chart object at 0x6280c2f28>
David_Duchovny,r_actors,126,"['1960', 8, '7']","New York, United States","New York, United States of America","('40n7127', '74w006')",<flatlib.chart.Chart object at 0x6280cf240>
Christian_Slater,r_actors,127,"['1969', 8, '18']","New York, New York, United States","New York, United States of America","('40n7127', '74w006')",<flatlib.chart.Chart object at 0x6280cf940>
Jon_Voight,r_actors,128,"['1938', 12, '29', '11:50']","Yonkers, New York, United States","Yonkers, Westchester County, New York, United States of America","('40n9312', '73w8987')",<flatlib.chart.Chart object at 0x6280c4208>
Stellan_Skarsgård,r_actors,129,"['1951', 6, '13']","Gothenburg, Sweden","Göteborg, Göteborgs Stad, Västra Götalands län, Götaland, Sverige","('57n7072', '11e967')",<flatlib.chart.Chart object at 0x6280c4940>
Natalie_Portman,r_actors,130,"['1981', 6, '9', '15:42']","Jerusalem, Israel","ירושלים, מחוז ירושלים, ישראל","('31n7783', '35e2251')",<flatlib.chart.Chart object at 0x6280cc240>
Wesley_Snipes,r_actors,131,"['1962', 7, '31']","Orlando, Florida, United States","Orlando, Central Boulevard, Thornton Park, Orlando, Orange County, Florida, 32801, United States of America","('28n5421', '81w379')",<flatlib.chart.Chart object at 0x6280c9940>
Winona_Ryder,r_actors,132,"['1971', 10, '29', '11:00']","Rochester, Minnesota, United States","Rochester, Olmsted County, Minnesota, United States of America","('44n0234', '92w463')",<flatlib.chart.Chart object at 0x6280e5f28>
Billy_Zane,r_actors,133,"['1966', 2, '24']","Chicago, Illinois, United States","Chicago, Cook County, Illinois, United States of America","('41n8756', '87w6244')",<flatlib.chart.Chart object at 0x6280e56a0>
