name,occupation,count,birthtime,birthplace,location,point,chart
Nick_Park,r_actors,3660,"['1958', 12, '6']","Preston, England, United Kingdom","Preston, Lancashire, North West England, England, United Kingdom","('53n7593', '2w6993')",<flatlib.chart.Chart object at 0x626a65978>
Brian_Helgeland,r_actors,3661,"['1961', 1, '17']","Providence, Rhode Island, United States","Providence, Providence County, Rhode Island, United States of America","('41n824', '71w4128')",<flatlib.chart.Chart object at 0x626a6a128>
Roger_Spottiswoode,r_actors,3662,"['1945', 1, '5']","Ottawa, Ontario, Canada","Ottawa, Eastern Ontario, Ontario, K1P 1J1, Canada","('45n4211', '75w6903')",<flatlib.chart.Chart object at 0x626a6aa20>
Julie_Taymor,r_actors,3663,"['1952', 12, '15', '10:06']","Newton, Massachusetts, United States","Newton, Massachusetts, 02468, United States of America","('42n337', '71w2092')",<flatlib.chart.Chart object at 0x626a70128>
Gore_Verbinski,r_actors,3664,"['1964', 3, '16']","Oak Ridge, Tennessee, United States","Oak Ridge, Anderson County, Tennessee, United States of America","('36n0104', '84w2696')",<flatlib.chart.Chart object at 0x626a70a58>
Michael_Corrente,r_actors,3666,"['1959', 4, '6']","Pawtucket, Rhode Island, United States","Pawtucket, Providence County, Rhode Island, United States of America","('41n8787', '71w3826')",<flatlib.chart.Chart object at 0x626a741d0>
Franklin_J._Schaffner,r_actors,3667,"['1920', 5, '30']","Tokyo, Japan","東京都, 日本 (Japan)","('35n6828', '139e7595')",<flatlib.chart.Chart object at 0x626a74a58>
Burr_Steers,r_actors,3668,"['1965', 10, '8']","Jackson, Iowa, United States","Jackson County, Iowa, United States of America","('42n142', '90w548')",<flatlib.chart.Chart object at 0x626a7a240>
Stig_Bergqvist,r_actors,3669,"['1962', 4, '28']","Stockholm, Sweden","Stockholm, Stockholms kommun, Stockholms län, Svealand, 111 29, Sverige","('59n3251', '18e0711')",<flatlib.chart.Chart object at 0x626a7aa90>
Gary_Fleder,r_actors,3670,"['1965', 12, '19']","Norfolk, Virginia, United States","Norfolk, Virginia, 23510, United States of America","('36n8463', '76w2929')",<flatlib.chart.Chart object at 0x626ab61d0>
Tony_Goldwyn,r_actors,3671,"['1960', 5, '20']","Los Angeles, California, United States","Los Angeles, Los Angeles County, California, United States of America","('34n0537', '118w2428')",<flatlib.chart.Chart object at 0x626ab69e8>
Stephan_Elliott,r_actors,3672,"['1964', 8, '27']","Sydney, New South Wales, Australia","Council of the City of Sydney, New South Wales, Australia","('33s8889', '151e2049')",<flatlib.chart.Chart object at 0x626aba240>
Mark_Steven_Johnson,r_actors,3673,"['1964', 10, '30']","Hastings, United States","Hastings, Dakota County, Minnesota, 55033, United States of America","('44n7427', '92w8519')",<flatlib.chart.Chart object at 0x626aba160>
Tom_Shadyac,r_actors,3674,"['1958', 12, '11']","Falls Church, United States","Falls Church City, Virginia, United States of America","('38n8823', '77w1711')",<flatlib.chart.Chart object at 0x626ac11d0>
Stephen_Hopkins,r_actors,3675,"['1958', 10, '1']","Jamajka, Jamaica","Jamaica, Spanish Town, Saint Catherine, Middlesex County, Jamaika","('18n1153', '77w1598')",<flatlib.chart.Chart object at 0x626ac1a20>
Rod_Lurie,r_actors,3676,"['1962', 5, '15']","Kiryat Ata, Israel","קרית אתא, מחוז חיפה, ישראל","('32n8116', '35e1164')",<flatlib.chart.Chart object at 0x626ac19e8>
Hal_Ashby,r_actors,3677,"['1929', 9, '2', '00:10']","Ogden, Utah, United States","Ogden, Weber County, Utah, United States of America","('41n223', '111w9738')",<flatlib.chart.Chart object at 0x626ac5198>
John_Frankenheimer,r_actors,3678,"['1930', 2, '19', '13:15']","New York, New York, United States","New York, United States of America","('40n7127', '74w006')",<flatlib.chart.Chart object at 0x626acb1d0>
Michael_Caton-Jones,r_actors,3679,"['1957', 10, '15']","Broxburn, United Kingdom","Broxburn, West Lothian, Scotland, EH52 5AG, United Kingdom","('55n9344', '3w4694')",<flatlib.chart.Chart object at 0x626acb908>
Frank_Oz,r_actors,3680,"['1944', 5, '25']","Hereford, United Kingdom","Hereford, Herefordshire, West Midlands, England, HR1 2NB, United Kingdom","('52n0554', '2w7152')",<flatlib.chart.Chart object at 0x626acf1d0>
Jay_Roach,r_actors,3681,"['1957', 6, '14']","Albuquerque, New Mexico, United States","Albuquerque, Bernalillo County, New Mexico, United States of America","('35n0841', '106w651')",<flatlib.chart.Chart object at 0x626acf9e8>
George_Tillman_Jr.,r_actors,3682,"['1969', 1, '26']","Milwaukee, Wisconsin, United States","Milwaukee, Milwaukee County, Wisconsin, United States of America","('43n035', '87w9225')",<flatlib.chart.Chart object at 0x626ad3128>
James_Mangold,r_actors,3683,"['1963', 12, '16']","New York, New York, United States","New York, United States of America","('40n7127', '74w006')",<flatlib.chart.Chart object at 0x626ad3908>
Jerry_Zaks,r_actors,3684,"['1946', 9, '7']","Stuttgart, Germany","Stuttgart, Baden-Württemberg, Deutschland","('48n7784', '9e18')",<flatlib.chart.Chart object at 0x626ad39e8>
Adrian_Lyne,r_actors,3685,"['1941', 3, '4']","Peterborough, United Kingdom","Peterborough, East of England, England, PE1 1XH, United Kingdom","('52n5726', '0w2427')",<flatlib.chart.Chart object at 0x626ad9978>
Antoine_Fuqua,r_actors,3687,"['1966', 1, '19']","Pittsburgh, Pennsylvania, United States","Pittsburgh, Allegheny County, Pennsylvania, 15262, United States of America","('40n4417', '79w9901')",<flatlib.chart.Chart object at 0x626ad9a20>
Kenneth_Johnson,r_actors,3688,"['1942', 10, '26']","Pine Bluff, Arkansas, United States","Pine Bluff, Jefferson County, Arkansas, United States of America","('34n2157', '92w014')",<flatlib.chart.Chart object at 0x626adf908>
Michael_Lehmann,r_actors,3690,"['1957', 3, '30']","San Francisco, California, United States","San Francisco, San Francisco City and County, California, United States of America","('37n779', '122w4199')",<flatlib.chart.Chart object at 0x626ae4198>
David_Mirkin,r_actors,3691,"['1955', 9, '18']","Philadelphia, Pennsylvania, United States","Philadelphia, Philadelphia County, Pennsylvania, United States of America","('39n9527', '75w1635')",<flatlib.chart.Chart object at 0x626ae49e8>
Gary_Ross,r_actors,3692,"['1956', 11, '3']","Los Angeles, California, United States","Los Angeles, Los Angeles County, California, United States of America","('34n0537', '118w2428')",<flatlib.chart.Chart object at 0x626ae8208>
Mark_L._Lester,r_actors,3693,"['1946', 11, '26']","Cleveland, Ohio, United States","Cleveland, Cuyahoga County, Ohio, United States of America","('41n5052', '81w6934')",<flatlib.chart.Chart object at 0x626ae89e8>
Paul_Michael_Glaser,r_actors,3695,"['1943', 3, '25', '15:25']","Cambridge, Massachusetts, United States","Cambridge, Middlesex County, Massachusetts, United States of America","('42n3751', '71w1056')",<flatlib.chart.Chart object at 0x626ae89b0>
Brian_Levant,r_actors,3696,"['1952', 8, '6']","Highland Park, Illinois, United States","Highland Park, Lake County, Illinois, 60035, United States of America","('42n1817', '87w8003')",<flatlib.chart.Chart object at 0x626aec978>
Edward_Zwick,r_actors,3698,"['1952', 10, '8']","Chicago, Illinois, United States","Chicago, Cook County, Illinois, United States of America","('41n8756', '87w6244')",<flatlib.chart.Chart object at 0x626af1208>
Barry_Primus,r_actors,3699,"['1938', 2, '16']","New York, New York, United States","New York, United States of America","('40n7127', '74w006')",<flatlib.chart.Chart object at 0x626af1908>
Howard_Deutch,r_actors,3700,"['1950', 9, '14']","New York, New York, United States","New York, United States of America","('40n7127', '74w006')",<flatlib.chart.Chart object at 0x626b131d0>
Jan_de_Bont,r_actors,3701,"['1943', 10, '22', '11:10']","Eindhoven, Netherlands","Eindhoven, Noord-Brabant, Nederland","('51n4486', '5e4501')",<flatlib.chart.Chart object at 0x626b13908>
Mel_Smith,r_actors,3702,"['1952', 12, '3']","Chiswick, United Kingdom","Chiswick, London, Greater London, England, W4 5UL, United Kingdom","('51n4923', '0w2638')",<flatlib.chart.Chart object at 0x626b18208>
Lucio_Fulci,r_actors,3703,"['1927', 6, '17']","Rome, Italy","Roma, Roma Capitale, Italia","('41n8933', '12e4829')",<flatlib.chart.Chart object at 0x626b18a90>
Don_Bluth,r_actors,3706,"['1937', 9, '13']","El Paso, Texas, United States","El Paso, El Paso County, Texas, United States of America","('31n7754', '106w4646')",<flatlib.chart.Chart object at 0x626b13ac8>
Jonathan_Kaplan,r_actors,3707,"['1947', 11, '25']","Paris, France","Paris, Île-de-France, France métropolitaine, France","('48n8567', '2e3515')",<flatlib.chart.Chart object at 0x626b1d908>
John_Sturges,r_actors,3708,"['1910', 1, '3']","Oak Park, Illinois, United States","Oak Park, Cook County, Illinois, United States of America","('41n8878', '87w7888')",<flatlib.chart.Chart object at 0x626b23208>
Francis_Veber,r_actors,3709,"['1937', 7, '28', '08:15']","Neuilly-sur-Seine, France","Neuilly-sur-Seine, Arrondissement de Nanterre, Hauts-de-Seine, Île-de-France, France métropolitaine, 92200, France","('48n8847', '2e2696')",<flatlib.chart.Chart object at 0x626b23908>
Brian_Gibson,r_actors,3710,"['1944', 9, '22']","London, England, United Kingdom","London, Greater London, England, SW1A 2DX, United Kingdom","('51n5073', '0w1276')",<flatlib.chart.Chart object at 0x626b281d0>
Lukas_Moodysson,r_actors,3711,"['1969', 1, '17']","Malm, Sweden","Malm, Nyköpings kommun, Södermanlands län, Svealand, Sverige","('58n8755', '16e8137')",<flatlib.chart.Chart object at 0x626b28a90>
Peter_Chelsom,r_actors,3713,"['1956', 4, '20', '09:00']","Blackpool, England, United Kingdom","Blackpool, North West England, England, United Kingdom","('53n8245', '3w0373')",<flatlib.chart.Chart object at 0x626b28978>
Nick_Castle,r_actors,3716,"['1947', 9, '21']","Los Angeles, California, United States","Los Angeles, Los Angeles County, California, United States of America","('34n0537', '118w2428')",<flatlib.chart.Chart object at 0x626b2da58>
Donald_Petrie,r_actors,3717,"['1954', 4, '2']","New York, New York, United States","New York, United States of America","('40n7127', '74w006')",<flatlib.chart.Chart object at 0x626b31208>
Brett_Leonard,r_actors,3718,"['1959', 5, '14']","Toledo, Ohio, United States","Toledo, Lucas County, Ohio, United States of America","('41n6787', '83w5127')",<flatlib.chart.Chart object at 0x626b31a58>
Doug_Liman,r_actors,3719,"['1965', 7, '24']","New York, New York, United States","New York, United States of America","('40n7127', '74w006')",<flatlib.chart.Chart object at 0x626b361d0>
Jordan_Brady,r_actors,3720,"['1964', 8, '10']",United States,United States,"('39n7837', '100w4459')",<flatlib.chart.Chart object at 0x626b369e8>
Anthony_Minghella,r_actors,3721,"['1954', 1, '6']","Ryde, England, United Kingdom","Ryde, Binstead, Isle of Wight, South East, England, United Kingdom","('50n7241', '1w1728')",<flatlib.chart.Chart object at 0x626b3b208>
F._Gary_Gray,r_actors,3722,"['1969', 7, '17']","New York, New York, United States","New York, United States of America","('40n7127', '74w006')",<flatlib.chart.Chart object at 0x626b3b908>
Charles_Haid,r_actors,3723,"['1943', 6, '2']","San Francisco, California, United States","San Francisco, San Francisco City and County, California, United States of America","('37n779', '122w4199')",<flatlib.chart.Chart object at 0x626b40128>
Tarsem_Singh,r_actors,3724,"['1961', 5, '26']","Lucknow, India","Lucknow, Sadar, Lucknow, Uttar Pradesh, 226019, India","('26n8381', '80e9346')",<flatlib.chart.Chart object at 0x626b409b0>
Barry_Sonnenfeld,r_actors,3725,"['1953', 4, '1']","New York, New York, United States","New York, United States of America","('40n7127', '74w006')",<flatlib.chart.Chart object at 0x626b45208>
Tony_Bill,r_actors,3726,"['1940', 8, '23']","San Diego, California, United States","San Diego, San Diego County, California, United States of America","('32n7174', '117w1628')",<flatlib.chart.Chart object at 0x626b459e8>
Kevin_Hooks,r_actors,3727,"['1958', 9, '19']","Philadelphia, Pennsylvania, United States","Philadelphia, Philadelphia County, Pennsylvania, United States of America","('39n9527', '75w1635')",<flatlib.chart.Chart object at 0x626b4a1d0>
Neil_LaBute,r_actors,3728,"['1963', 3, '19']","Detroit, Michigan, United States","Detroit, Wayne County, Michigan, United States of America","('42n3316', '83w0466')",<flatlib.chart.Chart object at 0x626b4a9e8>
Phil_Alden_Robinson,r_actors,3730,"['1950', 3, '1']","Long Beach, New York, United States","Long Beach, Nassau County, New York, 11561, United States of America","('40n5885', '73w6579')",<flatlib.chart.Chart object at 0x626b4f1d0>
Hugh_Wilson,r_actors,3731,"['1943', 8, '21']","Miami, Florida, United States","Miami, Miami-Dade County, Florida, United States of America","('25n7743', '80w1937')",<flatlib.chart.Chart object at 0x626b4f9e8>
Steven_Zaillian,r_actors,3732,"['1953', 1, '30']","Fresno, California, United States","Fresno, Fresno County, California, United States of America","('36n7295', '119w7089')",<flatlib.chart.Chart object at 0x6265921d0>
Richard_Benjamin,r_actors,3733,"['1938', 5, '22', '08:30']","New York, New York, United States","New York, United States of America","('40n7127', '74w006')",<flatlib.chart.Chart object at 0x626592908>
Guy_Hamilton,r_actors,3734,"['1922', 9, '16']","Paris, France","Paris, Île-de-France, France métropolitaine, France","('48n8567', '2e3515')",<flatlib.chart.Chart object at 0x6265929e8>
Jonathan_Lynn,r_actors,3735,"['1943', 4, '3']","Bath, England, United Kingdom","Bath, Bath and North East Somerset, South West England, England, United Kingdom","('51n3814', '2w3597')",<flatlib.chart.Chart object at 0x626597978>
John_Bailey,r_actors,3736,"['1942', 8, '10']","Moberly, United States","Moberly, Randolph County, Missouri, 65270, United States of America","('39n4201', '92w4364')",<flatlib.chart.Chart object at 0x62659e1d0>
Harold_Becker,r_actors,3737,"['1928', 9, '25']","New York, New York, United States","New York, United States of America","('40n7127', '74w006')",<flatlib.chart.Chart object at 0x62659e908>
Stuart_Baird,r_actors,3738,"['1947', 1, '14']","Bolton, England, United Kingdom","Bolton, Greater Manchester, North West England, England, BL1 1RU, United Kingdom","('53n5783', '2w43')",<flatlib.chart.Chart object at 0x6265a21d0>
Ted_Demme,r_actors,3740,"['1963', 10, '26']","New York, New York, United States","New York, United States of America","('40n7127', '74w006')",<flatlib.chart.Chart object at 0x6265a29b0>
Joe_Johnston,r_actors,3741,"['1950', 5, '13']","Fort Worth, Texas, United States","Fort Worth, Tarrant County, Texas, United States of America","('32n7532', '97w3327')",<flatlib.chart.Chart object at 0x6265a71d0>
Robert_Aldrich,r_actors,3742,"['1918', 8, '9']","Cranston, Rhode Island, United States","Cranston, Providence County, Rhode Island, United States of America","('41n781', '71w4371')",<flatlib.chart.Chart object at 0x6265a7198>
Tinto_Brass,r_actors,3743,"['1933', 3, '26', '18:45']","Milan, Italy","Milano, Lombardia, Italia","('45n4668', '9e1905')",<flatlib.chart.Chart object at 0x6265a79e8>
J._Lee_Thompson,r_actors,3744,"['1914', 8, '1']","Bristol, England, United Kingdom","Bristol, City of Bristol, South West England, England, United Kingdom","('51n4538', '2w5973')",<flatlib.chart.Chart object at 0x6265ab978>
Ted_Post,r_actors,3746,"['1918', 3, '31']","New York, New York, United States","New York, United States of America","('40n7127', '74w006')",<flatlib.chart.Chart object at 0x6265b1358>
Joe_Roth,r_actors,3747,"['1948', 6, '13']","New York, New York, United States","New York, United States of America","('40n7127', '74w006')",<flatlib.chart.Chart object at 0x6265b1908>
Charles_Shyer,r_actors,3748,"['1941', 10, '11']","Los Angeles, California, United States","Los Angeles, Los Angeles County, California, United States of America","('34n0537', '118w2428')",<flatlib.chart.Chart object at 0x6265b31d0>
Gillian_Armstrong,r_actors,3751,"['1950', 12, '18']","Melbourne, Victoria, Australia","City of Melbourne, Victoria, Australia","('37s8142', '144e9632')",<flatlib.chart.Chart object at 0x6265b39b0>
Jocelyn_Moorhouse,r_actors,3752,"['1960', 9, '4']","Melbourne, Victoria, Australia","City of Melbourne, Victoria, Australia","('37s8142', '144e9632')",<flatlib.chart.Chart object at 0x6265bb160>
Gérard_Pirès,r_actors,3753,"['1942', 8, '31', '06:00']","Paris, France","Paris, Île-de-France, France métropolitaine, France","('48n8567', '2e3515')",<flatlib.chart.Chart object at 0x6265bb908>
Gérard_Krawczyk,r_actors,3754,"['1953', 5, '17']","Paris, France","Paris, Île-de-France, France métropolitaine, France","('48n8567', '2e3515')",<flatlib.chart.Chart object at 0x6265b3940>
Søren_Kragh-Jacobsen,r_actors,3756,"['1947', 3, '2']","Copenhagen, Denmark","København, Københavns Kommune, Region Hovedstaden, 1357, Danmark","('55n6867', '12e5701')",<flatlib.chart.Chart object at 0x6265c0198>
Martin_Campbell,r_actors,3758,"['1943', 10, '24']","Hastings, New Zealand","Hastings, Hastings District, Hawke's Bay, 4122, New Zealand","('39s6418', '176e8431')",<flatlib.chart.Chart object at 0x6265c0978>
Bob_Rafelson,r_actors,3761,"['1933', 2, '21']","New York, New York, United States","New York, United States of America","('40n7127', '74w006')",<flatlib.chart.Chart object at 0x6265c4a58>
George_Dunning,r_actors,3762,"['1920', 11, '17']","Toronto, Ontario, Canada","Toronto, Golden Horseshoe, Ontario, M5H 2N2, Canada","('43n6535', '79w3839')",<flatlib.chart.Chart object at 0x6265c4a90>
Shekhar_Kapur,r_actors,3763,"['1945', 12, '6']","Lahore, Pakistan","لاہور, Lahore District, پنجاب, 531, پاکستان","('31n5656', '74e3142')",<flatlib.chart.Chart object at 0x6265c9ac8>
Davis_Guggenheim,r_actors,3764,"['1963', 11, '3']","St. Louis, Missouri, United States","City of Saint Louis, Missouri, United States of America","('38n653', '90w2411')",<flatlib.chart.Chart object at 0x6265cd128>
Sally_Potter,r_actors,3765,"['1949', 9, '19']","London, England, United Kingdom","London, Greater London, England, SW1A 2DX, United Kingdom","('51n5073', '0w1276')",<flatlib.chart.Chart object at 0x6265cd908>
Vincent_Gallo,r_actors,3766,"['1961', 4, '11']","Buffalo, New York, United States","Buffalo, Erie County, New York, United States of America","('42n8867', '78w8784')",<flatlib.chart.Chart object at 0x626b7e1d0>
Don_Roos,r_actors,3767,"['1955', 4, '14']","New York, New York, United States","New York, United States of America","('40n7127', '74w006')",<flatlib.chart.Chart object at 0x626b7e908>
Roger_Michell,r_actors,3768,"['1956', 6, '5']","Pretoria, South Africa","Pretoria, City of Tshwane Metropolitan Municipality, Gauteng, 0001, South Africa","('25s7459', '28e1879')",<flatlib.chart.Chart object at 0x626b7e9e8>
Todd_Haynes,r_actors,3770,"['1961', 1, '2', '09:35']","Los Angeles, California, United States","Los Angeles, Los Angeles County, California, United States of America","('34n0537', '118w2428')",<flatlib.chart.Chart object at 0x626b859e8>
Jim_Kouf,r_actors,3771,"['1951', 7, '24']","Los Angeles, California, United States","Los Angeles, Los Angeles County, California, United States of America","('34n0537', '118w2428')",<flatlib.chart.Chart object at 0x626b871d0>
Takeshi_Kitano,r_actors,3772,"['1947', 1, '18']","Tokyo, Japan","東京都, 日本 (Japan)","('35n6828', '139e7595')",<flatlib.chart.Chart object at 0x626b87a58>
Alex_Proyas,r_actors,3773,"['1963', 9, '23']","Le Caire, Egypt","القاهرة, محافظة القاهرة, Egypt / مصر","('30n0488', '31e2437')",<flatlib.chart.Chart object at 0x626b8d208>
Steven_E._de_Souza,r_actors,3774,"['1947', 11, '17']","Philadelphia, Pennsylvania, United States","Philadelphia, Philadelphia County, Pennsylvania, United States of America","('39n9527', '75w1635')",<flatlib.chart.Chart object at 0x626b8d9e8>
John_Stockwell,r_actors,3775,"['1961', 3, '25']","Galveston, Texas, United States","Galveston County, Texas, United States of America","('29n3872', '94w9927')",<flatlib.chart.Chart object at 0x626b911d0>
Mitch_Davis,r_actors,3776,"['1971', 12, '12']",United States,United States,"('39n7837', '100w4459')",<flatlib.chart.Chart object at 0x626b919e8>
Sergio_Martino,r_actors,3777,"['1938', 7, '19']","Rome, Italy","Roma, Roma Capitale, Italia","('41n8933', '12e4829')",<flatlib.chart.Chart object at 0x626b919b0>
Jamie_Uys,r_actors,3780,"['1921', 5, '30']","Boksburg, South Africa","Boksburg, City of Ekurhuleni Metropolitan Municipality, Gauteng, 1460, South Africa","('26s2125', '28e2617')",<flatlib.chart.Chart object at 0x626b98198>
Mamoru_Oshii,r_actors,3781,"['1951', 8, '8']","Tokyo, Japan","東京都, 日本 (Japan)","('35n6828', '139e7595')",<flatlib.chart.Chart object at 0x626b9d208>
John_N._Smith,r_actors,3783,"['1943', 7, '31']","Montreal, Qubec, Canada","Montréal, Agglomération de Montréal, Montréal (06), Québec, Canada","('45n4972', '73w6104')",<flatlib.chart.Chart object at 0x626b9d1d0>
Richard_Eyre,r_actors,3784,"['1943', 3, '28']","Barnstaple, England, United Kingdom","Barnstaple, Devon, South West England, England, EX31 1BN, United Kingdom","('51n0804', '4w06')",<flatlib.chart.Chart object at 0x626ba11d0>
Sergio_Corbucci,r_actors,3785,"['1926', 12, '6']","Rome, Italy","Roma, Roma Capitale, Italia","('41n8933', '12e4829')",<flatlib.chart.Chart object at 0x626ba1ac8>
Irwin_Winkler,r_actors,3787,"['1931', 5, '25']","New York, New York, United States","New York, United States of America","('40n7127', '74w006')",<flatlib.chart.Chart object at 0x626b9db00>
Dennis_Dugan,r_actors,3788,"['1946', 9, '5']","Wheaton, Illinois, United States","Wheaton, DuPage County, Illinois, United States of America","('41n8647', '88w1102')",<flatlib.chart.Chart object at 0x626ba6978>
Herbert_Ross,r_actors,3789,"['1927', 5, '13']","New York, New York, United States","New York, United States of America","('40n7127', '74w006')",<flatlib.chart.Chart object at 0x626bac1d0>
Andrew_Bergman,r_actors,3790,"['1945', 2, '20']","New York, New York, United States","New York, United States of America","('40n7127', '74w006')",<flatlib.chart.Chart object at 0x626bac908>
Richard_Linklater,r_actors,3791,"['1960', 7, '30']","Houston, Texas, United States","Houston, Harris County, Texas, 77002-5902, United States of America","('29n7589', '95w3677')",<flatlib.chart.Chart object at 0x626bb21d0>
Bille_August,r_actors,3792,"['1948', 11, '9']","Brede, Denmark","Brede, Lyngby-Taarbæk Kommune, Region Hovedstaden, 2800, Danmark","('55n7942', '12e4992')",<flatlib.chart.Chart object at 0x626bb2ac8>
Rob_Bowman,r_actors,3793,"['1960', 5, '15']","Wichita Falls, Texas, United States","Wichita Falls, Wichita County, Texas, United States of America","('33n9137', '98w4934')",<flatlib.chart.Chart object at 0x626bb71d0>
Adam_Shankman,r_actors,3794,"['1964', 11, '27']","Los Angeles, California, United States","Los Angeles, Los Angeles County, California, United States of America","('34n0537', '118w2428')",<flatlib.chart.Chart object at 0x626bb79e8>
Alain_Chabat,r_actors,3795,"['1958', 11, '24', '01:30']","Oran, Algeria","Oran, دائرة وهران, وهران, الجزائر","('35n7033', '0w6493')",<flatlib.chart.Chart object at 0x626bbb1d0>
Peter_Howitt,r_actors,3796,"['1957', 5, '5']","Manchester, England, United Kingdom","Manchester, Greater Manchester, North West England, England, United Kingdom","('53n4795', '2w2451')",<flatlib.chart.Chart object at 0x626bbb978>
Tom_DiCillo,r_actors,3798,"['1953', 8, '14']","Camp Lejeune, North Carolina, United States","Camp Lejeune, Piney Green, Jacksonville, Onslow County, North Carolina, United States of America","('34n6835', '77w3415')",<flatlib.chart.Chart object at 0x6266601d0>
Thomas_Vinterberg,r_actors,3799,"['1969', 5, '19']","Copenhagen, Denmark","København, Københavns Kommune, Region Hovedstaden, 1357, Danmark","('55n6867', '12e5701')",<flatlib.chart.Chart object at 0x626660a90>
Henry_Jaglom,r_actors,3801,"['1942', 1, '26', '03:20']","London, England, United Kingdom","London, Greater London, England, SW1A 2DX, United Kingdom","('51n5073', '0w1276')",<flatlib.chart.Chart object at 0x6266609e8>
Hugh_Hudson,r_actors,3802,"['1936', 8, '25']","London, England, United Kingdom","London, Greater London, England, SW1A 2DX, United Kingdom","('51n5073', '0w1276')",<flatlib.chart.Chart object at 0x626666208>
Ken_Loach,r_actors,3803,"['1936', 6, '17']","Nuneaton, England, United Kingdom","Nuneaton, Warwickshire, West Midlands, England, CV11 5AB, United Kingdom","('52n5246', '1w4684')",<flatlib.chart.Chart object at 0x62666b1d0>
Abbas_Kiarostami,r_actors,3804,"['1940', 6, '22']","Tehran, Iran","تهران, بخش مرکزی شهرستان تهران, شهرستان تهران, استان تهران, ایران","('35n7006', '51e4014')",<flatlib.chart.Chart object at 0x62666b9b0>
Jean-Marie_Poiré,r_actors,3805,"['1945', 7, '10', '20:42']","Paris, France","Paris, Île-de-France, France métropolitaine, France","('48n8567', '2e3515')",<flatlib.chart.Chart object at 0x62666b9e8>
David_Twohy,r_actors,3806,"['1955', 10, '18']","Los Angeles, California, United States","Los Angeles, Los Angeles County, California, United States of America","('34n0537', '118w2428')",<flatlib.chart.Chart object at 0x6266709e8>
Cédric_Klapisch,r_actors,3807,"['1961', 9, '4', '06:55']","Neuilly-sur-Seine, France","Neuilly-sur-Seine, Arrondissement de Nanterre, Hauts-de-Seine, Île-de-France, France métropolitaine, 92200, France","('48n8847', '2e2696')",<flatlib.chart.Chart object at 0x6266709b0>
Robert_Schindel,r_actors,3808,"['1944', 4, '4']","Bad Hall, Austria","Bad Hall, Steyr-Land, Oberösterreich, 4540, Österreich","('48n0348', '14e2091')",<flatlib.chart.Chart object at 0x626674ac8>
Chris_Weitz,r_actors,3810,"['1969', 11, '30']","New York, New York, United States","New York, United States of America","('40n7127', '74w006')",<flatlib.chart.Chart object at 0x626679358>
