name,occupation,count,birthtime,birthplace,location,point,chart
Angela_Bassett,r_actors,1077,"['1958', 8, '16', '19:45']","New York, New York, United States","New York, United States of America","('40n7127', '74w006')",<flatlib.chart.Chart object at 0x6256af940>
Jenna_Elfman,r_actors,1079,"['1971', 9, '30', '17:50']","Los Angeles, California, United States","Los Angeles, Los Angeles County, California, United States of America","('34n0537', '118w2428')",<flatlib.chart.Chart object at 0x6256b2390>
Stuart_Townsend,r_actors,1080,"['1972', 12, '15']","Howth, Ireland","Howth, Fingal, County Dublin, Leinster, D13 T1F3, Ireland","('53n3858', '6w0651')",<flatlib.chart.Chart object at 0x6256b2940>
Kate_Bosworth,r_actors,1082,"['1983', 1, '2', '17:55']","Los Angeles, California, United States","Los Angeles, Los Angeles County, California, United States of America","('34n0537', '118w2428')",<flatlib.chart.Chart object at 0x6256b8e80>
Lauren_Graham,r_actors,1083,"['1967', 3, '16', '18:26']","Honolulu, Hawaii, United States","Honolulu, Honolulu County, Hawaii, United States of America","('21n3045', '157w8557')",<flatlib.chart.Chart object at 0x6256b86a0>
Mandy_Moore,r_actors,1084,"['1984', 4, '10', '08:21']","Nashua, New Hampshire, United States","Nashua, Hillsborough County, New Hampshire, United States of America","('42n7654', '71w4676')",<flatlib.chart.Chart object at 0x6256e1ef0>
Peri_Gilpin,r_actors,1085,"['1961', 5, '27', '19:00']","Waco, Texas, United States","Waco, McLennan County, Texas, United States of America","('31n5493', '97w1467')",<flatlib.chart.Chart object at 0x6256e16a0>
Jason_Isaacs,r_actors,1088,"['1963', 6, '6']","Liverpool, England, United Kingdom","Liverpool, North West England, England, United Kingdom","('53n4072', '2w9917')",<flatlib.chart.Chart object at 0x6256b3278>
Radha_Mitchell,r_actors,1089,"['1973', 11, '12']","Melbourne, Victoria, Australia","City of Melbourne, Victoria, Australia","('37s8142', '144e9632')",<flatlib.chart.Chart object at 0x6256b39e8>
Richard_Belzer,r_actors,1090,"['1944', 8, '4', '10:00']","Bridgeport, Connecticut, United States","Bridgeport, Fairfield, Connecticut, United States of America","('41n167', '73w2048')",<flatlib.chart.Chart object at 0x6256d8160>
Gérard_Philipe,r_actors,1091,"['1922', 12, '4', '14:00']","Cannes, France","Cannes, Grasse, Alpes-Maritimes, Provence-Alpes-Côte d'Azur, France métropolitaine, France","('43n5515', '7e0134')",<flatlib.chart.Chart object at 0x6256d89b0>
Rip_Torn,r_actors,1092,"['1931', 2, '6', '02:35']","Temple, Texas, United States","Temple, Bell County, Texas, United States of America","('31n0982', '97w3428')",<flatlib.chart.Chart object at 0x6256c1240>
Jean_Marais,r_actors,1093,"['1913', 12, '11', '12:30']","Cherbourg-Octeville, France","Cherbourg-Octeville, Cherbourg-en-Cotentin, Cherbourg, Manche, Normandie, France métropolitaine, 50100, France","('49n6344', '1w6286')",<flatlib.chart.Chart object at 0x6256c1940>
Rob_Morrow,r_actors,1094,"['1962', 9, '21']","New Rochelle, New York, United States","New Rochelle, Westchester County, New York, United States of America","('40n9115', '73w7826')",<flatlib.chart.Chart object at 0x6256e3208>
Cybill_Shepherd,r_actors,1095,"['1950', 2, '18', '19:52']","Memphis, Tennessee, United States","Memphis, Shelby County, Tennessee, United States of America","('35n149', '90w0516')",<flatlib.chart.Chart object at 0x6256e31d0>
James_Brolin,r_actors,1096,"['1940', 7, '18', '11:10']","Los Angeles, California, United States","Los Angeles, Los Angeles County, California, United States of America","('34n0537', '118w2428')",<flatlib.chart.Chart object at 0x6256df208>
Brenda_Vaccaro,r_actors,1097,"['1939', 11, '18', '16:39']","New York, New York, United States","New York, United States of America","('40n7127', '74w006')",<flatlib.chart.Chart object at 0x6256df940>
O._J._Simpson,r_actors,1099,"['1947', 7, '9', '08:08']","San Francisco, California, United States","San Francisco, San Francisco City and County, California, United States of America","('37n779', '122w4199')",<flatlib.chart.Chart object at 0x6256d2f28>
Hal_Holbrook,r_actors,1100,"['1925', 2, '17', '03:16']","Cleveland Heights, Ohio, United States","Cleveland Heights, Cuyahoga County, Ohio, 44118, United States of America","('41n5201', '81w5562')",<flatlib.chart.Chart object at 0x6256d26a0>
Michel_Galabru,r_actors,1104,"['1922', 10, '27', '01:00']","Sf, Morocco","SF 6, Jdiriya ⵊⴷⵉⵢⵔⵉⵢⴰ اجديرية, caïdat de Jdiriya قيادة اجديرية, cercle de Es-Semara دائرة السمارة, Province d'Es-Semara إقليم السمارة, Maroc","('26n9691', '9w2449')",<flatlib.chart.Chart object at 0x6256c1b00>
Dylan_McDermott,r_actors,1105,"['1961', 10, '26', '13:54']","Waterbury, Connecticut, United States","Waterbury, New Haven County, Connecticut, United States of America","('41n5538', '73w0438')",<flatlib.chart.Chart object at 0x6256c86a0>
Kathryn_Grayson,r_actors,1106,"['1922', 2, '9', '13:30']","Winston-Salem, North Carolina, United States","Winston-Salem, Forsyth County, North Carolina, United States of America","('36n0998', '80w2441')",<flatlib.chart.Chart object at 0x6244e7240>
Bob_Fosse,r_actors,1107,"['1927', 6, '23', '22:29']","Chicago Heights, Illinois, United States","Chicago Heights, Cook County, Illinois, 60411, United States of America","('41n5063', '87w6357')",<flatlib.chart.Chart object at 0x6244e7a20>
Tom_Laughlin,r_actors,1108,"['1931', 8, '10', '17:55']","Minneapolis, Minnesota, United States","Minneapolis, Hennepin County, Minnesota, United States of America","('44n9773', '93w2655')",<flatlib.chart.Chart object at 0x62450cf28>
Mercedes_McCambridge,r_actors,1109,"['1918', 3, '17', '05:00']","Joliet, Illinois, United States","Joliet, Will County, Illinois, United States of America","('41n5264', '88w084')",<flatlib.chart.Chart object at 0x62450c780>
Yves_Montand,r_actors,1111,"['1921', 10, '13', '23:59']","Monsummano Terme, Italy","Monsummano Terme, Pistoia, Toscana, 51015, Italia","('43n8707', '10e814')",<flatlib.chart.Chart object at 0x6256c8dd8>
Jean_Rochefort,r_actors,1112,"['1930', 4, '29', '11:00']","Paris, France","Paris, Île-de-France, France métropolitaine, France","('48n8567', '2e3515')",<flatlib.chart.Chart object at 0x6244d3780>
Thomas_Gottschalk,r_actors,1113,"['1950', 5, '18', '17:00']","Bamberg, Germany","Bamberg, Bayern, 96047, Deutschland","('49n8916', '10e8868')",<flatlib.chart.Chart object at 0x6244d3668>
Dominique_Swain,r_actors,1114,"['1980', 8, '12', '12:15']","Santa Monica, California, United States","Santa Monica, Los Angeles County, California, United States of America","('34n0251', '118w4965')",<flatlib.chart.Chart object at 0x6244dca20>
Michèle_Mercier,r_actors,1116,"['1939', 1, '1', '04:30']","Nice, France","Nice, Alpes-Maritimes, Provence-Alpes-Côte d'Azur, France métropolitaine, France","('43n7009', '7e2684')",<flatlib.chart.Chart object at 0x6244dc9e8>
Patrick_Dempsey,r_actors,1118,"['1966', 1, '13']","Lewiston, Maine, United States","Lewiston, Androscoggin County, Maine, United States of America","('44n1004', '70w2148')",<flatlib.chart.Chart object at 0x6244dea20>
Liselotte_Pulver,r_actors,1119,"['1929', 10, '11', '04:30']","Bern, Switzerland","Bern, Verwaltungskreis Bern-Mittelland, Verwaltungsregion Bern-Mittelland, Bern/Berne, Switzerland","('46n9483', '7e4515')",<flatlib.chart.Chart object at 0x6244deb38>
Miguel_Ferrer,r_actors,1120,"['1955', 2, '7', '01:33']","Santa Monica, California, United States","Santa Monica, Los Angeles County, California, United States of America","('34n0251', '118w4965')",<flatlib.chart.Chart object at 0x6244d9a58>
Gina_Lollobrigida,r_actors,1121,"['1927', 7, '4', '03:00']","Subiaco, Italy","Subiaco, Roma Capitale, 00028, Italia","('41n9267', '13e0944')",<flatlib.chart.Chart object at 0x6244d9a20>
James_Whitmore,r_actors,1123,"['1921', 10, '1', '08:30']","White Plains, New York, United States","White Plains, Westchester County, New York, United States of America","('41n034', '73w7629')",<flatlib.chart.Chart object at 0x6244f99b0>
Maria_Schneider,r_actors,1124,"['1952', 2, '27', '21:00']","Paris, France","Paris, Île-de-France, France métropolitaine, France","('48n8567', '2e3515')",<flatlib.chart.Chart object at 0x6244f9a90>
Crispin_Glover,r_actors,1125,"['1964', 4, '20', '06:00']","New York, New York, United States","New York, United States of America","('40n7127', '74w006')",<flatlib.chart.Chart object at 0x6244f7940>
Bernard_Blier,r_actors,1126,"['1916', 1, '11', '09:00']","Buenos Aires, Argentina","Buenos Aires, Ciudad Autónoma de Buenos Aires, Argentina","('34s6076', '58w4371')",<flatlib.chart.Chart object at 0x6244f6278>
Olivia_Hussey,r_actors,1127,"['1951', 4, '17', '06:40']","Buenos Aires, Argentina","Buenos Aires, Ciudad Autónoma de Buenos Aires, Argentina","('34s6076', '58w4371')",<flatlib.chart.Chart object at 0x6244f6198>
Klaus_Maria_Brandauer,r_actors,1128,"['1943', 6, '22', '20:45']","Bad Aussee, Austria","Bad Aussee, Liezen, Steiermark, 8990, Österreich","('47n6095', '13e7832')",<flatlib.chart.Chart object at 0x6244fb320>
Nigel_Hawthorne,r_actors,1130,"['1929', 4, '5', '07:00']","Coventry, England, United Kingdom","Coventry, West Midlands Combined Authority, West Midlands, England, United Kingdom","('52n4082', '1w5105')",<flatlib.chart.Chart object at 0x6244fb9b0>
Lindsay_Crouse,r_actors,1131,"['1948', 5, '12', '23:46']","New York, New York, United States","New York, United States of America","('40n7127', '74w006')",<flatlib.chart.Chart object at 0x6244e0208>
Rufus_Sewell,r_actors,1133,"['1967', 10, '29']","Twickenham, England, United Kingdom","Twickenham, London Borough of Richmond upon Thames, London, Greater London, England, TW1 3RZ, United Kingdom","('51n4467', '0w3282')",<flatlib.chart.Chart object at 0x6244e0a20>
Sam_Rockwell,r_actors,1135,"['1968', 11, '5']","Daly City, California, United States","Daly City, San Mateo County, California, United States of America","('37n6905', '122w4727')",<flatlib.chart.Chart object at 0x62450e2e8>
Tony_Shalhoub,r_actors,1136,"['1953', 10, '9', '23:50']","Green Bay, Wisconsin, United States","Green Bay, Brown County, Wisconsin, United States of America","('44n5126', '88w0126')",<flatlib.chart.Chart object at 0x62450ea58>
Billy_Connolly,r_actors,1137,"['1942', 11, '24', '04:30']","Glasgow, Scotland, United Kingdom","Glasgow, Glasgow City, Scotland, G2 9SA, United Kingdom","('55n861', '4w2489')",<flatlib.chart.Chart object at 0x6244cf240>
Linda_Fiorentino,r_actors,1139,"['1958', 3, '9']","Philadelphia, Pennsylvania, United States","Philadelphia, Philadelphia County, Pennsylvania, United States of America","('39n9527', '75w1635')",<flatlib.chart.Chart object at 0x6244cf9b0>
Irving_Berlin,r_actors,1140,"['1888', 5, '11', '07:45']","Mohylev, Belarus","Могилёв, Могилёвская область, Беларусь","('53n909', '30e343')",<flatlib.chart.Chart object at 0x6244cfb00>
Giulietta_Masina,r_actors,1141,"['1921', 2, '22', '08:15']","San Giorgio di Piano, Italy","San Giorgio di Piano, Unione Reno Galliera, Bologna, Emilia-Romagna, Italia","('44n6468', '11e3754')",<flatlib.chart.Chart object at 0x6251caac8>
Shannyn_Sossamon,r_actors,1142,"['1978', 10, '3']","Honolulu, Hawaii, United States","Honolulu, Honolulu County, Hawaii, United States of America","('21n3045', '157w8557')",<flatlib.chart.Chart object at 0x6251cd240>
Harry_Belafonte,r_actors,1143,"['1927', 3, '1', '10:30']","New York, New York, United States","New York, United States of America","('40n7127', '74w006')",<flatlib.chart.Chart object at 0x6251cd9b0>
Robert_Urich,r_actors,1144,"['1946', 12, '19', '21:40']","Toronto, Ohio, United States","Toronto, Jefferson County, Ohio, United States of America","('40n4642', '80w6009')",<flatlib.chart.Chart object at 0x6251d9208>
Emil_Jannings,r_actors,1145,"['1884', 7, '23', '03:30']","Rorschach, Switzerland","Rorschach, Wahlkreis Rorschach, Sankt Gallen, 9400, Switzerland","('47n478', '9e4914')",<flatlib.chart.Chart object at 0x6251d99e8>
Janet_Gaynor,r_actors,1146,"['1906', 10, '6', '04:00']","Philadelphia, Pennsylvania, United States","Philadelphia, Philadelphia County, Pennsylvania, United States of America","('39n9527', '75w1635')",<flatlib.chart.Chart object at 0x6251db240>
Jean-Claude_Brialy,r_actors,1147,"['1933', 3, '30', '08:00']","Sour El-Ghozlane, Algeria","Sour El Ghozlane, Daïra Sour El Ghozlane, Bouira - البويرة, الجزائر","('36n1474', '3e6918')",<flatlib.chart.Chart object at 0x6251db940>
Patrick_Dewaere,r_actors,1148,"['1947', 1, '26', '10:30']","Saint-Brieuc, France","Saint-Brieuc, Côtes-d'Armor, Bretagne, France métropolitaine, 22000, France","('48n5142', '2w7603')",<flatlib.chart.Chart object at 0x6251dba20>
Natasha_Richardson,r_actors,1149,"['1963', 5, '11', '17:00']","London, England, United Kingdom","London, Greater London, England, SW1A 2DX, United Kingdom","('51n5073', '0w1276')",<flatlib.chart.Chart object at 0x6251d0940>
Anouk_Aimée,r_actors,1150,"['1932', 4, '27', '12:00']","Paris, France","Paris, Île-de-France, France métropolitaine, France","('48n8567', '2e3515')",<flatlib.chart.Chart object at 0x6251d0a20>
Tracey_Ullman,r_actors,1151,"['1959', 12, '30', '03:15']","Slough, England, United Kingdom","Slough, South East, England, United Kingdom","('51n5034', '0w5749')",<flatlib.chart.Chart object at 0x6251ce940>
Sally_Kellerman,r_actors,1152,"['1937', 6, '2', '07:37']","Long Beach, California, United States","Long Beach, Los Angeles County, California, United States of America","('33n769', '118w1916')",<flatlib.chart.Chart object at 0x6251e6160>
Moritz_Bleibtreu,r_actors,1153,"['1971', 8, '13']","Munich, Germany","München, Bayern, Deutschland","('48n1371', '11e5754')",<flatlib.chart.Chart object at 0x6251e6a58>
Richard_Anconina,r_actors,1154,"['1953', 1, '28', '10:45']","Paris, France","Paris, Île-de-France, France métropolitaine, France","('48n8567', '2e3515')",<flatlib.chart.Chart object at 0x6251cea20>
Farrah_Fawcett,r_actors,1155,"['1947', 2, '2', '15:10']","Corpus Christi, Texas, United States","Corpus Christi, Nueces County, Texas, United States of America","('27n7477', '97w4014')",<flatlib.chart.Chart object at 0x6251d4a58>
Marlène_Jobert,r_actors,1157,"['1940', 11, '4', '18:15']","Algiers, Algeria","Algiers, Sidi M'Hamed, Alger, 16007, الجزائر","('36n7754', '3e0602')",<flatlib.chart.Chart object at 0x625204198>
Gérard_Barray,r_actors,1158,"['1931', 11, '2', '16:15']","Toulouse, France","Toulouse, Haute-Garonne, Occitanie, France métropolitaine, France","('43n6045', '1e4442')",<flatlib.chart.Chart object at 0x6252049b0>
Julien_Guiomar,r_actors,1159,"['1928', 5, '3', '17:00']","Morlaix, France","Morlaix, Finistère, Bretagne, France métropolitaine, 29600, France","('48n5825', '3w8332')",<flatlib.chart.Chart object at 0x6251d4a20>
Miou-Miou,r_actors,1161,"['1950', 2, '22', '10:45']","Paris, France","Paris, Île-de-France, France métropolitaine, France","('48n8567', '2e3515')",<flatlib.chart.Chart object at 0x6251f2978>
Luke_Wilson,r_actors,1162,"['1971', 9, '21']","Dallas, Texas, United States","Dallas, Dallas County, Texas, United States of America","('32n7763', '96w7969')",<flatlib.chart.Chart object at 0x6251f0208>
Julie_Walters,r_actors,1163,"['1950', 2, '22', '15:00']","Smethwick, England, United Kingdom","Smethwick, West Midlands Combined Authority, West Midlands, England, B67 7QX, United Kingdom","('52n4968', '1w9739')",<flatlib.chart.Chart object at 0x6251f0940>
Warner_Baxter,r_actors,1164,"['1889', 3, '29', '19:20']","Columbus, Ohio, United States","Columbus, Franklin County, Ohio, United States of America","('39n9623', '83w0007')",<flatlib.chart.Chart object at 0x625203208>
Valeria_Golino,r_actors,1165,"['1965', 10, '22', '08:45']","Naples, Italy","Napoli, Campania, Italia","('40n8359', '14e2488')",<flatlib.chart.Chart object at 0x625203ac8>
Ian_Richardson,r_actors,1166,"['1934', 4, '7', '22:35']","Edinburgh, Scotland, United Kingdom","Edinburgh, City of Edinburgh, Scotland, EH1 3EG, United Kingdom","('55n9533', '3w1884')",<flatlib.chart.Chart object at 0x10fc7c240>
Martin_Shaw,r_actors,1167,"['1945', 1, '21', '09:15']","Birmingham, England, United Kingdom","Birmingham, West Midlands Combined Authority, West Midlands, England, United Kingdom","('52n4797', '1w9027')",<flatlib.chart.Chart object at 0x10fc7c940>
Rupert_Everett,r_actors,1168,"['1959', 5, '29', '15:45']","Burnham Deepdale, England, United Kingdom","Burnham Deepdale, Norfolk, East of England, England, PE31 8FB, United Kingdom","('52n9658', '0e6836')",<flatlib.chart.Chart object at 0x10fc9e198>
Robert_Hutton,r_actors,1169,"['1920', 6, '11', '15:00']","Kingston, New York, United States","Kingston, Ulster County, New York, 12401, United States of America","('41n9288', '74w0024')",<flatlib.chart.Chart object at 0x10fc9ea20>
Jon_Favreau,r_actors,1170,"['1966', 10, '19']","New York, New York, United States","New York, United States of America","('40n7127', '74w006')",<flatlib.chart.Chart object at 0x10fc81208>
Kieran_Culkin,r_actors,1171,"['1982', 9, '30']","New York, New York, United States","New York, United States of America","('40n7127', '74w006')",<flatlib.chart.Chart object at 0x10fc81940>
Dorothy_Dandridge,r_actors,1172,"['1922', 11, '9', '22:35']","Cleveland, Ohio, United States","Cleveland, Cuyahoga County, Ohio, United States of America","('41n5052', '81w6934')",<flatlib.chart.Chart object at 0x10fc92eb8>
Frances_Farmer,r_actors,1173,"['1913', 9, '19', '04:45']","Seattle, Washington, United States","Seattle, King County, Washington, United States of America","('47n6038', '122w3301')",<flatlib.chart.Chart object at 0x10fc926a0>
Gertrude_Lawrence,r_actors,1174,"['1898', 7, '4', '10:30']","London, England, United Kingdom","London, Greater London, England, SW1A 2DX, United Kingdom","('51n5073', '0w1276')",<flatlib.chart.Chart object at 0x10fc87240>
Lon_Chaney,r_actors,1175,"['1883', 4, '1', '07:24']","Colorado Springs, Colorado, United States","Colorado Springs, El Paso County, Colorado, United States of America","('38n834', '104w8253')",<flatlib.chart.Chart object at 0x10fc87208>
Ray_Milland,r_actors,1176,"['1907', 1, '3', '12:30']","Neath, Wales, United Kingdom","Neath, West Glamorgan, Wales, SA11 1DU, United Kingdom","('51n6628', '3w8039')",<flatlib.chart.Chart object at 0x624fe9d30>
Sharon_Tate,r_actors,1177,"['1943', 1, '24', '17:47']","Dallas, Texas, United States","Dallas, Dallas County, Texas, United States of America","('32n7763', '96w7969')",<flatlib.chart.Chart object at 0x10fc7d4e0>
Tallulah_Bankhead,r_actors,1179,"['1902', 1, '31', '21:00']","Huntsville, Alabama, United States","Huntsville, Madison County, Alabama, United States of America","('34n7298', '86w5859')",<flatlib.chart.Chart object at 0x10fc7de48>
Theda_Bara,r_actors,1180,"['1890', 7, '20', '22:45']","Cincinnati, Ohio, United States","Cincinnati, Hamilton County, Ohio, United States of America","('39n1015', '84w5125')",<flatlib.chart.Chart object at 0x10fc9b470>
Michael_Rooker,r_actors,1181,"['1955', 4, '6', '02:02']","Jasper, Alabama, United States","Jasper, Walker County, Alabama, United States of America","('33n8312', '87w2775')",<flatlib.chart.Chart object at 0x10fc9bd30>
George_Arliss,r_actors,1183,"['1868', 4, '10', '00:30']","London, England, United Kingdom","London, Greater London, England, SW1A 2DX, United Kingdom","('51n5073', '0w1276')",<flatlib.chart.Chart object at 0x10fc9bcf8>
Esai_Morales,r_actors,1184,"['1962', 10, '1', '17:59']","New York, New York, United States","New York, United States of America","('40n7127', '74w006')",<flatlib.chart.Chart object at 0x10fc88518>
Joan_Collins,r_actors,1185,"['1933', 5, '23', '03:00']","London, England, United Kingdom","London, Greater London, England, SW1A 2DX, United Kingdom","('51n5073', '0w1276')",<flatlib.chart.Chart object at 0x10fcae4e0>
Jacques_Weber,r_actors,1187,"['1949', 8, '23', '06:50']","Paris, France","Paris, Île-de-France, France métropolitaine, France","('48n8567', '2e3515')",<flatlib.chart.Chart object at 0x10fcaed68>
Haing_S._Ngor,r_actors,1188,"['1940', 3, '22', '12:30']","Samrong, Cambodia","Samrong Meanchey, ភូមិសែនសុខទី ៦, សង្កាត់ឃ្មួញ, ខណ្ឌសែនសុខ, រាជធានីភ្នំពេញ, 12000, Cambodia","('11n6188', '104e8474')",<flatlib.chart.Chart object at 0x10fca04e0>
Roseanne_Barr,r_actors,1190,"['1952', 11, '3', '13:21']","Salt Lake City, Utah, United States","Salt Lake City, Utah, United States of America","('40n7596', '111w8868')",<flatlib.chart.Chart object at 0x10fca0cf8>
Alida_Valli,r_actors,1191,"['1921', 5, '31', '04:30']","Pula, Croatia","Grad Pula, Istarska županija, Hrvatska","('44n8702', '13e8455')",<flatlib.chart.Chart object at 0x10fca2518>
Tim_Holt,r_actors,1192,"['1919', 2, '5', '03:40']","Los Angeles, California, United States","Los Angeles, Los Angeles County, California, United States of America","('34n0537', '118w2428')",<flatlib.chart.Chart object at 0x10fca2d30>
Gloria_Swanson,r_actors,1193,"['1899', 3, '27', '00:20']","Chicago, Illinois, United States","Chicago, Cook County, Illinois, United States of America","('41n8756', '87w6244')",<flatlib.chart.Chart object at 0x10fc954e0>
Erich_von_Stroheim,r_actors,1194,"['1885', 9, '22', '08:47']","Vienna, Austria","Wien, 1010, Österreich","('48n2084', '16e3725')",<flatlib.chart.Chart object at 0x10fc95cc0>
Nancy_Olson,r_actors,1195,"['1928', 7, '14', '20:45']","Milwaukee, Wisconsin, United States","Milwaukee, Milwaukee County, Wisconsin, United States of America","('43n035', '87w9225')",<flatlib.chart.Chart object at 0x10fcb7438>
Jack_Webb,r_actors,1196,"['1920', 4, '2', '21:30']","Santa Monica, California, United States","Santa Monica, Los Angeles County, California, United States of America","('34n0251', '118w4965')",<flatlib.chart.Chart object at 0x10fcb7d30>
John_Mills,r_actors,1198,"['1908', 2, '22', '02:00']","Norfolk, England, United Kingdom","Norfolk, East of England, England, United Kingdom","('52n6667', '1e0')",<flatlib.chart.Chart object at 0x10fcab470>
Robert_Urquhart,r_actors,1199,"['1921', 10, '16', '04:00']","Ullapool, Scotland, United Kingdom","Ullapool, Highland, Scotland, IV26 2XE, United Kingdom","('57n8978', '5w1587')",<flatlib.chart.Chart object at 0x10fcabc18>
Ursula_Andress,r_actors,1200,"['1936', 3, '19', '13:00']","Bern, Switzerland","Bern, Verwaltungskreis Bern-Mittelland, Verwaltungsregion Bern-Mittelland, Bern/Berne, Switzerland","('46n9483', '7e4515')",<flatlib.chart.Chart object at 0x10fcabcf8>
Catherine_Breillat,r_actors,1201,"['1948', 7, '13', '20:15']","Bressuire, France","Bressuire, Deux-Sèvres, Nouvelle-Aquitaine, France métropolitaine, 79300, France","('46n8426', '0w4929')",<flatlib.chart.Chart object at 0x10fcb6c18>
Rebecca_Romijn,r_actors,1202,"['1972', 11, '6', '11:38']","Oakland, California, United States","Oakland, Alameda County, California, United States of America","('37n8045', '122w2714')",<flatlib.chart.Chart object at 0x6268b8518>
Samantha_Morton,r_actors,1203,"['1977', 5, '13', '12:00']","Nottingham, England, United Kingdom","City of Nottingham, East Midlands, England, United Kingdom","('52n9534', '1w1496')",<flatlib.chart.Chart object at 0x6268b8c18>
Julie_Delpy,r_actors,1204,"['1969', 12, '21', '22:40']","Paris, France","Paris, Île-de-France, France métropolitaine, France","('48n8567', '2e3515')",<flatlib.chart.Chart object at 0x6268b8c88>
Pierre_Arditi,r_actors,1205,"['1944', 12, '1', '05:50']","Paris, France","Paris, Île-de-France, France métropolitaine, France","('48n8567', '2e3515')",<flatlib.chart.Chart object at 0x6268bb438>
Sabine_Azéma,r_actors,1206,"['1949', 9, '20', '01:30']","Paris, France","Paris, Île-de-France, France métropolitaine, France","('48n8567', '2e3515')",<flatlib.chart.Chart object at 0x6268bb2b0>
Agathe_de_La_Fontaine,r_actors,1207,"['1972', 3, '27', '10:50']","Dieppe, France","Dieppe, Seine-Maritime, Normandie, France métropolitaine, 76200, France","('49n9246', '1e0791')",<flatlib.chart.Chart object at 0x6268a5c18>
Emmanuelle_Seigner,r_actors,1208,"['1966', 6, '22', '18:35']","Paris, France","Paris, Île-de-France, France métropolitaine, France","('48n8567', '2e3515')",<flatlib.chart.Chart object at 0x6268a5d30>
Andy_Kaufman,r_actors,1210,"['1949', 1, '17', '18:03']","New York, New York, United States","New York, United States of America","('40n7127', '74w006')",<flatlib.chart.Chart object at 0x6268b9d30>
Vanessa_A._Williams,r_actors,1212,"['1963', 5, '12']","New York, New York, United States","New York, United States of America","('40n7127', '74w006')",<flatlib.chart.Chart object at 0x6268b4668>
Simone_Signoret,r_actors,1213,"['1921', 3, '25', '02:30']","Wiesbaden, Germany","Wiesbaden, Hessen, 65183, Deutschland","('50n082', '8e2417')",<flatlib.chart.Chart object at 0x6268b4d30>
Robert_Altman,r_actors,1214,"['1925', 2, '20', '00:01']","Kansas City, Missouri, United States","Kansas City, Jackson County, Missouri, United States of America","('39n1001', '94w5781')",<flatlib.chart.Chart object at 0x6268ae4e0>
Jean-Jacques_Annaud,r_actors,1215,"['1943', 10, '1', '21:40']","Juvisy-sur-Orge, France","Juvisy-sur-Orge, Palaiseau, Essonne, Île-de-France, France métropolitaine, 91260, France","('48n6904', '2e3738')",<flatlib.chart.Chart object at 0x6268aec88>
Dario_Argento,r_actors,1216,"['1940', 9, '7', '14:00']","Rome, Italy","Roma, Roma Capitale, Italia","('41n8933', '12e4829')",<flatlib.chart.Chart object at 0x6268b9cf8>
Mario_Bava,r_actors,1217,"['1914', 7, '30', '19:30']","Sanremo, Italy","Sanremo, Imperia, Liguria, 18038, Italia","('43n8198', '7e7749')",<flatlib.chart.Chart object at 0x62688fc18>
Luc_Besson,r_actors,1218,"['1959', 3, '18', '13:45']","Paris, France","Paris, Île-de-France, France métropolitaine, France","('48n8567', '2e3515')",<flatlib.chart.Chart object at 0x62688fdd8>
