name,occupation,count,birthtime,birthplace,location,point,chart
Roger_Pierre,r_script-writers,3625,"['1923', 8, '30', '20:25']","Paris, France","Paris, Île-de-France, France métropolitaine, France","('48n8567', '2e3515')",<flatlib.chart.Chart object at 0x625f05cf8>
Jukka_Kärkkäinen,r_script-writers,3626,"['1972', 1, '20']","Kerava, Finland","Kerava, Helsingin seutukunta, Uusimaa, Manner-Suomi, Suomi","('60n4034', '25e1041')",<flatlib.chart.Chart object at 0x625f0a5f8>
Paul_Duddridge,r_script-writers,3627,"['1966', 11, '30']","Cardiff, Wales, United Kingdom","Cardiff, Wales, CF, United Kingdom","('51n4817', '3w1792')",<flatlib.chart.Chart object at 0x625f0acf8>
Aleksandr_Gordon,r_script-writers,3628,"['1931', 12, '26']","Moscow, Russia","Москва, Центральный федеральный округ, Россия","('55n4792', '37e3273')",<flatlib.chart.Chart object at 0x625f0ad68>
Desmond_Morris,r_script-writers,3629,"['1928', 1, '24']","Purton, United Kingdom","Purton, Gloucestershire, South West England, England, GL13 9HT, United Kingdom","('51n7357', '2w4487')",<flatlib.chart.Chart object at 0x625f0fcf8>
Jack_Snyder,r_script-writers,3630,"['1960', 3, '26']","St. Louis, Missouri, United States","City of Saint Louis, Missouri, United States of America","('38n653', '90w2411')",<flatlib.chart.Chart object at 0x625f14518>
Mikhail_Kalik,r_script-writers,3632,"['1927', 1, '29']","Archangelsko, SSSR","ССС'Р, 21/27, Лесная улица, Старый город, Северодвинск, городской округ Северодвинск, Архангельская область, Северо-Западный федеральный округ, 164521, Россия","('64n5621', '39e8449')",<flatlib.chart.Chart object at 0x625f14e10>
Steven_Karpf,r_script-writers,3633,"['1939', 12, '11']","Jackson, Iowa, United States","Jackson County, Iowa, United States of America","('42n142', '90w548')",<flatlib.chart.Chart object at 0x625f195f8>
Otakar_Hanuš,r_script-writers,3635,"['1890', 3, '31']","Prague, Czech Republic","Praha, okres Hlavní město Praha, Hlavní město Praha, Praha, Česká republika","('50n0875', '14e4213')",<flatlib.chart.Chart object at 0x625f19e80>
Dušan_Kulíšek,r_script-writers,3636,"['1934', 10, '13']","Myjava, Slovakia","Myjava, okres Myjava, Trenčiansky kraj, Západné Slovensko, Slovensko","('48n7541', '17e5765')",<flatlib.chart.Chart object at 0x625f1e5f8>
Leif_Tilden,r_script-writers,3637,"['1964', 3, '20']","Boston, Massachusetts, United States","Boston, Suffolk County, Massachusetts, United States of America","('42n3603', '71w0583')",<flatlib.chart.Chart object at 0x625f1edd8>
Laurent_Delahousse,r_script-writers,3639,"['1969', 8, '30', '20:30']","Croix, France","Croix, Lille, Nord, Hauts-de-France, France métropolitaine, 59170, France","('50n6802', '3e1564')",<flatlib.chart.Chart object at 0x625f1eda0>
Hugo_Gélin,r_script-writers,3641,"['1980', 5, '4']","Paris, France","Paris, Île-de-France, France métropolitaine, France","('48n8567', '2e3515')",<flatlib.chart.Chart object at 0x625f23d68>
Paul_Abbott,r_script-writers,3646,"['1960', 2, '22']","Burnley, England, United Kingdom","Burnley, Lancashire, North West England, England, United Kingdom","('53n7907', '2w2439')",<flatlib.chart.Chart object at 0x626dad518>
Paul_Hough,r_script-writers,3647,"['1974', 8, '4']","London, England, United Kingdom","London, Greater London, England, SW1A 2DX, United Kingdom","('51n5073', '0w1276')",<flatlib.chart.Chart object at 0x626dadd68>
Juraj_Weincziller,r_script-writers,3648,"['1937', 1, '16']","Poprad, Slovakia","Poprad, okres Poprad, Prešovský kraj, Východné Slovensko, Slovensko","('49n0589', '20e3129')",<flatlib.chart.Chart object at 0x626db15f8>
Buddy_Dolan,r_script-writers,3649,"['1964', 7, '1']","Stuttgart, Germany","Stuttgart, Baden-Württemberg, Deutschland","('48n7784', '9e18')",<flatlib.chart.Chart object at 0x626db1d68>
Stellio_Lorenzi,r_script-writers,3650,"['1921', 5, '7', '01:15']","Paris, France","Paris, Île-de-France, France métropolitaine, France","('48n8567', '2e3515')",<flatlib.chart.Chart object at 0x626dade10>
Mikael_Marcimain,r_script-writers,3653,"['1970', 3, '17']","Stockholm, Sweden","Stockholm, Stockholms kommun, Stockholms län, Svealand, 111 29, Sverige","('59n3251', '18e0711')",<flatlib.chart.Chart object at 0x626db5da0>
Karel_Krpata,r_script-writers,3654,"['1900', 10, '18']","Pardubice, Czech Republic","Pardubice, okres Pardubice, Pardubický kraj, Severovýchod, Česká republika","('50n0386', '15e7791')",<flatlib.chart.Chart object at 0x626dbc5f8>
Josef_Kadlec,r_script-writers,3655,"['1919', 10, '21']","Pilsen, Czech Republic","Plzeň, okres Plzeň-město, Plzeňský kraj, Jihozápad, Česká republika","('49n7477', '13e3775')",<flatlib.chart.Chart object at 0x626dbce80>
Aleksandr_Ostrovskiy,r_script-writers,3657,"['1823', 4, '12']","Moscow, Russia","Москва, Центральный федеральный округ, Россия","('55n4792', '37e3273')",<flatlib.chart.Chart object at 0x626dbcdd8>
Ivan_Gariš,r_script-writers,3658,"['1923', 5, '7']","Jihlava, Czech Republic","Jihlava, okres Jihlava, Kraj Vysočina, Jihovýchod, Česká republika","('49n3961', '15e5903')",<flatlib.chart.Chart object at 0x626dc1eb8>
Caroline_Huppert,r_script-writers,3662,"['1950', 10, '28']","Paris, France","Paris, Île-de-France, France métropolitaine, France","('48n8567', '2e3515')",<flatlib.chart.Chart object at 0x626dc1da0>
Travis_Fine,r_script-writers,3663,"['1968', 6, '26']","Atlanta, Georgia, United States","Atlanta, Fulton County, Georgia, United States of America","('33n7491', '84w3902')",<flatlib.chart.Chart object at 0x626dc6dd8>
Malcolm_Marmorstein,r_script-writers,3664,"['1929', 1, '1']","Jersey City, New Jersey, United States","Jersey City, Hudson County, New Jersey, United States of America","('40n7282', '74w0776')",<flatlib.chart.Chart object at 0x626dca5f8>
František_Marvan,r_script-writers,3667,"['1922', 9, '12']",Unknown(?),"Unknown, ሶማሌ ክልል / Somali, Ethiopia","('6n4026', '43e3984')",<flatlib.chart.Chart object at 0x626dcad68>
Jiří_Toman,r_script-writers,3668,"['1924', 3, '22']","Pardubice, Czech Republic","Pardubice, okres Pardubice, Pardubický kraj, Severovýchod, Česká republika","('50n0386', '15e7791')",<flatlib.chart.Chart object at 0x626dce5f8>
Oliver_Stritzel,r_script-writers,3669,"['1957', 3, '9']","Berlin, Germany","Berlin, Deutschland","('52n517', '13e3889')",<flatlib.chart.Chart object at 0x626dce588>
Donald_Rice,r_script-writers,3672,"['1977', 3, '27']","Oxford, England, United Kingdom","Oxford, Oxfordshire, South East, England, United Kingdom","('51n752', '1w2578')",<flatlib.chart.Chart object at 0x626dd2630>
Alena_Vostrá,r_script-writers,3673,"['1938', 5, '17']","Prague, Czech Republic","Praha, okres Hlavní město Praha, Hlavní město Praha, Praha, Česká republika","('50n0875', '14e4213')",<flatlib.chart.Chart object at 0x626dd2e80>
Daniel_Schmid,r_script-writers,3675,"['1941', 12, '26']","Flims-Waldhaus, Switzerland","Flims Waldhaus, Flims, Imboden, Graubünden/Grigioni/Grischun, 7018, Switzerland","('46n8257', '9e2888')",<flatlib.chart.Chart object at 0x626dd2d68>
Fanek_Jilík,r_script-writers,3677,"['1914', 7, '4']","Kunovice, Czech Republic","Kunovice, okres Uherské Hradiště, Zlínský kraj, Střední Morava, 68604, Česká republika","('49n042', '17e4662')",<flatlib.chart.Chart object at 0x626dd9cf8>
Bart_De_Pauw,r_script-writers,3680,"['1968', 5, '28']","Zelzate, Belgium","Zelzate, Oost-Vlaanderen, Vlaanderen, België - Belgique - Belgien","('51n2', '3e8105')",<flatlib.chart.Chart object at 0x626dd95c0>
Vojtěch_Vacke,r_script-writers,3681,"['1940', 3, '18']","Nezabudice, Czech Republic","Nezabudice, okres Rakovník, Středočeský kraj, Střední Čechy, Česká republika","('50n0131', '13e8224')",<flatlib.chart.Chart object at 0x626ddfe80>
Carter_Bays,r_script-writers,3686,"['1975', 8, '12']","Jackson, Iowa, United States","Jackson County, Iowa, United States of America","('42n142', '90w548')",<flatlib.chart.Chart object at 0x626ddfeb8>
Oldřich_Kautský,r_script-writers,3687,"['1906', 4, '20']","Prague, Czech Republic","Praha, okres Hlavní město Praha, Hlavní město Praha, Praha, Česká republika","('50n0875', '14e4213')",<flatlib.chart.Chart object at 0x626de4e80>
Petr_Minařík,r_script-writers,3688,"['1975', 10, '13']",Unknown(?),"Unknown, ሶማሌ ክልል / Somali, Ethiopia","('6n4026', '43e3984')",<flatlib.chart.Chart object at 0x626de8518>
Delia_Ephron,r_script-writers,3691,"['1944', 7, '12']","New York, New York, United States","New York, United States of America","('40n7127', '74w006')",<flatlib.chart.Chart object at 0x626de8ef0>
Mark_Boal,r_script-writers,3693,"['1973', 1, '23']","New York, New York, United States","New York, United States of America","('40n7127', '74w006')",<flatlib.chart.Chart object at 0x626de8dd8>
Axel_Kuschevatzky,r_script-writers,3694,"['1972', 10, '28']","Buenos Aires, Argentina","Buenos Aires, Ciudad Autónoma de Buenos Aires, Argentina","('34s6076', '58w4371')",<flatlib.chart.Chart object at 0x626df1cf8>
Marc_Norman,r_script-writers,3695,"['1941', 2, '10']","Los Angeles, California, United States","Los Angeles, Los Angeles County, California, United States of America","('34n0537', '118w2428')",<flatlib.chart.Chart object at 0x626df55c0>
Alfred_Uhry,r_script-writers,3696,"['1936', 12, '12']","Atlanta, Georgia, United States","Atlanta, Fulton County, Georgia, United States of America","('33n7491', '84w3902')",<flatlib.chart.Chart object at 0x626df5dd8>
Kurt_Luedtke,r_script-writers,3698,"['1939', 9, '28']","Grand Rapids, Michigan, United States","Grand Rapids, Kent County, Michigan, United States of America","('42n9632', '85w6679')",<flatlib.chart.Chart object at 0x626dfa6d8>
Warren_Adler,r_script-writers,3699,"['1927', 12, '16']","New York, New York, United States","New York, United States of America","('40n7127', '74w006')",<flatlib.chart.Chart object at 0x626dfacf8>
Robert_Kirchhoff,r_script-writers,3702,"['1968', 5, '7']",Unknown(?),"Unknown, ሶማሌ ክልል / Somali, Ethiopia","('6n4026', '43e3984')",<flatlib.chart.Chart object at 0x626dfadd8>
Jan_Otčenášek,r_script-writers,3704,"['1924', 11, '19']","Prague, Czech Republic","Praha, okres Hlavní město Praha, Hlavní město Praha, Praha, Česká republika","('50n0875', '14e4213')",<flatlib.chart.Chart object at 0x626dff710>
Magnus_Fiennes,r_script-writers,3705,"['1965', 11, '21']","Anglie, United Kingdom","England, United Kingdom","('52n7955', '0w5402')",<flatlib.chart.Chart object at 0x626e045c0>
Patricia_Highsmith,r_script-writers,3706,"['1921', 1, '19', '03:45']","Fort Worth, United States","Fort Worth, Tarrant County, Texas, United States of America","('32n7532', '97w3327')",<flatlib.chart.Chart object at 0x626e04dd8>
Jack_Whittingham,r_script-writers,3707,"['1910', 8, '2']","Scarborough, United Kingdom","Scarborough, North Yorkshire, Yorkshire and the Humber, England, United Kingdom","('54n282', '0w4012')",<flatlib.chart.Chart object at 0x626e0a630>
Bastian_Günther,r_script-writers,3708,"['1974', 9, '3']","Hachenburg, Germany","Hachenburg, Westerwaldkreis, Rheinland-Pfalz, Deutschland","('50n6628', '7e8253')",<flatlib.chart.Chart object at 0x626e0ad68>
Felix_Herngren,r_script-writers,3709,"['1967', 2, '4']","Stockholm, Sweden","Stockholm, Stockholms kommun, Stockholms län, Svealand, 111 29, Sverige","('59n3251', '18e0711')",<flatlib.chart.Chart object at 0x626e0e630>
René_Pujol,r_script-writers,3710,"['1878', 5, '15']","Bordeaux, France","Bordeaux, Gironde, Nouvelle-Aquitaine, France métropolitaine, 33000, France","('44n8412', '0w58')",<flatlib.chart.Chart object at 0x626e0ecf8>
Alexander_Jacobs,r_script-writers,3711,"['1927', 11, '16']","London, England, United Kingdom","London, Greater London, England, SW1A 2DX, United Kingdom","('51n5073', '0w1276')",<flatlib.chart.Chart object at 0x626e145c0>
Thierry_Jonquet,r_script-writers,3712,"['1954', 1, '19', '19:45']","Paris, France","Paris, Île-de-France, France métropolitaine, France","('48n8567', '2e3515')",<flatlib.chart.Chart object at 0x626e14cf8>
Jiří_Melíšek,r_script-writers,3713,"['1932', 6, '16']","Prague, Czech Republic","Praha, okres Hlavní město Praha, Hlavní město Praha, Praha, Česká republika","('50n0875', '14e4213')",<flatlib.chart.Chart object at 0x626e195f8>
Andrei_Benkendorf,r_script-writers,3714,"['1946', 3, '13']","Moscow, Russia","Москва, Центральный федеральный округ, Россия","('55n4792', '37e3273')",<flatlib.chart.Chart object at 0x626e19e10>
Marcel_Barrena,r_script-writers,3715,"['1981', 10, '15']","Barcelona, Spain","Barcelona, Barcelonès, Barcelona, Catalunya, 08001, España","('41n3829', '2e1774')",<flatlib.chart.Chart object at 0x626e19d68>
Derek_Humphry,r_script-writers,3717,"['1930', 4, '29']","Bath, United Kingdom","Bath, Bath and North East Somerset, South West England, England, United Kingdom","('51n3814', '2w3597')",<flatlib.chart.Chart object at 0x626e1ed30>
Bryan_Buckley,r_script-writers,3719,"['1963', 9, '3']","Boston, Massachusetts, United States","Boston, Suffolk County, Massachusetts, United States of America","('42n3603', '71w0583')",<flatlib.chart.Chart object at 0x626e235f8>
Fernando_Eiras,r_script-writers,3720,"['1957', 2, '21']","Rio de Janeiro, Brazil","Rio de Janeiro, Região Geográfica Imediata do Rio de Janeiro, Região Metropolitana do Rio de Janeiro, Região Geográfica Intermediária do Rio de Janeiro, Rio de Janeiro, Região Sudeste, Brasil","('22s911', '43w2094')",<flatlib.chart.Chart object at 0x626e235c0>
William_Harrison,r_script-writers,3721,"['1933', 10, '29']","Dallas, Texas, United States","Dallas, Dallas County, Texas, United States of America","('32n7763', '96w7969')",<flatlib.chart.Chart object at 0x626e275c0>
Alla_Surikova,r_script-writers,3722,"['1940', 11, '6']","Kiev, Ukraine","Київ, Україна","('50n45', '30e5241')",<flatlib.chart.Chart object at 0x626e27588>
Erika_Grediaga,r_script-writers,3724,"['1974', 9, '25']","Mexico City, Mexico","Ciudad de México, Cuauhtémoc, Ciudad de México, 06060, México","('19n4326', '99w1332')",<flatlib.chart.Chart object at 0x626e2c748>
Miloslav_Fábera,r_script-writers,3725,"['1912', 7, '15']","Pilsen, Czech Republic","Plzeň, okres Plzeň-město, Plzeňský kraj, Jihozápad, Česká republika","('49n7477', '13e3775')",<flatlib.chart.Chart object at 0x626e2ce80>
JB_Smoove,r_script-writers,3726,"['1964', 12, '16']","Plymouth, North Carolina, United States","Plymouth, Washington County, North Carolina, 27962, United States of America","('35n8668', '76w7486')",<flatlib.chart.Chart object at 0x626e785c0>
Miloš_Noll,r_script-writers,3727,"['1926', 8, '11']","Prague, Czech Republic","Praha, okres Hlavní město Praha, Hlavní město Praha, Praha, Česká republika","('50n0875', '14e4213')",<flatlib.chart.Chart object at 0x626e78e80>
Lance_Tracy,r_script-writers,3728,"['1971', 8, '23']","Oregon City, Oregon, United States","Oregon City, Clackamas County, Oregon, 97045, United States of America","('45n3573', '122w6068')",<flatlib.chart.Chart object at 0x626e7e5c0>
Tatsumi_Kumashiro,r_script-writers,3729,"['1927', 4, '24']","Saga, Japan","佐賀県 (Saga Prefecture), 日本 (Japan)","('33n2185', '130e1297')",<flatlib.chart.Chart object at 0x626e7ee48>
Karel_Fabián,r_script-writers,3730,"['1912', 6, '21']","Prague, Czech Republic","Praha, okres Hlavní město Praha, Hlavní město Praha, Praha, Česká republika","('50n0875', '14e4213')",<flatlib.chart.Chart object at 0x626e845f8>
Kat_Candler,r_script-writers,3731,"['1974', 11, '11']","Atlanta, Georgia, United States","Atlanta, Fulton County, Georgia, United States of America","('33n7491', '84w3902')",<flatlib.chart.Chart object at 0x626e84dd8>
Mark_Lund,r_script-writers,3732,"['1965', 6, '6']","Holden, United States","Holden, Johnson County, Missouri, United States of America","('38n7142', '93w9913')",<flatlib.chart.Chart object at 0x626e885f8>
Jens_Dahl,r_script-writers,3734,"['1961', 1, '9']","Copenhagen, Denmark","København, Københavns Kommune, Region Hovedstaden, 1357, Danmark","('55n6867', '12e5701')",<flatlib.chart.Chart object at 0x626e88eb8>
František_Živný,r_script-writers,3735,"['1927', 2, '5']","Pilsen, Czech Republic","Plzeň, okres Plzeň-město, Plzeňský kraj, Jihozápad, Česká republika","('49n7477', '13e3775')",<flatlib.chart.Chart object at 0x626e8d630>
Leonid_Kvinikhidze,r_script-writers,3736,"['1937', 12, '21']","Saint Petersburg, Russia","Санкт-Петербург, Северо-Западный федеральный округ, 190000, Россия","('59n9607', '30e1587')",<flatlib.chart.Chart object at 0x626e8de10>
Ben_York_Jones,r_script-writers,3740,"['1984', 2, '11']","Englewood, New Jersey, United States","Englewood, Bergen County, New Jersey, 07361, United States of America","('40n8929', '73w9726')",<flatlib.chart.Chart object at 0x626e88e10>
Lubomir_Levitski,r_script-writers,3741,"['1980', 9, '17']","Verkhovyna, Ukraine","Верховина, Верховинський район, Івано-Франківська область, 78700, Україна","('48n1538', '24e8279')",<flatlib.chart.Chart object at 0x626e92d30>
Ricardo_Alventosa,r_script-writers,3743,"['1937', 10, '31']","Buenos Aires, Argentina","Buenos Aires, Ciudad Autónoma de Buenos Aires, Argentina","('34s6076', '58w4371')",<flatlib.chart.Chart object at 0x626e97630>
Didier_Van_Cauwelaert,r_script-writers,3744,"['1960', 7, '29', '21:20']","Nice, France","Nice, Alpes-Maritimes, Provence-Alpes-Côte d'Azur, France métropolitaine, France","('43n7009', '7e2684')",<flatlib.chart.Chart object at 0x626e97550>
Stephen_J._Rivele,r_script-writers,3745,"['1949', 5, '6']",Unknown(?),"Unknown, ሶማሌ ክልል / Somali, Ethiopia","('6n4026', '43e3984')",<flatlib.chart.Chart object at 0x626e9b518>
Alice_Hoffman,r_script-writers,3746,"['1952', 3, '16']","New York, New York, United States","New York, United States of America","('40n7127', '74w006')",<flatlib.chart.Chart object at 0x626e9bcf8>
Aleksandr_Stefanovich,r_script-writers,3747,"['1944', 12, '13']","Saint Petersburg, Russia","Санкт-Петербург, Северо-Западный федеральный округ, 190000, Россия","('59n9607', '30e1587')",<flatlib.chart.Chart object at 0x626e9bd68>
Gordon_Cotler,r_script-writers,3748,"['1923', 6, '4']","New York, New York, United States","New York, United States of America","('40n7127', '74w006')",<flatlib.chart.Chart object at 0x626e9fd68>
Dorothy_Uhnak,r_script-writers,3749,"['1930', 4, '24']","New York, New York, United States","New York, United States of America","('40n7127', '74w006')",<flatlib.chart.Chart object at 0x626ea75c0>
Howard_Fast,r_script-writers,3750,"['1914', 11, '11']","New York, New York, United States","New York, United States of America","('40n7127', '74w006')",<flatlib.chart.Chart object at 0x626ea7cf8>
Eugenio_Mira,r_script-writers,3752,"['1977', 9, '23']","Castalla, Spain","Castalla, l'Alcoià, Alacant / Alicante, Comunitat Valenciana, 03420, España","('38n5957', '0w6703')",<flatlib.chart.Chart object at 0x626ea7dd8>
Saara_Cantell,r_script-writers,3754,"['1968', 4, '27']",Unknown(?),"Unknown, ሶማሌ ክልል / Somali, Ethiopia","('6n4026', '43e3984')",<flatlib.chart.Chart object at 0x626eac588>
Stephan_Lacant,r_script-writers,3755,"['1972', 9, '9']","Essen, Germany","Essen, Nordrhein-Westfalen, Deutschland","('51n4582', '7e0158')",<flatlib.chart.Chart object at 0x626eacdd8>
Paul_Sloan,r_script-writers,3756,"['1970', 3, '29']","Jackson, Iowa, United States","Jackson County, Iowa, United States of America","('42n142', '90w548')",<flatlib.chart.Chart object at 0x626eb0e10>
Chuck_Hustmyre,r_script-writers,3757,"['1963', 11, '22']","Baton Rouge, Louisiana, United States","Baton Rouge, East Baton Rouge Parish, Louisiana, United States of America","('30n446', '91w1874')",<flatlib.chart.Chart object at 0x626eb4518>
Paco_Leon,r_script-writers,3759,"['1974', 10, '4']","Seville, Spain","Sevilla, Andalucía, España","('37n3886', '5w9953')",<flatlib.chart.Chart object at 0x626eb4d68>
Francesco_Bruni,r_script-writers,3761,"['1961', 9, '30']","Livorno, Italy","Livorno, Toscana, Italia","('42n7902', '10e3403')",<flatlib.chart.Chart object at 0x626eb0d68>
Zack_Whedon,r_script-writers,3763,"['1979', 8, '14']","Jackson, Iowa, United States","Jackson County, Iowa, United States of America","('42n142', '90w548')",<flatlib.chart.Chart object at 0x626f45e10>
Aldo_von_Pinelli,r_script-writers,3765,"['1913', 9, '11']","Cervaro, Italy","Cervaro, Teramo, Abruzzo, 64043, Italia","('42n5821', '13e4754')",<flatlib.chart.Chart object at 0x626f45e80>
Bernhard_Buchbinder,r_script-writers,3767,"['1854', 7, '6']","Budapest, Hungary","Budapest, Közép-Magyarország, Magyarország","('47n4814', '19e1461')",<flatlib.chart.Chart object at 0x626f49eb8>
J._R._Reher,r_script-writers,3770,"['1978', 1, '30']","Minneapolis, Minnesota, United States","Minneapolis, Hennepin County, Minnesota, United States of America","('44n9773', '93w2655')",<flatlib.chart.Chart object at 0x626f50748>
Hana_Prošková,r_script-writers,3772,"['1924', 11, '30']","Prague, Czech Republic","Praha, okres Hlavní město Praha, Hlavní město Praha, Praha, Česká republika","('50n0875', '14e4213')",<flatlib.chart.Chart object at 0x626f50e80>
Mykhailo_Illienko,r_script-writers,3773,"['1947', 6, '29']","Moscow, Russia","Москва, Центральный федеральный округ, Россия","('55n4792', '37e3273')",<flatlib.chart.Chart object at 0x626f50dd8>
Ilya_Gurin,r_script-writers,3774,"['1922', 7, '9']","Kharkiv, Ukraine","Харків, Шевченківський район, Харківська міська рада, Харківська область, Україна","('49n9903', '36e2304')",<flatlib.chart.Chart object at 0x626f53eb8>
Haya_Harareet,r_script-writers,3775,"['1931', 9, '20']","Haifa, Israel","חיפה, מחוז חיפה, ישראל","('32n8191', '34e9984')",<flatlib.chart.Chart object at 0x626f53e10>
Mahdi_Fleifel,r_script-writers,3776,"['1979', 10, '25']",Unknown(?),"Unknown, ሶማሌ ክልል / Somali, Ethiopia","('6n4026', '43e3984')",<flatlib.chart.Chart object at 0x626f59588>
Charles_Amberg,r_script-writers,3777,"['1894', 12, '8']","Bonn, Germany","Bonn, Nordrhein-Westfalen, 53111, Deutschland","('50n7359', '7e1007')",<flatlib.chart.Chart object at 0x626f59d68>
Henri_Verdun,r_script-writers,3779,"['1895', 8, '9']","Paris, France","Paris, Île-de-France, France métropolitaine, France","('48n8567', '2e3515')",<flatlib.chart.Chart object at 0x626f5cd68>
Franco_Giraldi,r_script-writers,3780,"['1931', 7, '11']","Comeno, Italy","Colle S. Comeno, Cassino, Frosinone, Italia","('41n5036', '13e8055')",<flatlib.chart.Chart object at 0x626f5ce48>
Aleksandr_Kuznetsov,r_script-writers,3781,"['1935', 5, '21']","Moscow, Russia","Москва, Центральный федеральный округ, Россия","('55n4792', '37e3273')",<flatlib.chart.Chart object at 0x626f63e80>
Rolando_Ravello,r_script-writers,3782,"['1969', 6, '4']","Rome, Italy","Roma, Roma Capitale, Italia","('41n8933', '12e4829')",<flatlib.chart.Chart object at 0x626f63e10>
Vitaliy_Manskiy,r_script-writers,3783,"['1963', 12, '2']","Lvov, Ukraine","Львів, Галицький район, Львівська міська рада, Львівська область, Україна","('49n842', '24e0316')",<flatlib.chart.Chart object at 0x626f695c0>
Nicola_von_Altenstadt,r_script-writers,3784,"['1965', 8, '8']","Cologne, Germany","Köln, Nordrhein-Westfalen, Deutschland","('50n9384', '6e96')",<flatlib.chart.Chart object at 0x626f69e10>
Sebastián_Lelio,r_script-writers,3785,"['1974', 3, '8']","Santiago, Chile","Santiago, Provincia de Santiago, Región Metropolitana de Santiago, Chile","('33s4378', '70w6504')",<flatlib.chart.Chart object at 0x626f6d630>
Patrick_Hamilton,r_script-writers,3786,"['1904', 3, '17']","Hassocks, United Kingdom","Hassocks, West Sussex, South East, England, BN6, United Kingdom","('50n9243', '0w1453')",<flatlib.chart.Chart object at 0x626f725c0>
Nana_Ekvtimishvili,r_script-writers,3788,"['1978', 7, '9']","Tbilisi, Georgia","თბილისი, 0136, Georgia / საქართველო","('41n6935', '44e8014')",<flatlib.chart.Chart object at 0x626f72e10>
Stefan_Aust,r_script-writers,3789,"['1946', 7, '1']","Stade, Germany","Stade, Niedersachsen, Deutschland","('53n5998', '9e4754')",<flatlib.chart.Chart object at 0x626f72dd8>
Tomáš_Durdík,r_script-writers,3791,"['1951', 1, '24']","Prague, Czech Republic","Praha, okres Hlavní město Praha, Hlavní město Praha, Praha, Česká republika","('50n0875', '14e4213')",<flatlib.chart.Chart object at 0x626f77e80>
Pierre_Colombier,r_script-writers,3792,"['1896', 3, '18', '17:30']","Compigne, France","Compiègne, Oise, Hauts-de-France, France métropolitaine, 60200, France","('49n4179', '2e8263')",<flatlib.chart.Chart object at 0x626f77dd8>
Genrikh_Gabai,r_script-writers,3793,"['1923', 10, '6']","Moscow, Russia","Москва, Центральный федеральный округ, Россия","('55n4792', '37e3273')",<flatlib.chart.Chart object at 0x626f7ceb8>
Petr_Kolečko,r_script-writers,3794,"['1984', 3, '28']",Unknown(?),"Unknown, ሶማሌ ክልል / Somali, Ethiopia","('6n4026', '43e3984')",<flatlib.chart.Chart object at 0x626f7f518>
Derrick_Sims,r_script-writers,3795,"['1985', 2, '11']","Kingsland, Arkansas, United States","Kingsland, Arkansas, United States of America","('33n8584', '92w294')",<flatlib.chart.Chart object at 0x626f7fcf8>
Fernando_Cerchio,r_script-writers,3796,"['1914', 8, '7']","Luserna San Giovanni, Italy","Luserna San Giovanni, Torino, Piemonte, 10062, Italia","('44n8154', '7e2513')",<flatlib.chart.Chart object at 0x626f7fdd8>
