name,occupation,count,birthtime,birthplace,location,point,chart
Guy_Casaril,r_script-writers,2286,"['1933', 11, '1']","Miramont-de-Guyenne, France","Miramont-de-Guyenne, Marmande, Lot-et-Garonne, Nouvelle-Aquitaine, France métropolitaine, 47800, France","('44n6042', '0e3594')",<flatlib.chart.Chart object at 0x625da3b70>
Karel_Cop,r_script-writers,2288,"['1930', 10, '14']","Prague, Czech Republic","Praha, okres Hlavní město Praha, Hlavní město Praha, Praha, Česká republika","('50n0875', '14e4213')",<flatlib.chart.Chart object at 0x625da8390>
Eduard_Pergner,r_script-writers,2289,"['1935', 12, '19']","Sobotka, Czech Republic","Sobotka, okres Jičín, Královéhradecký kraj, Severovýchod, 50743, Česká republika","('50n4671', '15e1722')",<flatlib.chart.Chart object at 0x625dad3c8>
Mark_Jones,r_script-writers,2290,"['1953', 1, '17']","Los Angeles, California, United States","Los Angeles, Los Angeles County, California, United States of America","('34n0537', '118w2428')",<flatlib.chart.Chart object at 0x625dadba8>
Brian_Thompson,r_script-writers,2291,"['1959', 8, '28']","Ellensburg, United States","Ellensburg, Kittitas County, Washington, 98926, United States of America","('46n9971', '120w5451')",<flatlib.chart.Chart object at 0x625db2390>
Andrey_Nekrasov,r_script-writers,2292,"['1957', 2, '26']","Saint Petersburg, Russia","Санкт-Петербург, Северо-Западный федеральный округ, 190000, Россия","('59n9607', '30e1587')",<flatlib.chart.Chart object at 0x625db2be0>
Nikolaj_Arcel,r_script-writers,2293,"['1972', 8, '25']","Copenhagen, Denmark","København, Københavns Kommune, Region Hovedstaden, 1357, Danmark","('55n6867', '12e5701')",<flatlib.chart.Chart object at 0x625db63c8>
František_A._Dvořák,r_script-writers,2294,"['1908', 8, '5']","Prague, Czech Republic","Praha, okres Hlavní město Praha, Hlavní město Praha, Praha, Česká republika","('50n0875', '14e4213')",<flatlib.chart.Chart object at 0x625db6c88>
Jan_Verheyen,r_script-writers,2296,"['1963', 3, '18']","Temse, Belgium","Temse, Oost-Vlaanderen, Vlaanderen, België - Belgique - Belgien","('51n1254', '4e2133')",<flatlib.chart.Chart object at 0x625db6be0>
Bonnie_Wright,r_script-writers,2297,"['1991', 2, '17']","London, England, United Kingdom","London, Greater London, England, SW1A 2DX, United Kingdom","('51n5073', '0w1276')",<flatlib.chart.Chart object at 0x625dbcac8>
Vladimír_Valenta,r_script-writers,2299,"['1923', 5, '28']","Prague, Czech Republic","Praha, okres Hlavní město Praha, Hlavní město Praha, Praha, Česká republika","('50n0875', '14e4213')",<flatlib.chart.Chart object at 0x625e1c400>
Goffredo_Alessandrini,r_script-writers,2302,"['1904', 9, '9']","Cairo, Egypt","القاهرة, محافظة القاهرة, Egypt / مصر","('30n0488', '31e2437')",<flatlib.chart.Chart object at 0x625e1cc88>
Lukas_Nola,r_script-writers,2309,"['1964', 3, '31']","Zagreb, Croatia","Zagreb, Grad Zagreb, Hrvatska","('45n8132', '15e977')",<flatlib.chart.Chart object at 0x625e1cbe0>
Amat_Escalante,r_script-writers,2310,"['1979', 2, '28']","Barcelona, Spain","Barcelona, Barcelonès, Barcelona, Catalunya, 08001, España","('41n3829', '2e1774')",<flatlib.chart.Chart object at 0x625e21ac8>
Jan_Jílek,r_script-writers,2313,"['1933', 11, '24']","Dlouhomilov, Czech Republic","Dlouhomilov, okres Šumperk, Olomoucký kraj, Střední Morava, Česká republika","('49n9069', '16e9913')",<flatlib.chart.Chart object at 0x625e253c8>
Jane_Bradbury,r_script-writers,2316,"['1974', 1, '1']","Irsko, Ireland",Ireland,"('52n8652', '7w9795')",<flatlib.chart.Chart object at 0x625e25cf8>
František_Uldrich,r_script-writers,2317,"['1936', 5, '1']","Prague, Czech Republic","Praha, okres Hlavní město Praha, Hlavní město Praha, Praha, Česká republika","('50n0875', '14e4213')",<flatlib.chart.Chart object at 0x625e2b400>
Miguel_Alcantud,r_script-writers,2318,"['1971', 3, '12']","Cartagena, Spain","Cartagena, Campo de Cartagena y Mar Menor, Región de Murcia, España","('37n6268', '1w0006')",<flatlib.chart.Chart object at 0x625e2bac8>
Nanouk_Leopold,r_script-writers,2319,"['1968', 7, '25']","Rotterdam, Netherlands","Rotterdam, Zuid-Holland, Nederland","('51n9229', '4e4632')",<flatlib.chart.Chart object at 0x625e25358>
Miloš_Tomić,r_script-writers,2320,"['1976', 2, '5']","Belgrade, Serbia","Београд, Град Београд, Централна Србија, 11000, Србија (Serbia)","('44n8178', '20e4569')",<flatlib.chart.Chart object at 0x625e30c88>
Jiří_Reichl,r_script-writers,2322,"['1940', 4, '13']",Unknown(?),"Unknown, ሶማሌ ክልል / Somali, Ethiopia","('6n4026', '43e3984')",<flatlib.chart.Chart object at 0x625e352e8>
Patrick_Rotman,r_script-writers,2324,"['1949', 2, '17']",Unknown(?),"Unknown, ሶማሌ ክልል / Somali, Ethiopia","('6n4026', '43e3984')",<flatlib.chart.Chart object at 0x625e35358>
Vojtěch_Ron,r_script-writers,2326,"['1930', 11, '26']","Turnov, Czech Republic","Turnov, okres Semily, Liberecký kraj, Severovýchod, 51101, Česká republika","('50n5872', '15e1503')",<flatlib.chart.Chart object at 0x625e30cc0>
Ed_Gass-Donnelly,r_script-writers,2329,"['1977', 8, '17']","Toronto, Ontario, Canada","Toronto, Golden Horseshoe, Ontario, M5H 2N2, Canada","('43n6535', '79w3839')",<flatlib.chart.Chart object at 0x625e39c50>
Werner_Hedman,r_script-writers,2331,"['1926', 4, '6']","Copenhagen, Denmark","København, Københavns Kommune, Region Hovedstaden, 1357, Danmark","('55n6867', '12e5701')",<flatlib.chart.Chart object at 0x625e394a8>
Filip_Jan_Rymsza,r_script-writers,2334,"['1977', 12, '29']","Olecko, Poland","Olecko, gmina Olecko, powiat olecki, województwo warmińsko-mazurskie, 19-401, Polska","('54n0398', '22e4934')",<flatlib.chart.Chart object at 0x625e3fb70>
Giulio_Antamoro,r_script-writers,2335,"['1877', 7, '1']","m, Italy","Gschnofer Stall, Langfenn - Lavenna, Mölten - Meltina, Salten-Schlern - Salto-Sciliar, Bolzano - Bozen, Trentino-Alto Adige/Südtirol, 39010, Italia","('46n568', '11e2819')",<flatlib.chart.Chart object at 0x625e3fc18>
Aleksandr_Tatarskiy,r_script-writers,2336,"['1950', 12, '11']","Kyjev, Ukraine","Київ, Україна","('50n45', '30e5241')",<flatlib.chart.Chart object at 0x625e44390>
Wallace_Langham,r_script-writers,2337,"['1965', 3, '11']","Fort Worth, Texas, United States","Fort Worth, Tarrant County, Texas, United States of America","('32n7532', '97w3327')",<flatlib.chart.Chart object at 0x625e49390>
Bohuslav_Blažek,r_script-writers,2339,"['1942', 10, '18']","Prague, Czech Republic","Praha, okres Hlavní město Praha, Hlavní město Praha, Praha, Česká republika","('50n0875', '14e4213')",<flatlib.chart.Chart object at 0x625e49c50>
Peter_Del_Monte,r_script-writers,2340,"['1943', 7, '26']","San Francisko, United States","San Francisco, San Francisco City and County, California, United States of America","('37n779', '122w4199')",<flatlib.chart.Chart object at 0x625e4e2e8>
Eduardo_Manzanos_Brochero,r_script-writers,2341,"['1919', 11, '10']","Madrid, Spain","Madrid, Área metropolitana de Madrid y Corredor del Henares, Comunidad de Madrid, 28001, España","('40n4167', '3w7036')",<flatlib.chart.Chart object at 0x625e4eac8>
Jonathan_Groff,r_script-writers,2346,"['1985', 3, '26']","Lancaster, Pennsylvania, United States","Lancaster County, Pennsylvania, United States of America","('40n0807', '76w2411')",<flatlib.chart.Chart object at 0x625e534e0>
Georges_Rouquier,r_script-writers,2349,"['1909', 6, '23', '20:51']","Lunel-Viel, France","Lunel-Viel, Montpellier, Hérault, Occitanie, France métropolitaine, 34400, France","('43n6779', '4e0902')",<flatlib.chart.Chart object at 0x625e533c8>
Robert_Kramer,r_script-writers,2350,"['1939', 6, '22']","New York, New York, United States","New York, United States of America","('40n7127', '74w006')",<flatlib.chart.Chart object at 0x625e58390>
Carmelo_Bene,r_script-writers,2351,"['1937', 9, '1', '09:30']","Campi Salentina, Italy","Campi Salentina, Lecce, Puglia, 73012, Italia","('40n3985', '18e0183')",<flatlib.chart.Chart object at 0x625e58c88>
Edgar_Reitz,r_script-writers,2352,"['1932', 11, '1']","Morbach, Germany","Morbach, Landkreis Bernkastel-Wittlich, Rheinland-Pfalz, 54497, Deutschland","('49n8103', '7e1242')",<flatlib.chart.Chart object at 0x625e58b70>
Tanner_Beard,r_script-writers,2354,"['1984', 9, '16']","Snyder, Texas, United States","Snyder, Scurry County, Texas, United States of America","('32n7179', '100w9176')",<flatlib.chart.Chart object at 0x625e61c18>
Roger_Lim,r_script-writers,2355,"['1968', 6, '4']","San Francisco, California, United States","San Francisco, San Francisco City and County, California, United States of America","('37n779', '122w4199')",<flatlib.chart.Chart object at 0x625e652e8>
Stelvio_Massi,r_script-writers,2356,"['1929', 3, '26']","Civitanova Marche, Italy","Civitanova Marche, Macerata, Marche, Italia","('43n3055', '13e7229')",<flatlib.chart.Chart object at 0x625e65c50>
Thomas_Dekker,r_script-writers,2357,"['1987', 12, '28']","Las Vegas, Nevada, United States","Las Vegas, Clark County, Nevada, United States of America","('36n1673', '115w1485')",<flatlib.chart.Chart object at 0x625e6b390>
Jan_Cechl,r_script-writers,2359,"['1978', 8, '22']",Unknown(?),"Unknown, ሶማሌ ክልል / Somali, Ethiopia","('6n4026', '43e3984')",<flatlib.chart.Chart object at 0x625e6b358>
Jodi_Long,r_script-writers,2361,"['1954', 1, '1']","New York, New York, United States","New York, United States of America","('40n7127', '74w006')",<flatlib.chart.Chart object at 0x625e6bba8>
Hans_Billian,r_script-writers,2363,"['1918', 4, '15']","Breslau, Germany","Breslaustraße, Alsenberg, Hof, Bayern, 95028, Deutschland","('50n3146', '11e9353')",<flatlib.chart.Chart object at 0x625e6fb70>
Garrett_Palmer,r_script-writers,2367,"['1997', 9, '27']","San Ramon, United States","San Ramon, Contra Costa County, California, United States of America","('37n7799', '121w978')",<flatlib.chart.Chart object at 0x625e6fb00>
Vladimir_Alenikov,r_script-writers,2368,"['1948', 8, '7']","Saint Petersburg, Russia","Санкт-Петербург, Северо-Западный федеральный округ, 190000, Россия","('59n9607', '30e1587')",<flatlib.chart.Chart object at 0x625e74b00>
Regina_Russell,r_script-writers,2370,"['1965', 9, '2']","Charleston, South Carolina, United States","Charleston, Charleston County, South Carolina, United States of America","('32n7876', '79w9403')",<flatlib.chart.Chart object at 0x625e74c18>
Ruth_Jones,r_script-writers,2371,"['1966', 9, '22']","Bridgend, United Kingdom","Bridgend, Mid Glamorgan, Wales, CF31 1BZ, United Kingdom","('51n505', '3w5757')",<flatlib.chart.Chart object at 0x625e78b70>
Joanna_Angel,r_script-writers,2374,"['1980', 12, '25']","New York, New York, United States","New York, United States of America","('40n7127', '74w006')",<flatlib.chart.Chart object at 0x625e7d390>
Nikolay_Olyalin,r_script-writers,2375,"['1941', 5, '22']","Opikhalino, Russia","Опихалино, Новленское сельское поселение, Вологодский район, Вологодская область, Северо-Западный федеральный округ, Россия","('59n5752', '39e0457')",<flatlib.chart.Chart object at 0x625e7dbe0>
Florin_Piersic_Jr.,r_script-writers,2376,"['1968', 7, '18']","Bucharest, Romania","București, Municipiul București, 010051, România","('44n4361', '26e1027')",<flatlib.chart.Chart object at 0x625e853c8>
Michael_Sucsy,r_script-writers,2379,"['1973', 2, '14', '13:12']","New York, New York, United States","New York, United States of America","('40n7127', '74w006')",<flatlib.chart.Chart object at 0x625e85ac8>
Maggie_Peren,r_script-writers,2384,"['1974', 5, '7']","Heidelberg, Germany","Heidelberg, Baden-Württemberg, 69120, Deutschland","('49n4094', '8e6947')",<flatlib.chart.Chart object at 0x625e85ba8>
Karel_Smrž,r_script-writers,2386,"['1897', 4, '19']",CZSK,"XDA Developers (CZ+SK), Námestie Slobody, Vranov nad Topľou, Prešovský kraj, Východné Slovensko, 093 01, Slovensko","('48n8929', '21e6794')",<flatlib.chart.Chart object at 0x625e89b00>
Michael_Feifer,r_script-writers,2390,"['1968', 9, '11']","New York, New York, United States","New York, United States of America","('40n7127', '74w006')",<flatlib.chart.Chart object at 0x625e8e3c8>
Ivan_Maksimov,r_script-writers,2393,"['1958', 11, '19']","Moscow, Russia","Москва, Центральный федеральный округ, Россия","('55n4792', '37e3273')",<flatlib.chart.Chart object at 0x625e8eb00>
Jacques_Poitrenaud,r_script-writers,2394,"['1922', 5, '22', '00:30']","Lille, France","Lille, Nord, Hauts-de-France, France métropolitaine, France","('50n6366', '3e0635')",<flatlib.chart.Chart object at 0x625e8eb70>
Gene_Roddenberry,r_script-writers,2395,"['1921', 8, '19', '01:35']","El Paso, Texas, United States","El Paso, El Paso County, Texas, United States of America","('31n7754', '106w4646')",<flatlib.chart.Chart object at 0x625e92ba8>
Christian_E._Christiansen,r_script-writers,2396,"['1972', 12, '14']","Kalundborg, Denmark","Kalundborg, Kalundborg Kommune, Region Sjælland, 4400, Danmark","('55n6834', '11e0994')",<flatlib.chart.Chart object at 0x625e963c8>
Aida_Zyablikova,r_script-writers,2397,"['1940', 3, '16']","Luhansk, Ukraine","Луганськ, Ленінський район, Луганська міська рада, Луганська область, Україна","('48n5717', '39e2973')",<flatlib.chart.Chart object at 0x625e96c50>
Garry_Trudeau,r_script-writers,2399,"['1948', 7, '21']","New York, New York, United States","New York, United States of America","('40n7127', '74w006')",<flatlib.chart.Chart object at 0x625e9c518>
Mikhail_Brashinskiy,r_script-writers,2400,"['1965', 5, '10']","Saint Petersburg, Russia","Санкт-Петербург, Северо-Западный федеральный округ, 190000, Россия","('59n9607', '30e1587')",<flatlib.chart.Chart object at 0x625e9cbe0>
Vytautas_Zalakevicius,r_script-writers,2401,"['1930', 4, '14']","Kaunas, Lithuania","Kaunas, Kauno miesto savivaldybė, Kauno apskritis, Lietuva","('54n8982', '23e9045')",<flatlib.chart.Chart object at 0x625f6d3c8>
Claudia_Llosa,r_script-writers,2402,"['1976', 11, '15']","Lima, Peru","Lima, Peru","('12s0621', '77w0365')",<flatlib.chart.Chart object at 0x625f6db70>
Niels_Arden_Oplev,r_script-writers,2405,"['1961', 3, '26']","Holstebro, Denmark","Holstebro, Holstebro Kommune, Region Midtjylland, 7500, Danmark","('56n359', '8e6159')",<flatlib.chart.Chart object at 0x625f703c8>
Seth_MacFarlane,r_script-writers,2407,"['1973', 10, '26']","Kent, United States","Kent County, Texas, United States of America","('33n1665', '100w7846')",<flatlib.chart.Chart object at 0x625f70cf8>
Pierre_Chenal,r_script-writers,2408,"['1904', 12, '5', '05:35']","Brussels, Belgium","Bruxelles / Brussel, Ville de Bruxelles - Stad Brussel, Région de Bruxelles-Capitale - Brussels Hoofdstedelijk Gewest, België - Belgique - Belgien","('50n8437', '4e3674')",<flatlib.chart.Chart object at 0x625f70cc0>
Rachel_Dratch,r_script-writers,2409,"['1966', 2, '22']","Cambridge, Massachusetts, United States","Cambridge, Middlesex County, Massachusetts, United States of America","('42n3751', '71w1056')",<flatlib.chart.Chart object at 0x625f77ba8>
Alice_Lowe,r_script-writers,2411,"['1977', 4, '1']","Bolton, England, United Kingdom","Bolton, Greater Manchester, North West England, England, BL1 1RU, United Kingdom","('53n5783', '2w43')",<flatlib.chart.Chart object at 0x625f78438>
Adam_Dubin,r_script-writers,2412,"['1964', 1, '10']","New York, New York, United States","New York, United States of America","('40n7127', '74w006')",<flatlib.chart.Chart object at 0x625f78ac8>
Kirk_Hammett,r_script-writers,2413,"['1962', 11, '18', '02:54']","San Francisco, California, United States","San Francisco, San Francisco City and County, California, United States of America","('37n779', '122w4199')",<flatlib.chart.Chart object at 0x625f802e8>
Greta_Gerwig,r_script-writers,2414,"['1983', 8, '4']","Sacramento, California, United States","Sacramento, Sacramento County, California, United States of America","('38n5816', '121w4944')",<flatlib.chart.Chart object at 0x625f80be0>
Danny_McBride,r_script-writers,2416,"['1976', 12, '29']","Statesboro, United States","Statesboro, Bulloch County, Georgia, United States of America","('32n449', '81w7833')",<flatlib.chart.Chart object at 0x625f86358>
Patrick_Breen,r_script-writers,2417,"['1960', 10, '26']","New York, New York, United States","New York, United States of America","('40n7127', '74w006')",<flatlib.chart.Chart object at 0x625f86ac8>
Philippe_Setbon,r_script-writers,2418,"['1957', 11, '28']","Paris, France","Paris, Île-de-France, France métropolitaine, France","('48n8567', '2e3515')",<flatlib.chart.Chart object at 0x625f86b38>
Bruno_Podalydès,r_script-writers,2419,"['1961', 3, '11']","Boulogne-Billancourt, France","Boulogne-Billancourt, Hauts-de-Seine, Île-de-France, France métropolitaine, 92100, France","('48n8357', '2e2402')",<flatlib.chart.Chart object at 0x625f8dac8>
Iva_Hercíková,r_script-writers,2420,"['1935', 11, '2']","Pardubice, Czech Republic","Pardubice, okres Pardubice, Pardubický kraj, Severovýchod, Česká republika","('50n0386', '15e7791')",<flatlib.chart.Chart object at 0x625f91400>
Hans_H._Zerlett,r_script-writers,2421,"['1892', 8, '17']","Wiesbaden, Germany","Wiesbaden, Hessen, 65183, Deutschland","('50n082', '8e2417')",<flatlib.chart.Chart object at 0x625f91be0>
Dimitar_Mitovski,r_script-writers,2423,"['1964', 8, '1']","Plovdiv, Bulgaria","Пловдив, 4000, България","('42n1419', '24e7499')",<flatlib.chart.Chart object at 0x625f953c8>
Bongkoj_Khongmalai,r_script-writers,2424,"['1985', 4, '15']","Thajsko, Thailand",ประเทศไทย,"('14n8972', '100e8327')",<flatlib.chart.Chart object at 0x625f95c18>
John_Lutz,r_script-writers,2425,"['1973', 4, '23']","Pipestone, Minnesota, United States","Pipestone County, Minnesota, United States of America","('44n027', '96w2567')",<flatlib.chart.Chart object at 0x625f9b2e8>
David_Chase,r_script-writers,2426,"['1945', 8, '22']","Mount Vernon, New York, United States","Mount Vernon, Westchester County, New York, 10550, United States of America","('40n9126', '73w8371')",<flatlib.chart.Chart object at 0x625f9bba8>
Robert_Nelson,r_script-writers,2428,"['1930', 3, '1']","San Francisco, California, United States","San Francisco, San Francisco City and County, California, United States of America","('37n779', '122w4199')",<flatlib.chart.Chart object at 0x625fa02e8>
Tomáš_Holeček,r_script-writers,2429,"['1979', 4, '12']",Unknown(?),"Unknown, ሶማሌ ክልል / Somali, Ethiopia","('6n4026', '43e3984')",<flatlib.chart.Chart object at 0x625fa0390>
Mariusz_Wilczynski,r_script-writers,2432,"['1960', 4, '29']","d, Poland","Kolonia D, Osieck, gmina Osieck, powiat otwocki, województwo mazowieckie, 08-445, Polska","('51n9788', '21e4115')",<flatlib.chart.Chart object at 0x625fa0ba8>
Robert_Drew,r_script-writers,2433,"['1924', 2, '15']","Toledo, Ohio, United States","Toledo, Lucas County, Ohio, United States of America","('41n6787', '83w5127')",<flatlib.chart.Chart object at 0x625fa4ac8>
Liisa_Helminen,r_script-writers,2434,"['1950', 2, '15']","Turku, Finland","Turku, Turun seutukunta, Varsinais-Suomi, Manner-Suomi, Suomi","('60n4518', '22e2671')",<flatlib.chart.Chart object at 0x625fa93c8>
Jon_Ronson,r_script-writers,2435,"['1967', 5, '10']","Cardiff, Wales, United Kingdom","Cardiff, Wales, CF, United Kingdom","('51n4817', '3w1792')",<flatlib.chart.Chart object at 0x625fa9ac8>
Anurag_Kashyap,r_script-writers,2436,"['1972', 9, '10']","Gorakhpur, India","Gorakhpur, Uttar Pradesh, India","('26n6713', '83e3646')",<flatlib.chart.Chart object at 0x62611f400>
Forry_Smith,r_script-writers,2440,"['1952', 12, '1']","Waterloo, Iowa, United States","Waterloo, Iowa, United States of America","('42n498', '92w333')",<flatlib.chart.Chart object at 0x62611fc18>
Lutz_Dammbeck,r_script-writers,2441,"['1948', 10, '17']","Leipzig, Germany","Leipzig, Sachsen, 04109, Deutschland","('51n3406', '12e3747')",<flatlib.chart.Chart object at 0x62611fb70>
Nicolas_Boukhrief,r_script-writers,2446,"['1963', 6, '4']","Antibes, France","Antibes, Grasse, Alpes-Maritimes, Provence-Alpes-Côte d'Azur, France métropolitaine, France","('43n5836', '7e109')",<flatlib.chart.Chart object at 0x626124b38>
Joe_Shaw,r_script-writers,2447,"['1972', 11, '15']","London, England, United Kingdom","London, Greater London, England, SW1A 2DX, United Kingdom","('51n5073', '0w1276')",<flatlib.chart.Chart object at 0x626129390>
Pietro_Francisci,r_script-writers,2448,"['1906', 9, '9']","Rome, Italy","Roma, Roma Capitale, Italia","('41n8933', '12e4829')",<flatlib.chart.Chart object at 0x626129c88>
Zack_Parker,r_script-writers,2451,"['1978', 7, '25']","Richmond, Indiana, United States","Richmond, Wayne County, Indiana, 47374, United States of America","('39n8287', '84w8899')",<flatlib.chart.Chart object at 0x62612d438>
Steve_McQueen,r_script-writers,2452,"['1969', 10, '9']","London, England, United Kingdom","London, Greater London, England, SW1A 2DX, United Kingdom","('51n5073', '0w1276')",<flatlib.chart.Chart object at 0x62612db38>
Peter_Lilienthal,r_script-writers,2453,"['1929', 11, '27']","Berlin, Germany","Berlin, Deutschland","('52n517', '13e3889')",<flatlib.chart.Chart object at 0x62612db70>
Jacques_Nolot,r_script-writers,2454,"['1943', 8, '31', '03:00']","Marciac, France","Marciac, Mirande, Gers, Occitanie, France métropolitaine, 32230, France","('43n5241', '0e1612')",<flatlib.chart.Chart object at 0x626134ac8>
Jonathan_Blitstein,r_script-writers,2456,"['1982', 10, '28']",Unknown(?),"Unknown, ሶማሌ ክልል / Somali, Ethiopia","('6n4026', '43e3984')",<flatlib.chart.Chart object at 0x626134c88>
Jonas_Elmer,r_script-writers,2457,"['1966', 3, '14']","Holstebro, Denmark","Holstebro, Holstebro Kommune, Region Midtjylland, 7500, Danmark","('56n359', '8e6159')",<flatlib.chart.Chart object at 0x62613ac50>
Katie_Boland,r_script-writers,2458,"['1988', 2, '14']","Toronto, Ontario, Canada","Toronto, Golden Horseshoe, Ontario, M5H 2N2, Canada","('43n6535', '79w3839')",<flatlib.chart.Chart object at 0x62613aba8>
Masahiro_Kobayashi,r_script-writers,2459,"['1954', 1, '6']","Tokyo, Japan","東京都, 日本 (Japan)","('35n6828', '139e7595')",<flatlib.chart.Chart object at 0x626140c50>
Nick_Swardson,r_script-writers,2460,"['1976', 10, '9']","Minneapolis, Minnesota, United States","Minneapolis, Hennepin County, Minnesota, United States of America","('44n9773', '93w2655')",<flatlib.chart.Chart object at 0x6261453c8>
Donna_D'Errico,r_script-writers,2461,"['1968', 3, '30']","Dothan, Alabama, United States","Dothan, Houston County, Alabama, United States of America","('31n2237', '85w3934')",<flatlib.chart.Chart object at 0x626145ba8>
Stefano_Bessoni,r_script-writers,2462,"['1965', 9, '14']","Rome, Italy","Roma, Roma Capitale, Italia","('41n8933', '12e4829')",<flatlib.chart.Chart object at 0x626145b70>
Brendan_Cowles,r_script-writers,2463,"['1969', 7, '23']","Burbank, California, United States","Burbank, Los Angeles County, California, United States of America","('34n1816', '118w3259')",<flatlib.chart.Chart object at 0x626149ba8>
Joanna_Zólkowska,r_script-writers,2464,"['1950', 3, '6']","Siedlce, Poland","Siedlce, województwo mazowieckie, Polska","('52n1616', '22e2813')",<flatlib.chart.Chart object at 0x62614e400>
Philippe_Claudel,r_script-writers,2465,"['1962', 2, '2']","Dombasle-sur-Meurthe, France","Dombasle-sur-Meurthe, Nancy, Meurthe-et-Moselle, Grand Est, France métropolitaine, 54110, France","('48n6231', '6e3494')",<flatlib.chart.Chart object at 0x62614eb38>
Světlana_Lazarová,r_script-writers,2468,"['1963', 11, '21']","Plovdiv, Bulgaria","Пловдив, 4000, България","('42n1419', '24e7499')",<flatlib.chart.Chart object at 0x6261523c8>
Kristen_Schaal,r_script-writers,2471,"['1978', 1, '24']","Longmont, United States","Longmont, Boulder County, Colorado, United States of America","('40n1672', '105w1019')",<flatlib.chart.Chart object at 0x626152ba8>
Steven_Tsapelas,r_script-writers,2473,"['1981', 3, '8']","New York, New York, United States","New York, United States of America","('40n7127', '74w006')",<flatlib.chart.Chart object at 0x6261573c8>
Isti_Madarász,r_script-writers,2474,"['1976', 11, '16']","Miskolc, Hungary","Miskolc, Miskolci járás, Borsod-Abaúj-Zemplén megye, Észak-Magyarország, Alföld és Észak, Magyarország","('48n1032', '20e7902')",<flatlib.chart.Chart object at 0x626157c50>
Dante_Lam,r_script-writers,2482,"['1965', 5, '11']","Hong Kong, Hong Kong","香港 Hong Kong, 中西區 Central and Western District, 香港島 Hong Kong Island, 香港 Hong Kong, 999077, China 中国","('22n2793', '114e1628')",<flatlib.chart.Chart object at 0x626152358>
James_Ellroy,r_script-writers,2486,"['1948', 3, '4']","Los Angeles, California, United States","Los Angeles, Los Angeles County, California, United States of America","('34n0537', '118w2428')",<flatlib.chart.Chart object at 0x626306cc0>
Katell_Quillevere,r_script-writers,2487,"['1980', 1, '30']","Abidjan, Ivory Coast","Abidjan, 01 BP 2325 ABIDJAN 01, Côte d'Ivoire","('5n3204', '4w0161')",<flatlib.chart.Chart object at 0x62630b4a8>
Steve_McNicholas,r_script-writers,2489,"['1955', 8, '11']","Wakefield, United Kingdom","Wakefield, Yorkshire and the Humber, England, United Kingdom","('53n683', '1w4967')",<flatlib.chart.Chart object at 0x62630bcf8>
Marina_de_Van,r_script-writers,2490,"['1971', 8, '2']","Paris, France","Paris, Île-de-France, France métropolitaine, France","('48n8567', '2e3515')",<flatlib.chart.Chart object at 0x62630bc50>
Stefan_Holtz,r_script-writers,2492,"['1973', 10, '4']","Mnichov, Germany","München, Bayern, Deutschland","('48n1371', '11e5754')",<flatlib.chart.Chart object at 0x626311b70>
