name,occupation,count,birthtime,birthplace,location,point,chart
J._H._Wyman,r_script-writers,1090,"['1967', 1, '5']","Oakland, California, United States","Oakland, Alameda County, California, United States of America","('37n8045', '122w2714')",<flatlib.chart.Chart object at 0x62708d5f8>
Bai_Ling,r_script-writers,1091,"['1966', 10, '10']","cheng-tu, China","恩城乡, 大新县, 崇左市, 广西壮族自治区, China 中国","('22n7405', '107e0915')",<flatlib.chart.Chart object at 0x62708de48>
Joyce_Chopra,r_script-writers,1092,"['1936', 10, '27']",Unknown(?),"Unknown, ሶማሌ ክልል / Somali, Ethiopia","('6n4026', '43e3984')",<flatlib.chart.Chart object at 0x62706f518>
Nicolas_Gessner,r_script-writers,1093,"['1931', 8, '17']","Budapest, Hungary","Budapest, Közép-Magyarország, Magyarország","('47n4814', '19e1461')",<flatlib.chart.Chart object at 0x62706fe80>
Luke_Greenfield,r_script-writers,1094,"['1972', 2, '5']","Manhasset, New York, United States","Manhasset, North Hempstead, Nassau County, New York, 11030, United States of America","('40n7846', '73w6971')",<flatlib.chart.Chart object at 0x6270905f8>
Hiroyuki_Okiura,r_script-writers,1095,"['1966', 10, '13']","Osaka, Japan","大阪府, 日本 (Japan)","('34n6199', '135e4904')",<flatlib.chart.Chart object at 0x627090e48>
Maurizio_Ponzi,r_script-writers,1097,"['1939', 5, '8']","Rome, Italy","Roma, Roma Capitale, Italia","('41n8933', '12e4829')",<flatlib.chart.Chart object at 0x627090da0>
Tex_Avery,r_script-writers,1099,"['1908', 2, '26']","Taylor, United States","Taylor County, Texas, United States of America","('32n2793', '99w8813')",<flatlib.chart.Chart object at 0x627080e10>
Martin_Benson,r_script-writers,1100,"['1918', 8, '10']","London, England, United Kingdom","London, Greater London, England, SW1A 2DX, United Kingdom","('51n5073', '0w1276')",<flatlib.chart.Chart object at 0x6270a0b00>
David_Butler,r_script-writers,1101,"['1894', 12, '17']","San Francisco, California, United States","San Francisco, San Francisco City and County, California, United States of America","('37n779', '122w4199')",<flatlib.chart.Chart object at 0x6270a0b38>
Pierre_Granier-Deferre,r_script-writers,1102,"['1927', 7, '22', '05:00']","Paris, France","Paris, Île-de-France, France métropolitaine, France","('48n8567', '2e3515')",<flatlib.chart.Chart object at 0x6270a02b0>
Ron_Krauss,r_script-writers,1103,"['1970', 12, '28']","New York, New York, United States","New York, United States of America","('40n7127', '74w006')",<flatlib.chart.Chart object at 0x62709dcf8>
Robert_Morley,r_script-writers,1104,"['1908', 5, '26']","Semley, Wiltshire, United Kingdom","Semley, Wiltshire, South West England, England, SP7 9AU, United Kingdom","('51n0414', '2w1563')",<flatlib.chart.Chart object at 0x6270a25c0>
Michael_A._Nickles,r_script-writers,1106,"['1968', 3, '26']","Syracuse, New York, United States","Syracuse, Onondaga County, New York, United States of America","('43n0481', '76w1474')",<flatlib.chart.Chart object at 0x6270a2e48>
Robert_Stevenson,r_script-writers,1107,"['1905', 3, '31']","Buxton, United Kingdom","Buxton, Station Road, Cowdale, High Peak, Derbyshire, East Midlands, England, SK17 6AH, United Kingdom","('53n2608', '1w9131')",<flatlib.chart.Chart object at 0x625bfe5c0>
Danny_Bilson,r_script-writers,1108,"['1956', 7, '26']","Los Angeles, California, United States","Los Angeles, Los Angeles County, California, United States of America","('34n0537', '118w2428')",<flatlib.chart.Chart object at 0x625bfedd8>
Jean_Chapot,r_script-writers,1110,"['1930', 11, '15']","Rouen, France","Rouen, Seine-Maritime, Normandie, France métropolitaine, France","('49n4405', '1e094')",<flatlib.chart.Chart object at 0x625bfed68>
Claude_Miller,r_script-writers,1111,"['1942', 2, '20', '00:50']","Paris, France","Paris, Île-de-France, France métropolitaine, France","('48n8567', '2e3515')",<flatlib.chart.Chart object at 0x625c02cf8>
Philip_Saville,r_script-writers,1112,"['1930', 10, '28']","London, England, United Kingdom","London, Greater London, England, SW1A 2DX, United Kingdom","('51n5073', '0w1276')",<flatlib.chart.Chart object at 0x625bfd5c0>
Pupi_Avati,r_script-writers,1113,"['1938', 11, '3', '23:15']","Bologna, Italy","Bologna, Emilia-Romagna, Italia","('44n4937', '11e343')",<flatlib.chart.Chart object at 0x625bfdd68>
Bruno_Corbucci,r_script-writers,1114,"['1931', 10, '23']","Rome, Italy","Roma, Roma Capitale, Italia","('41n8933', '12e4829')",<flatlib.chart.Chart object at 0x625bfdda0>
James_Dearden,r_script-writers,1115,"['1949', 9, '14']","London, England, United Kingdom","London, Greater London, England, SW1A 2DX, United Kingdom","('51n5073', '0w1276')",<flatlib.chart.Chart object at 0x625beecf8>
Philippe_Muyl,r_script-writers,1116,"['1943', 5, '30']","Lille, France","Lille, Nord, Hauts-de-France, France métropolitaine, France","('50n6366', '3e0635')",<flatlib.chart.Chart object at 0x625beedd8>
Gregg_Araki,r_script-writers,1118,"['1959', 12, '17', '19:21']","Los Angeles, California, United States","Los Angeles, Los Angeles County, California, United States of America","('34n0537', '118w2428')",<flatlib.chart.Chart object at 0x625bf0dd8>
Dominik_Graf,r_script-writers,1120,"['1952', 9, '6']","Munich, Germany","München, Bayern, Deutschland","('48n1371', '11e5754')",<flatlib.chart.Chart object at 0x625bf0da0>
Neil_Mandt,r_script-writers,1122,"['1969', 8, '25']","New York, New York, United States","New York, United States of America","('40n7127', '74w006')",<flatlib.chart.Chart object at 0x625bf1d30>
Trevor_Nunn,r_script-writers,1123,"['1940', 1, '14']","Ipswich, England, United Kingdom","Ipswich, Suffolk, East of England, England, United Kingdom","('52n0579', '1e1526')",<flatlib.chart.Chart object at 0x625be6550>
Timo_Torikka,r_script-writers,1125,"['1958', 2, '1']","Kerava, Finland","Kerava, Helsingin seutukunta, Uusimaa, Manner-Suomi, Suomi","('60n4034', '25e1041')",<flatlib.chart.Chart object at 0x625be6cf8>
Mary_McGuckian,r_script-writers,1126,"['1965', 5, '27']","Irsko, Ireland",Ireland,"('52n8652', '7w9795')",<flatlib.chart.Chart object at 0x625bdd5c0>
Bart_Freundlich,r_script-writers,1127,"['1970', 1, '17']","New York, New York, United States","New York, United States of America","('40n7127', '74w006')",<flatlib.chart.Chart object at 0x625bddcf8>
Andrew_Grieve,r_script-writers,1128,"['1939', 11, '28']","Cardiff, Wales, United Kingdom","Cardiff, Wales, CF, United Kingdom","('51n4817', '3w1792')",<flatlib.chart.Chart object at 0x625bdbb00>
Pekka_Parikka,r_script-writers,1129,"['1939', 5, '2']",Unknown(?),"Unknown, ሶማሌ ክልል / Somali, Ethiopia","('6n4026', '43e3984')",<flatlib.chart.Chart object at 0x625bdbb38>
Yves_Boisset,r_script-writers,1131,"['1939', 3, '14', '06:45']","Paris, France","Paris, Île-de-France, France métropolitaine, France","('48n8567', '2e3515')",<flatlib.chart.Chart object at 0x625bdb240>
Edward_Buzzell,r_script-writers,1132,"['1895', 11, '13']","New York, New York, United States","New York, United States of America","('40n7127', '74w006')",<flatlib.chart.Chart object at 0x625bd4cf8>
Terence_Davies,r_script-writers,1133,"['1945', 11, '10']","Liverpool, England, United Kingdom","Liverpool, North West England, England, United Kingdom","('53n4072', '2w9917')",<flatlib.chart.Chart object at 0x625bd0b00>
Marina_Foïs,r_script-writers,1134,"['1970', 1, '21', '05:10']","Boulogne-Billancourt, France","Boulogne-Billancourt, Hauts-de-Seine, Île-de-France, France métropolitaine, 92100, France","('48n8357', '2e2402')",<flatlib.chart.Chart object at 0x625bd0358>
Matthias_Glasner,r_script-writers,1135,"['1965', 1, '20']","Hamburg, Germany","Hamburg, Deutschland","('53n5438', '10e0099')",<flatlib.chart.Chart object at 0x625bd4d68>
Richard_T._Heffron,r_script-writers,1136,"['1930', 10, '6']","Chicago, Illinois, United States","Chicago, Cook County, Illinois, United States of America","('41n8756', '87w6244')",<flatlib.chart.Chart object at 0x625bd1e10>
Olivier_Megaton,r_script-writers,1137,"['1965', 8, '6']","Versailles, France","Versailles, Yvelines, Île-de-France, France métropolitaine, 78000, France","('48n8035', '2e1267')",<flatlib.chart.Chart object at 0x625bd1dd8>
Sergei_Parajanov,r_script-writers,1138,"['1924', 1, '9']","Tbilisi, Georgia","თბილისი, 0136, Georgia / საქართველო","('41n6935', '44e8014')",<flatlib.chart.Chart object at 0x625bcaeb8>
Oliver_Parker,r_script-writers,1139,"['1960', 9, '6']","London, England, United Kingdom","London, Greater London, England, SW1A 2DX, United Kingdom","('51n5073', '0w1276')",<flatlib.chart.Chart object at 0x6283275f8>
Zdeněk_Smetana,r_script-writers,1140,"['1925', 6, '26']","Prague, Czech Republic","Praha, okres Hlavní město Praha, Hlavní město Praha, Praha, Česká republika","('50n0875', '14e4213')",<flatlib.chart.Chart object at 0x628327e80>
Paul_Weiland,r_script-writers,1141,"['1953', 7, '11']","Bolton, England, United Kingdom","Bolton, Greater Manchester, North West England, England, BL1 1RU, United Kingdom","('53n5783', '2w43')",<flatlib.chart.Chart object at 0x62831f5c0>
Antonio_Mayans,r_script-writers,1143,"['1939', 5, '4']","Valencia, Spain","València, Comarca de València, València / Valencia, Comunitat Valenciana, España","('39n4699', '0w376')",<flatlib.chart.Chart object at 0x62831fe80>
Wolfgang_Murnberger,r_script-writers,1144,"['1960', 11, '13']","Wiener Neustadt, Austria","Gemeinde Wiener Neustadt, Statutarstadt Wiener Neustadt, Niederösterreich, Österreich","('47n8087', '16e237')",<flatlib.chart.Chart object at 0x62831ff28>
Andrey_Zvyagintsev,r_script-writers,1146,"['1964', 2, '6']","Novosibirsk, SSSR","АО Птицефабрика имени 50-летия СССР, Прокудский сельсовет, Коченёвский район, Новосибирская область, Сибирский федеральный округ, Россия","('55n0039', '82e4818')",<flatlib.chart.Chart object at 0x62833ceb8>
Maurizio_Casagrande,r_script-writers,1149,"['1961', 11, '4']","Naples, Italy","Napoli, Campania, Italia","('40n8359', '14e2488')",<flatlib.chart.Chart object at 0x62833ce10>
Gary_Graver,r_script-writers,1150,"['1938', 7, '20']","Portland, Oregon, United States","Portland, Multnomah County, Oregon, 97204, United States of America","('45n5202', '122w6742')",<flatlib.chart.Chart object at 0x62833ddd8>
Kim_Rossi_Stuart,r_script-writers,1152,"['1969', 10, '31']","Rome, Italy","Roma, Roma Capitale, Italia","('41n8933', '12e4829')",<flatlib.chart.Chart object at 0x62833dda0>
Larry_Charles,r_script-writers,1154,"['1956', 2, '20']","New York, New York, United States","New York, United States of America","('40n7127', '74w006')",<flatlib.chart.Chart object at 0x628331cf8>
Christian_de_Chalonge,r_script-writers,1155,"['1937', 1, '21', '23:30']","Douai, France","Douai, Nord, Hauts-de-France, France métropolitaine, 59500, France","('50n3676', '3e0805')",<flatlib.chart.Chart object at 0x628331dd8>
Boris_Rytsarev,r_script-writers,1157,"['1930', 6, '30']","Moscow, Russia","Москва, Центральный федеральный округ, Россия","('55n4792', '37e3273')",<flatlib.chart.Chart object at 0x62833b588>
Jerry_Ciccoritti,r_script-writers,1158,"['1956', 8, '5']","Toronto, Ontario, Canada","Toronto, Golden Horseshoe, Ontario, M5H 2N2, Canada","('43n6535', '79w3839')",<flatlib.chart.Chart object at 0x62833beb8>
René_Clair,r_script-writers,1159,"['1898', 11, '11', '14:00']","Paris, France","Paris, Île-de-France, France métropolitaine, France","('48n8567', '2e3515')",<flatlib.chart.Chart object at 0x62833acf8>
Kim_Henkel,r_script-writers,1160,"['1946', 1, '19']","Virginia, United States","Virginia, United States of America","('37n1232', '78w4928')",<flatlib.chart.Chart object at 0x6283325c0>
Michael_McDonald,r_script-writers,1162,"['1964', 12, '31']","Fullerton, California, United States","Fullerton, Orange County, California, United States of America","('33n8708', '117w9294')",<flatlib.chart.Chart object at 0x628332e48>
Hal_Roach,r_script-writers,1163,"['1892', 1, '14']","Elmira, New York, United States","Elmira, Chemung County, New York, United States of America","('42n0898', '76w8077')",<flatlib.chart.Chart object at 0x62834b5c0>
David_Swift,r_script-writers,1165,"['1919', 7, '27']","Minneapolis, Minnesota, United States","Minneapolis, Hennepin County, Minnesota, United States of America","('44n9773', '93w2655')",<flatlib.chart.Chart object at 0x62834bdd8>
Robert_Butler,r_script-writers,1171,"['1927', 11, '17']","Los Angeles, California, United States","Los Angeles, Los Angeles County, California, United States of America","('34n0537', '118w2428')",<flatlib.chart.Chart object at 0x62834f5c0>
Lewis_John_Carlino,r_script-writers,1172,"['1932', 1, '1']","New York, New York, United States","New York, United States of America","('40n7127', '74w006')",<flatlib.chart.Chart object at 0x62834fd68>
Aleksandr_Dovzhenko,r_script-writers,1174,"['1894', 9, '11']","Sosnica, Ukraine","Сосниця, Сосницький район, Чернігівська область, 16100, Україна","('51n5245', '32e5029')",<flatlib.chart.Chart object at 0x62834fda0>
Michael_Landon_Jr.,r_script-writers,1175,"['1964', 6, '20']","Los Angeles, California, United States","Los Angeles, Los Angeles County, California, United States of America","('34n0537', '118w2428')",<flatlib.chart.Chart object at 0x628358dd8>
Stephan_Wagner,r_script-writers,1176,"['1968', 11, '15']","Mainz, Germany","Mainz, Rheinland-Pfalz, 55116, Deutschland","('50n0012', '8e2763')",<flatlib.chart.Chart object at 0x628358d68>
Diane_Kurys,r_script-writers,1177,"['1948', 12, '3']","Lyon, France","Lyon, Métropole de Lyon, Circonscription départementale du Rhône, Auvergne-Rhône-Alpes, France métropolitaine, France","('45n7578', '4e832')",<flatlib.chart.Chart object at 0x628354d68>
Sara_Sugarman,r_script-writers,1178,"['1965', 10, '13']","Rhyl, United Kingdom","Rhyl, Denbighshire, Wales, LL18 1RG, United Kingdom","('53n3207', '3w4907')",<flatlib.chart.Chart object at 0x62835a5c0>
Vyacheslav_Kotyonochkin,r_script-writers,1179,"['1927', 6, '20']","Moscow, Russia","Москва, Центральный федеральный округ, Россия","('55n4792', '37e3273')",<flatlib.chart.Chart object at 0x62835ae10>
Paul_Gross,r_script-writers,1180,"['1959', 4, '30']","Calgary, Alberta, Canada","Calgary, Alberta, Canada","('51n0534', '114w0626')",<flatlib.chart.Chart object at 0x6283635c0>
Paul_A._Kaufman,r_script-writers,1182,"['1964', 12, '2']","London, England, United Kingdom","London, Greater London, England, SW1A 2DX, United Kingdom","('51n5073', '0w1276')",<flatlib.chart.Chart object at 0x628363eb8>
Oskar_Roehler,r_script-writers,1184,"['1959', 1, '21']","Starnberg, Germany","Starnberg, Landkreis Starnberg, Bayern, 82319, Deutschland","('48n0001', '11e3509')",<flatlib.chart.Chart object at 0x628363dd8>
Bob_Balaban,r_script-writers,1187,"['1945', 8, '16']","Chicago, Illinois, United States","Chicago, Cook County, Illinois, United States of America","('41n8756', '87w6244')",<flatlib.chart.Chart object at 0x628367e10>
Gustaf_Skarsgård,r_script-writers,1188,"['1980', 11, '12']","Stockholm, Sweden","Stockholm, Stockholms kommun, Stockholms län, Svealand, 111 29, Sverige","('59n3251', '18e0711')",<flatlib.chart.Chart object at 0x62836c5f8>
Darren_Stein,r_script-writers,1189,"['1971', 12, '24']","Los Angeles, California, United States","Los Angeles, Los Angeles County, California, United States of America","('34n0537', '118w2428')",<flatlib.chart.Chart object at 0x62836cdd8>
David_Wain,r_script-writers,1192,"['1969', 8, '1']","Shaker Heights, Ohio, United States","Shaker Heights, Cuyahoga County, Ohio, United States of America","('41n4739', '81w5371')",<flatlib.chart.Chart object at 0x628375748>
Italo_Zingarelli,r_script-writers,1193,"['1930', 1, '15']","Lugo di Romagna, Italy","Lugo, Unione dei comuni della Bassa Romagna, Ravenna, Emilia-Romagna, 48022, Italia","('44n4189', '11e9082')",<flatlib.chart.Chart object at 0x628375e80>
John_Krish,r_script-writers,1195,"['1923', 12, '4']","London, England, United Kingdom","London, Greater London, England, SW1A 2DX, United Kingdom","('51n5073', '0w1276')",<flatlib.chart.Chart object at 0x628375da0>
Fraser_Clarke_Heston,r_script-writers,1197,"['1955', 2, '12', '03:38']","Los Angeles, California, United States","Los Angeles, Los Angeles County, California, United States of America","('34n0537', '118w2428')",<flatlib.chart.Chart object at 0x628377dd8>
Stephanie_Beaton,r_script-writers,1198,"['1972', 7, '16']","Alliance, Ohio, United States","Alliance, Stark County, Ohio, United States of America","('40n9153', '81w1059')",<flatlib.chart.Chart object at 0x62836f5c0>
Charlotte_Sachs_Bostrup,r_script-writers,1199,"['1963', 10, '3']","Holstebro, Denmark","Holstebro, Holstebro Kommune, Region Midtjylland, 7500, Danmark","('56n359', '8e6159')",<flatlib.chart.Chart object at 0x62836feb8>
Dennis_Berry,r_script-writers,1202,"['1944', 8, '11']","Los Angeles, California, United States","Los Angeles, Los Angeles County, California, United States of America","('34n0537', '118w2428')",<flatlib.chart.Chart object at 0x62836fe10>
Jan_Kounen,r_script-writers,1204,"['1964', 5, '2']","Utrecht, Netherlands","Utrecht, Nederland","('52n095', '5e1097')",<flatlib.chart.Chart object at 0x628383588>
Jon_Cryer,r_script-writers,1207,"['1965', 4, '16']","New York, New York, United States","New York, United States of America","('40n7127', '74w006')",<flatlib.chart.Chart object at 0x62838b5f8>
Marion_Davies,r_script-writers,1210,"['1897', 1, '3', '06:00']","New York, New York, United States","New York, United States of America","('40n7127', '74w006')",<flatlib.chart.Chart object at 0x62838be80>
Tina_Fey,r_script-writers,1211,"['1970', 5, '18', '10:42']","Upper Darby, Pennsylvania, United States","Upper Darby, Delaware County, Pennsylvania, United States of America","('39n9284', '75w2738')",<flatlib.chart.Chart object at 0x6283875c0>
Suzanne_Marwille,r_script-writers,1212,"['1895', 7, '11']","Prague, Czech Republic","Praha, okres Hlavní město Praha, Hlavní město Praha, Praha, Česká republika","('50n0875', '14e4213')",<flatlib.chart.Chart object at 0x628387e80>
Fyodor_Khitruk,r_script-writers,1213,"['1917', 5, '1']","Tver, Russia","Тверь, городской округ Тверь, Тверская область, Центральный федеральный округ, Россия","('56n8587', '35e9208')",<flatlib.chart.Chart object at 0x628387dd8>
Ella_Lemhagen,r_script-writers,1215,"['1965', 8, '29', '20:25']","Uppsala, Sweden","Uppsala, Uppsala kommun, Uppsala län, Svealand, 753 20, Sverige","('59n8586', '17e6387')",<flatlib.chart.Chart object at 0x628378e80>
Christopher_Miles,r_script-writers,1216,"['1939', 4, '19']","London, England, United Kingdom","London, Greater London, England, SW1A 2DX, United Kingdom","('51n5073', '0w1276')",<flatlib.chart.Chart object at 0x6283965c0>
Bruno_Šefranka,r_script-writers,1218,"['1928', 11, '29']","Hlohovec, Czech Republic","Hlohovec, okres Břeclav, Jihomoravský kraj, Jihovýchod, 69143, Česká republika","('48n774', '16e7623')",<flatlib.chart.Chart object at 0x628396cf8>
Pascal_Bonitzer,r_script-writers,1220,"['1946', 2, '1', '16:00']","Paris, France","Paris, Île-de-France, France métropolitaine, France","('48n8567', '2e3515')",<flatlib.chart.Chart object at 0x628378dd8>
Frank_Q._Dobbs,r_script-writers,1221,"['1939', 7, '29']","Houston, Texas, United States","Houston, Harris County, Texas, 77002-5902, United States of America","('29n7589', '95w3677')",<flatlib.chart.Chart object at 0x62838edd8>
Luke_Goss,r_script-writers,1222,"['1968', 9, '29', '18:11']","Lewisham, England, United Kingdom","Lewisham, London, Greater London, England, SE13 6BB, United Kingdom","('51n4624', '0w0101')",<flatlib.chart.Chart object at 0x6251905c0>
Just_Jaeckin,r_script-writers,1223,"['1940', 8, '8', '16:00']","Vichy, France","Vichy, Allier, Auvergne-Rhône-Alpes, France métropolitaine, 03200, France","('46n1239', '3e4204')",<flatlib.chart.Chart object at 0x625190d68>
Gene_Lockhart,r_script-writers,1224,"['1891', 7, '18']","London, Ontario, Canada","London, Southwestern Ontario, Ontario, N6A 1G4, Canada","('42n9837', '81w2496')",<flatlib.chart.Chart object at 0x62838eda0>
Rockne_S._O'Bannon,r_script-writers,1226,"['1955', 1, '12']","Los Angeles, California, United States","Los Angeles, Los Angeles County, California, United States of America","('34n0537', '118w2428')",<flatlib.chart.Chart object at 0x6251a5dd8>
Laslo_Benedek,r_script-writers,1227,"['1905', 3, '5']","Budapest, Hungary","Budapest, Közép-Magyarország, Magyarország","('47n4814', '19e1461')",<flatlib.chart.Chart object at 0x625192630>
Peter_Glenville,r_script-writers,1228,"['1913', 10, '28']","London, England, United Kingdom","London, Greater London, England, SW1A 2DX, United Kingdom","('51n5073', '0w1276')",<flatlib.chart.Chart object at 0x625192cf8>
Massimo_Ranieri,r_script-writers,1229,"['1951', 5, '3']","Naples, Italy","Napoli, Campania, Italia","('40n8359', '14e2488')",<flatlib.chart.Chart object at 0x625192dd8>
Tonie_Marshall,r_script-writers,1230,"['1951', 11, '29']","Neuilly-sur-Seine, France","Neuilly-sur-Seine, Arrondissement de Nanterre, Hauts-de-Seine, Île-de-France, France métropolitaine, 92200, France","('48n8847', '2e2696')",<flatlib.chart.Chart object at 0x62519bcf8>
Alexandre_Arcady,r_script-writers,1233,"['1947', 3, '17', '15:00']","Algiers, Algeria","Algiers, Sidi M'Hamed, Alger, 16007, الجزائر","('36n7754', '3e0602')",<flatlib.chart.Chart object at 0x62519be10>
Ludwig_Berger,r_script-writers,1234,"['1892', 1, '6']","Mainz, Germany","Mainz, Rheinland-Pfalz, 55116, Deutschland","('50n0012', '8e2763')",<flatlib.chart.Chart object at 0x6251a2cf8>
Detlev_Buck,r_script-writers,1235,"['1962', 12, '1']","Bad Segeberg, Schleswig-Holstein, Germany","Bad Segeberg, Segeberg, Schleswig-Holstein, 23795, Deutschland","('53n9368', '10e3041')",<flatlib.chart.Chart object at 0x6251a2da0>
Louis_C._K.,r_script-writers,1236,"['1967', 9, '12']","Washington, District of Columbia, United States","Washington, District of Columbia, 20500, United States of America","('38n8949', '77w0366')",<flatlib.chart.Chart object at 0x625196dd8>
Colin_Higgins,r_script-writers,1237,"['1941', 7, '28', '09:30']","Nouma, New Caledonia","Île Nouma, Wero, Province Sud, Nouvelle-Calédonie, France","('22s6289', '167e4178')",<flatlib.chart.Chart object at 0x62517d630>
Laird_Stuart,r_script-writers,1239,"['1954', 4, '15']","Sydney, New South Wales, Australia","Council of the City of Sydney, New South Wales, Australia","('33s8889', '151e2049')",<flatlib.chart.Chart object at 0x62517dd30>
Jim_Van_Bebber,r_script-writers,1240,"['1964', 11, '24']","Greenville, United States","Greenville, Greenville County, South Carolina, United States of America","('34n8514', '82w3985')",<flatlib.chart.Chart object at 0x6251915c0>
Sandra_Nettelbeck,r_script-writers,1241,"['1966', 4, '4']","Hamburg, Germany","Hamburg, Deutschland","('53n5438', '10e0099')",<flatlib.chart.Chart object at 0x625191e48>
Adam_Brooks,r_script-writers,1242,"['1956', 9, '3']","Toronto, Ontario, Canada","Toronto, Golden Horseshoe, Ontario, M5H 2N2, Canada","('43n6535', '79w3839')",<flatlib.chart.Chart object at 0x62517dd68>
Fruit_Chan,r_script-writers,1243,"['1959', 4, '15']","Guangdong, China","广东省, China 中国","('23n1358', '113e1983')",<flatlib.chart.Chart object at 0x62517b208>
Atmen_Kelif,r_script-writers,1244,"['1968', 4, '1']","Albi, France","Albi, Tarn, Occitanie, France métropolitaine, 81000, France","('43n9278', '2e1479')",<flatlib.chart.Chart object at 0x62517b2b0>
Rudolf_Noelte,r_script-writers,1245,"['1921', 3, '20']","Berlin, Germany","Berlin, Deutschland","('52n517', '13e3889')",<flatlib.chart.Chart object at 0x6251775c0>
Jean-Pierre_Améris,r_script-writers,1246,"['1961', 7, '26']","Lyon, France","Lyon, Métropole de Lyon, Circonscription départementale du Rhône, Auvergne-Rhône-Alpes, France métropolitaine, France","('45n7578', '4e832')",<flatlib.chart.Chart object at 0x625177e10>
Joe_Nussbaum,r_script-writers,1247,"['1973', 1, '10']","Jackson, Iowa, United States","Jackson County, Iowa, United States of America","('42n142', '90w548')",<flatlib.chart.Chart object at 0x625182e10>
Donald_Shebib,r_script-writers,1248,"['1938', 1, '17']","Toronto, Ontario, Canada","Toronto, Golden Horseshoe, Ontario, M5H 2N2, Canada","('43n6535', '79w3839')",<flatlib.chart.Chart object at 0x625182dd8>
Jonas_Åkerlund,r_script-writers,1249,"['1965', 11, '16']","Bromma, Sweden","Bromma, Vingåkers kommun, Södermanlands län, Svealand, Sverige","('59n0591', '16e0202')",<flatlib.chart.Chart object at 0x62517ee80>
Hall_Bartlett,r_script-writers,1250,"['1922', 11, '27']","Kansas City, Missouri, United States","Kansas City, Jackson County, Missouri, United States of America","('39n1001', '94w5781')",<flatlib.chart.Chart object at 0x625175b00>
James_Gleason,r_script-writers,1251,"['1882', 5, '23']","New York, New York, United States","New York, United States of America","('40n7127', '74w006')",<flatlib.chart.Chart object at 0x625175358>
Alejandro_Jodorowsky,r_script-writers,1252,"['1929', 2, '7']","Iquique, Chile","Iquique, Provincia de Iquique, Región de Tarapacá, Chile","('20s2141', '70w1525')",<flatlib.chart.Chart object at 0x625b97550>
Natalya_Bondarchuk,r_script-writers,1253,"['1950', 5, '10']","Moscow, Russia","Москва, Центральный федеральный округ, Россия","('55n4792', '37e3273')",<flatlib.chart.Chart object at 0x625b97e10>
Alexandre_Aja,r_script-writers,1254,"['1978', 8, '7']","Paris, France","Paris, Île-de-France, France métropolitaine, France","('48n8567', '2e3515')",<flatlib.chart.Chart object at 0x625175278>
